,Date,Debate Type,Speaker,Sents
485,1-25-16,primary_dem,SANDERS," Look, Hillary Clinton is a very good person."
486,1-25-16,primary_dem,SANDERS,Martin O'Malley is a very decent guy.
487,1-25-16,primary_dem,SANDERS,"So I'm not - you know, this is not a - personal stuff."
488,1-25-16,primary_dem,SANDERS,"It just seems to me that the crises that we face as a country today, and we didn't even get into climate change to a significant degree: inequality, poverty in America, an obscene and unfair campaign finance system."
489,1-25-16,primary_dem,SANDERS,These problems are so serious that we have got to go beyond establishment politics and establishment economics.
490,1-25-16,primary_dem,SANDERS,"In my view we need a political revolution where millions of people stand up and say you know what, that great government of ours belongs to all of us, not just the few."
491,1-25-16,primary_dem,SANDERS,That's why I'm running for president.
492,1-25-16,primary_dem,SANDERS,Thank you.
493,1-25-16,primary_dem,SANDERS,[applause]
494,1-25-16,primary_dem,CUOMO," Sen. Sanders, thank you for taking the opportunity."
495,1-25-16,primary_dem,CUOMO,Good luck to you in the Iowa caucuses next week.
496,1-25-16,primary_dem,CUOMO,"[applause]

All right."
497,1-25-16,primary_dem,CUOMO,Our thanks to Sen. Sanders.
498,1-25-16,primary_dem,CUOMO,"Coming up, Hillary Clinton and Martin O'Malley get their turns on stage."
499,1-25-16,primary_dem,CUOMO,And our audience of Iowa voters is ready with a new slate of questions.
500,1-25-16,primary_dem,CUOMO,Stay with us.
501,1-25-16,primary_dem,CUOMO,"[applause]

[commercial break] [applause]"
502,1-25-16,primary_dem,CUOMO," Welcome back to the CNN Democratic Presidential Town Hall here at Drake University in Des Moines, Iowa."
503,1-25-16,primary_dem,CUOMO,This is the last best chance for the candidates to face Iowa voters and answer their questions directly before they caucus next Monday.
504,1-25-16,primary_dem,CUOMO,"Now, we've heard from Senator Sanders."
505,1-25-16,primary_dem,CUOMO,"In a bit, we're going to hear from Secretary Clinton."
506,1-25-16,primary_dem,CUOMO,"But right now, the floor belongs to former Maryland Governor Martin O'Malley."
507,1-25-16,primary_dem,CUOMO,[applause]
508,1-25-16,primary_dem,CUOMO, Hey.
509,1-25-16,primary_dem,O," Chris, how are you?"
510,1-25-16,primary_dem,CUOMO," Good to see you, Governor."
511,1-25-16,primary_dem,O," Good to see you, too, man."
512,1-25-16,primary_dem,CUOMO, [inaudible].
513,1-25-16,primary_dem,CUOMO,[applause]
514,1-25-16,primary_dem,O, I think.
515,1-25-16,primary_dem,O,Hey.
516,1-25-16,primary_dem,O,[applause]
517,1-25-16,primary_dem,O, Thanks a lot.
518,1-25-16,primary_dem,CUOMO," Have a seat, Gov."
519,1-25-16,primary_dem,CUOMO,[applause]
520,1-25-16,primary_dem,O, Thank you.
521,1-25-16,primary_dem,O,[applause]
522,1-25-16,primary_dem,CUOMO, How you feeling a week out?
523,1-25-16,primary_dem,O, I'm excited.
524,1-25-16,primary_dem,O,It's Iowa Caucus time.
525,1-25-16,primary_dem,O,"And Chris, I've seen this before."
526,1-25-16,primary_dem,O,"Once Iowans get into that decision-making pocket, none of the pollsters back East can tell you how it's going to turn out."
527,1-25-16,primary_dem,O,"[laughter]

And - and... [applause] ...I wish you could be out there with me."
528,1-25-16,primary_dem,O,I have been campaigning the Iowa Caucus way.
529,1-25-16,primary_dem,O,"I've been to over 120 events and getting up on the chair, doing town halls like this."
530,1-25-16,primary_dem,O,And we're seeing larger and larger crowds.
531,1-25-16,primary_dem,O,"And the - the beauty of the people of Iowa is they're not intimidated by polls, they're not intimidated by pundits and they have this birthright, they feel, to upset the apple cart."
532,1-25-16,primary_dem,O,"And with only three of us in this Democratic primary, there's only one of us who can still upset the apple cart."
533,1-25-16,primary_dem,O,"Come on, Iowa, right?"
534,1-25-16,primary_dem,O,[applause]
535,1-25-16,primary_dem,CUOMO," ""The Des Moines Register.""..."
536,1-25-16,primary_dem,CUOMO,"[applause] ...they gave the nomination - their endorsement to Secretary Clinton, OK."
537,1-25-16,primary_dem,CUOMO,They gave their endorsement to her.
538,1-25-16,primary_dem,CUOMO,"In it, they talk about you."
539,1-25-16,primary_dem,CUOMO,"And they say that you are, quote, ""better suited as one of her cabinet secretaries than as president."""
540,1-25-16,primary_dem,CUOMO,What do you want to tell Iowans right now to prove that their state's biggest paper is wrong?
541,1-25-16,primary_dem,O," Yes, well, this - the - this is what I have to say."
542,1-25-16,primary_dem,O,"Look, I'm in this, Chris, to win this."
543,1-25-16,primary_dem,O,I'm running for president of the United States.
544,1-25-16,primary_dem,O,And the reason I'm running is this.
545,1-25-16,primary_dem,O,Our country is facing big challenges.
546,1-25-16,primary_dem,O,And we have deep divisions in our country.
547,1-25-16,primary_dem,O,"And we need a candidate who can actually pull us together, who can heal these divisions, who can get things done."
548,1-25-16,primary_dem,O,That's what I've done all my life.
549,1-25-16,primary_dem,O,I'm not a divider.
550,1-25-16,primary_dem,O,"If I were, I would not have been able to accomplish the things we accomplished in a very troubled city or in our state through a recession."
551,1-25-16,primary_dem,O,"And that's what I believe the people of Iowa are looking for, a president who will move us forward, who will build on the good things that President Obama has done and actually take that job creation legacy and turn it into rising wages again for every American family."
552,1-25-16,primary_dem,O,That's what we need.
553,1-25-16,primary_dem,O,And we need new leadership to do that and break through the gridlock of Washington.
554,1-25-16,primary_dem,CUOMO, You mentioned President Obama.
555,1-25-16,primary_dem,CUOMO,He was speaking this morning about the election a little bit more deeply than he has in the past.
556,1-25-16,primary_dem,CUOMO,And he was doing an analysis of Secretary Clinton and Senator Sanders.
557,1-25-16,primary_dem,CUOMO,And he referred to the senator as kind of this bright shiny new object and that has a fascination for people.
558,1-25-16,primary_dem,CUOMO,"I thought you were supposed to be the bright, shiny new object in this."
559,1-25-16,primary_dem,O, Yes.
560,1-25-16,primary_dem,CUOMO, What happened?
561,1-25-16,primary_dem,O," Well, look, I'm honored to be able to offer my candidacy in the company of Secretary Clinton and Senator Sanders."
562,1-25-16,primary_dem,O,"If you look at our Democratic primary and the debates we've had, we're certainly doing a much better job of speaking to the goodness within our country rather than to fear and anger and loathing like we've heard from Republicans."
563,1-25-16,primary_dem,O,[applause]
564,1-25-16,primary_dem,CUOMO, Are you ready to make a case to the people?
565,1-25-16,primary_dem,O, Yes.
566,1-25-16,primary_dem,O,[applause]
567,1-25-16,primary_dem,CUOMO, All right...
568,1-25-16,primary_dem,O, [inaudible].
569,1-25-16,primary_dem,CUOMO, - let's take a question.
570,1-25-16,primary_dem,CUOMO,"We have Joy Lassen, a student at Iowa State University."
571,1-25-16,primary_dem,CUOMO,She's originally from St. Louis.
572,1-25-16,primary_dem,CUOMO,Her parents work in Ferguson.
573,1-25-16,primary_dem,CUOMO,She says she's undecided.
574,1-25-16,primary_dem,CUOMO,What's your question for the governor?
575,1-25-16,primary_dem,O, Is this Q&A time?
576,1-25-16,primary_dem,O,Am I allowed to stand?
577,1-25-16,primary_dem,CUOMO, You can do whatever you want.
578,1-25-16,primary_dem,O, I'm not capable of doing Q&A in Iowa...
579,1-25-16,primary_dem,CUOMO," Yes, please."
580,1-25-16,primary_dem,O, - from a seat.
581,1-25-16,primary_dem,CUOMO, Wherever you want to do it.
582,1-25-16,primary_dem,O, OK.
583,1-25-16,primary_dem,CUOMO, All right.
584,1-25-16,primary_dem,CUOMO,I'll take [inaudible].
585,1-25-16,primary_dem,CUOMO,"[applause]

[cross-talk]

JOY LASSEN: Good evening."
586,1-25-16,primary_dem,O, Hi.
587,1-25-16,primary_dem,LASSEN, Hi.
588,1-25-16,primary_dem,LASSEN,"Your history as mayor of Baltimore and governor of Maryland show that you pushed for zero tolerance policing and felony punishments for low level drug offenders, which usually affects the black population."
589,1-25-16,primary_dem,LASSEN,How are you planning to ensure racial equality when your history in office contradicts your current platform to fight structural racism?
590,1-25-16,primary_dem,O," Yes, well... [applause] ...Well, look, let's talk about this."
591,1-25-16,primary_dem,O,"In 1999, our city of Baltimore had become the most violent, the most addicted and the most abandoned city in America."
592,1-25-16,primary_dem,O,"And when very few other people would step up who could bring us together and turn it around, I did."
593,1-25-16,primary_dem,O,"And that year, and for about the 12 years leading up to that point, we were burying over 300 young, poor, black men every single year."
594,1-25-16,primary_dem,O,"And, yes, black lives matter."
595,1-25-16,primary_dem,O,"And I told the people of my city look, we did not have to accept the reality of 24/7 drug dealer occupation over our poor neighborhood."
596,1-25-16,primary_dem,O,"When you call from a poor neighborhood for a police service, they should respond the same way that they do in wealthier neighborhoods, black and white."
597,1-25-16,primary_dem,O,There are a lot of things we got right.
598,1-25-16,primary_dem,O,There were a lot of lives that we saved.
599,1-25-16,primary_dem,O,I promise to improve how we police the police.
600,1-25-16,primary_dem,O,We actually did start closing down open air drug markets.
601,1-25-16,primary_dem,O,"And in the course of my executive service both as mayor and as a governor, I never stop searching for the things that work so we can do more of them to save and redeem lives, and the things that don't work so that we can stop doing them."
602,1-25-16,primary_dem,O,So we greatly increased drug treatment.
603,1-25-16,primary_dem,O,We saved hundreds and hundreds of lives from overdose deaths.
604,1-25-16,primary_dem,O,"We started tracking discourtesy, excessive force."
605,1-25-16,primary_dem,O,I drove down use of fatal police-involved - fatal police-involved shootings to three of their four lowest years in Baltimore history.
606,1-25-16,primary_dem,O,"And as governor, I restored voting rights to 52,000 people."
607,1-25-16,primary_dem,O,I repealed as a crime and decriminalized the possession of marijuana.
608,1-25-16,primary_dem,O,I banned the box on people who are applying for state employment.
609,1-25-16,primary_dem,O,"And... [applause]

And not the first time, not the second time, but the third time, by bringing people together, including a few Republican votes, I made my state the first state south of the Mason Dixon Line to repeal the death penalty in America."
610,1-25-16,primary_dem,O,"[applause]

So..."
611,1-25-16,primary_dem,CUOMO, Governor...
612,1-25-16,primary_dem,O," Look, it's hard to appreciate at the time."
613,1-25-16,primary_dem,O,"But one true story, and quickly, Chris..."
614,1-25-16,primary_dem,CUOMO, Right.
615,1-25-16,primary_dem,O," There is a family of seven people, a mom, dad and five kids who in East Baltimore were firebombed in their sleep and killed by a drug dealer."
616,1-25-16,primary_dem,O,And the reason?
617,1-25-16,primary_dem,O,Because they were picking up the phone and calling 911 and asking for relief for their kids from this sort of 24/7 drug dealer occupation.
618,1-25-16,primary_dem,O,"Look, I think all of us have a responsibility."
619,1-25-16,primary_dem,O,I know I feel a responsibility to constantly look for the things that work and the things that don't work.
620,1-25-16,primary_dem,O,By the end of my time as governor we had driven down violent crime to a 30-year low.
621,1-25-16,primary_dem,O,And we had also driven down our incarceration rate to a 20-year low.
622,1-25-16,primary_dem,O,You can do both of them at the same time by doing the things that work.
623,1-25-16,primary_dem,O,[applause]
624,1-25-16,primary_dem,CUOMO," Next question, Dan Conick (ph)."
625,1-25-16,primary_dem,CUOMO,He owns small two businesses in Des Moines.
626,1-25-16,primary_dem,CUOMO,"He says he's leaning toward Bernie Sanders, but he's here to give you a shot."
627,1-25-16,primary_dem,CUOMO,And he has a question.
628,1-25-16,primary_dem,CUOMO,What is it?
629,1-25-16,primary_dem,CUOMO,[laughter]
630,1-25-16,primary_dem,QUESTION, Hello.
631,1-25-16,primary_dem,QUESTION,Yes.
632,1-25-16,primary_dem,QUESTION,I'm a small business owner...
633,1-25-16,primary_dem,O, Tell me your name again.
634,1-25-16,primary_dem,QUESTION, Daniel Conick (ph).
635,1-25-16,primary_dem,QUESTION,And I - you know you run the numbers and you try and figure out OK. Well at the end of the day when you're spending as much on your health care every month as you do your mortgage.
636,1-25-16,primary_dem,QUESTION,What ways would you choose to try to lessen that burden on the middle class and just you know small business owners like myself?
637,1-25-16,primary_dem,O," Look, I think we need to build upon the good things that President Obama has done with the Affordable Care Act."
638,1-25-16,primary_dem,O,But no program ever came into existence in a perfect condition.
639,1-25-16,primary_dem,O,So we have to improve it.
640,1-25-16,primary_dem,O,And one of the ways I think we need to improve it is by covering those high value sort of early out-of-pocket expenses that people are experiencing.
641,1-25-16,primary_dem,O,"What I hear from a lot of folks all over Iowa is that maybe while their premiums have leveled off, they're paying more out-of-pocket, more - and their deductibles are higher."
642,1-25-16,primary_dem,O,"So we need to - we need to push the insurance companies to actually offer products that pay for those early, those first out-of-pocket expenses."
643,1-25-16,primary_dem,O,"But let me take you up to a slightly larger and higher level, and it is this."
644,1-25-16,primary_dem,O,"Look, we need to - we need to change what it is that we actually pay for, to put wellness at the center."
645,1-25-16,primary_dem,O,In my own state we moved all 46 of our acute care hospitals out of fee-for-service and started paying them global payment for all of their Medicare and Medicaid patients.
646,1-25-16,primary_dem,O,Why?
647,1-25-16,primary_dem,O,"Because the biggest driver of your high health insurance costs, and throughout our country, is the hospital costs at the center."
648,1-25-16,primary_dem,O,"And we told our hospitals that if you reduce avoidable hospital readmissions, you can share in those savings."
649,1-25-16,primary_dem,O,"And the New England Journal of Medicine did an article about four weeks ago and said I'll be damned, it actually works."
650,1-25-16,primary_dem,O,"[laughter]

We can dial up wellness."
651,1-25-16,primary_dem,O,We can reduce the expense here.
652,1-25-16,primary_dem,O,"And that's the future, I believe."
653,1-25-16,primary_dem,O,And every state has a role to play in moving that way because clearly we're still paying too much for health insurance.
654,1-25-16,primary_dem,O,Our system's called an all-payer system.
655,1-25-16,primary_dem,O,We have a rate-setting commission.
656,1-25-16,primary_dem,O,And we're able to replace the institutional profitability.
657,1-25-16,primary_dem,O,"I mean, the hospitals aren't going bankrupt by any means, but we're able to put wellness at the center."
658,1-25-16,primary_dem,O,And that's what we need to do as a country to bring down the high cost of health care.
659,1-25-16,primary_dem,O,[applause]
660,1-25-16,primary_dem,CUOMO," Thank you, Daniel."
661,1-25-16,primary_dem,CUOMO,"Another question for you, Gov."
662,1-25-16,primary_dem,CUOMO,"Jenna Bishop, she's from Drake University."
663,1-25-16,primary_dem,CUOMO,She says she's undecided on which candidate she's supporting.
664,1-25-16,primary_dem,CUOMO,And she has a question about young voters for you.
665,1-25-16,primary_dem,O," Well, it's still early, there are six days."
666,1-25-16,primary_dem,O,"[laughter]

JENNA BISHOP: Hi, Governor."
667,1-25-16,primary_dem,O,I'm 23 years old.
668,1-25-16,primary_dem,O,"And I care about a lot of issues, other than just the cost of college."
669,1-25-16,primary_dem,O,So I'd like to know what issue you think should be most important to young voters and why.
670,1-25-16,primary_dem,O, Thank you.
671,1-25-16,primary_dem,O,Great question.
672,1-25-16,primary_dem,O,I have put forward a plan for debt-free college within the next five years.
673,1-25-16,primary_dem,O,"And as the one candidate among the three of us with 15 years of executive experience, we went four years in a row in my state without a penny's increase to college tuition."
674,1-25-16,primary_dem,O,"So you can check out my plan for that on my Web site, martinomalley.com."
675,1-25-16,primary_dem,O,But you know what I believe is the biggest issue that I think you should be concerned about as a young person who has more time on this planet than I do?
676,1-25-16,primary_dem,O,And that is climate change.
677,1-25-16,primary_dem,O,"[applause]

Climate change is the greatest business opportunity to come to the United States in 100 years."
678,1-25-16,primary_dem,O,"And I am the first candidate in either party to put forward a plan to move us to a 100 percent clean electric energy grid by 2050, and create 5 million jobs along the way."
679,1-25-16,primary_dem,O,"And this is another one of those instances, Chris, where Iowa is pointing the way forward."
680,1-25-16,primary_dem,O,Look at what you have already done in your state.
681,1-25-16,primary_dem,O,"Thirty to 35 percent of your energy now comes from clean Iowa wind, which wasn't there 15 years ago."
682,1-25-16,primary_dem,O,"And you employ 5,000 people in the new industry, and the great thing about those big component parts you see rumbling down the highway on I-80 is they're too darn big for it to make a whole lot of sense to import them from other countries."
683,1-25-16,primary_dem,O,So you have to build them here.
684,1-25-16,primary_dem,O,"[applause]

And it's a big - and it's a big differentiator among the three of us."
685,1-25-16,primary_dem,O,"I mean, we're all - we're all decent people, we all want to do the right thing for our planet, but there is a generational perspective here."
686,1-25-16,primary_dem,O,"And we're not going to get to 100 percent clean electric grid with an ""all of the above"" strategy, any more than we got to the moon with an ""all of the above"" strategy."
687,1-25-16,primary_dem,O,It was an engineering challenge.
688,1-25-16,primary_dem,O,And we are up top this as Americans.
689,1-25-16,primary_dem,O,"But incrementalism, half steps, splitting the loaf, that's not going to get us."
690,1-25-16,primary_dem,O,And that's not what your generation wants.
691,1-25-16,primary_dem,O,You want the straight truth and you want us to face our challenges fearlessly and make this new reality ours.
692,1-25-16,primary_dem,CUOMO," What works for you in that, Jenna, do you like the answer?"
693,1-25-16,primary_dem,BISHOP, I think that's great.
694,1-25-16,primary_dem,BISHOP,"I think the environment is huge, obviously, especially for those of us that are going to be living a lot of years, hopefully."
695,1-25-16,primary_dem,BISHOP,"So, thanks."
696,1-25-16,primary_dem,BISHOP,[laughter]
697,1-25-16,primary_dem,CUOMO, Hopefully we'll still be there.
698,1-25-16,primary_dem,CUOMO,All right.
699,1-25-16,primary_dem,CUOMO,"Arnold Woods, he is the president of the Des Moines NAACP."
700,1-25-16,primary_dem,CUOMO,He is an Air Force veteran who served in Vietnam.
701,1-25-16,primary_dem,CUOMO,And he says he is still undecided.
702,1-25-16,primary_dem,CUOMO,"Your question, sir."
703,1-25-16,primary_dem,CUOMO,"ARNOLD WOODS: Yes, I am undecided."
704,1-25-16,primary_dem,CUOMO,"And the question I have is, because of the extreme number of our military personnel returning from war zones, combat zones with PTSD, what is your feeling towards reestablishing a military draft?"
705,1-25-16,primary_dem,CUOMO,"And for those who are not deemed worthy to go to military draft or to be drafted into the military, do you have any options for them where they can serve our country for a couple years prior to going to college?"
706,1-25-16,primary_dem,O, Thank you.
707,1-25-16,primary_dem,O,"I have put forward in your state 15 strategic goals to move our country forward again, to rebuild the truth of the American dream to get wages to go up, to make college more affordable and debt-free within the next five years, cut drug overdoses in half in the next 10 years, gun deaths in half in the next 10 years."
708,1-25-16,primary_dem,O,But one of the goals is to cut youth unemployment in half in the next three years.
709,1-25-16,primary_dem,O,"And I propose to do that by making national service a universal option for every kid in America, to serve their country in environmental restoration, or in public health, or in other avenues in addition to the military."
710,1-25-16,primary_dem,O,"And I believe that that will not only allow our kids to go to college in a more affordable way, giving them an increased Pell grant benefit, but I also know that it will do a great deal to tap that goodness within the next generation and bring it forward, bring their ethic forward."
711,1-25-16,primary_dem,O,Let me talk a little bit about veterans because another one of our - my strategic goals is full employment for the veterans of ours who come home from Iraq and Afghanistan.
712,1-25-16,primary_dem,O,We do a very poor job of transitioning our veterans back to civilian life.
713,1-25-16,primary_dem,O,"And I have found, as a governor attacking this problem, that the key is employment."
714,1-25-16,primary_dem,O,Talkingalking to our veterans about employment.
715,1-25-16,primary_dem,O,"There is absolutely no hand-off between the Defense Department and Veterans Affairs, let alone our state departments of Veterans Affairs."
716,1-25-16,primary_dem,O,"And, in fact, on the DD-214, the discharge form that veterans fill out, there's not even a box on there for an email address."
717,1-25-16,primary_dem,O,And a lot of our veterans become ghost people.
718,1-25-16,primary_dem,O,We might catch up with them eventually at the hospital.
719,1-25-16,primary_dem,O,We might catch up with them at a county jail.
720,1-25-16,primary_dem,O,"We're a better nation than this and we need to have a transition program so that none of our veterans slip through the cracks and we need to make the first goal so that we can then get to the Post-Traumatic Stress issues, mental health and other things."
721,1-25-16,primary_dem,O,"The first goal needs to be for employment, because every person needs to be needed."
722,1-25-16,primary_dem,O,And we need our veterans back here every bit as much as we needed them abroad.
723,1-25-16,primary_dem,O,[applause]
724,1-25-16,primary_dem,CUOMO," We've got another question for you, Governor."
725,1-25-16,primary_dem,CUOMO,"Deborah Plummer is from Drake University, undecided, has a question about the economy for you."
726,1-25-16,primary_dem,CUOMO,"DEBORAH PLUMMER: Good evening, Governor."
727,1-25-16,primary_dem,O, Hi.
728,1-25-16,primary_dem,PLUMMER, Hi.
729,1-25-16,primary_dem,PLUMMER,"My question is, do you have any specific plans to grow the economy at a rate that will increase job growth for those - so that those who are long-term unemployed or have fallen out of the workforce will have an opportunity to get back in?"
730,1-25-16,primary_dem,O, Sure.
731,1-25-16,primary_dem,O,Yes.
732,1-25-16,primary_dem,O,The - let me talk a little bit about our economy.
733,1-25-16,primary_dem,O,Prior to President Obama's good work - and he's done great work.
734,1-25-16,primary_dem,O,"He saved us from a second Great Depression, from the recklessness and the greed on Wall Street."
735,1-25-16,primary_dem,O,"Our nation's creating jobs again and we're the only species on the planet without full employment, so jobs are important, right?"
736,1-25-16,primary_dem,O,"Without jobs, nothing works very well."
737,1-25-16,primary_dem,O,"But here's another thing that doesn't work very well in America, unless it's going in the right direction, and that is wages."
738,1-25-16,primary_dem,O,"For the first time this side of World War II, 70 percent of us are earning the same or less than we did 12 years ago."
739,1-25-16,primary_dem,O,"So as I look at this, I believe that we need to first and foremost remember that our economy is not money."
740,1-25-16,primary_dem,O,It is people.
741,1-25-16,primary_dem,O,It is all of our people.
742,1-25-16,primary_dem,O,And we need to restore common sense wage and labor policies that make wages rise again.
743,1-25-16,primary_dem,O,"Things we used to do, Democrats and Republicans together all the time, like keeping the minimum wage above the poverty line, paying overtime pay for overtime work."
744,1-25-16,primary_dem,O,"How about this, the long deferred promise of equal pay for equal work for men and women?"
745,1-25-16,primary_dem,O,"[applause]

Making it easier for people to join labor unions instead of harder."
746,1-25-16,primary_dem,O,"And then... [applause] ...And here's another one to make wages go up instead of being a drag on wages, let's get 11 million of our neighbors out of the underground shadow economy by passing comprehensive immigration reform... [applause] ...with a pathway to citizenship for all."
747,1-25-16,primary_dem,CUOMO," Governor, but there's..."
748,1-25-16,primary_dem,O," Chris, and two other brief ones on this."
749,1-25-16,primary_dem,O,I'm the first candidate in either party to put forward a new agenda for America's cities.
