,Date,Debate Type,Speaker,Sents
211,1-25-16,primary_dem,CUOMO,What about that aspect?
212,1-25-16,primary_dem,CUOMO,"That's what Hillary Clinton represents on one level to voters, that she would be the first female president, and there is something special in that, especially when it comes to women's issues."
213,1-25-16,primary_dem,SANDERS," And of course, I understand that."
214,1-25-16,primary_dem,SANDERS,"But I think if you look at my record in terms of fighting for women's rights, I think there are very few members of Congress who have a stronger record."
215,1-25-16,primary_dem,SANDERS,"It's 100 percent lifetime, and I've been there for a while."
216,1-25-16,primary_dem,SANDERS,"In addition to that, you know, there have - as you know, women are making 79 cents on the dollar compared to men."
217,1-25-16,primary_dem,SANDERS,"That is nothing but old-fashioned sexism, and I am a strong advocate and will fight for pay equity for women."
218,1-25-16,primary_dem,SANDERS,"I believe that - and it's not only women, although it impacts women and women of color even greater, this level of pay inequality, inequity, is extraordinary."
219,1-25-16,primary_dem,SANDERS,"So we're going to fight for pay equity, make sure that everybody earns the same amount for the same work."
220,1-25-16,primary_dem,SANDERS,"Also, what we have got to do is people cannot make it on 8, 9, 10 bucks an hour."
221,1-25-16,primary_dem,SANDERS,We have got to raise the minimum wage in this country to a living wage.
222,1-25-16,primary_dem,SANDERS,That will impact all people.
223,1-25-16,primary_dem,SANDERS,It will impact women more than men as we raise the minimum wage to 15 bucks an hour.
224,1-25-16,primary_dem,SANDERS,[applause]
225,1-25-16,primary_dem,CUOMO, All right.
226,1-25-16,primary_dem,CUOMO,So...
227,1-25-16,primary_dem,SANDERS," Well, one more point, one more point, Chris."
228,1-25-16,primary_dem,SANDERS,I'm trying to win her vote.
229,1-25-16,primary_dem,SANDERS,Leave me alone here.
230,1-25-16,primary_dem,SANDERS,"[laughter]

All right."
231,1-25-16,primary_dem,SANDERS,"Hillary Clinton and I have a disagreement on a very important issue that impacts everybody, but especially women."
232,1-25-16,primary_dem,SANDERS,I believe that we should expand Social Security benefits by lifting the cap on taxable income.
233,1-25-16,primary_dem,SANDERS,"That will help millions of low-income seniors, especially women."
234,1-25-16,primary_dem,SANDERS,Ask Hillary Clinton if she's prepared to lift the cap on taxable income.
235,1-25-16,primary_dem,SANDERS,[applause]
236,1-25-16,primary_dem,CUOMO," All right, Alexis, I want to put you a little bit on the spot."
237,1-25-16,primary_dem,CUOMO,"Now that you heard the answer... [laughter] ...what do you think now - and he looks like that even when he's happy, so don't worry about his particular reactions."
238,1-25-16,primary_dem,CUOMO,"[laughter]

So after the answer, where are you, same place, open-minded, what are you at?"
239,1-25-16,primary_dem,ALEXIS," It definitely means I'm going to have some hard thinking to do in the next week, but it reassures me and it was a good plan to speak about."
240,1-25-16,primary_dem,ALEXIS,Thank you.
241,1-25-16,primary_dem,SANDERS, Thank you very much.
242,1-25-16,primary_dem,SANDERS,[applause]
243,1-25-16,primary_dem,CUOMO, Take progress where you find it.
244,1-25-16,primary_dem,CUOMO,"All right, we'll give Alexis some time to think, the rest of you as well."
245,1-25-16,primary_dem,CUOMO,We have more questions for Senator Sanders and his final pitch to these Iowa voters when we come back.
246,1-25-16,primary_dem,CUOMO,Stay with us.
247,1-25-16,primary_dem,CUOMO,[commercial break]
248,1-25-16,primary_dem,CUOMO," Welcome back to the CNN Democratic Presidential Town Hall here at Drake University in Des Moines, Iowa."
249,1-25-16,primary_dem,CUOMO,We're here with Senator Bernie Sanders.
250,1-25-16,primary_dem,CUOMO,We've been talking about the issues.
251,1-25-16,primary_dem,CUOMO,"You were working on a young woman there, trying to get her vote."
252,1-25-16,primary_dem,CUOMO,I have another woman.
253,1-25-16,primary_dem,CUOMO,I think you've got some work left to do on.
254,1-25-16,primary_dem,CUOMO,Her name is Secretary Clinton.
255,1-25-16,primary_dem,CUOMO,She has an ad out now.
256,1-25-16,primary_dem,CUOMO,You both put out big ads.
257,1-25-16,primary_dem,CUOMO,I know how you feel about yours.
258,1-25-16,primary_dem,CUOMO,"Let's take a look at Secretary Clinton's ad and get your take on it, Senator, right here in this room."
259,1-25-16,primary_dem,CUOMO,"[begin video clip]

UNIDENTIFIED MALE: The world a president has to grapple with - sometimes you can't even imagine."
260,1-25-16,primary_dem,CUOMO,"That's the job and she's prepared for it like no other, a tireless secretary of State, standing up against the abuse of women and girls, negotiating a cease-fire in Gaza, leading the diplomacy that keeps us out of war."
261,1-25-16,primary_dem,CUOMO,The presidency is the toughest job in the world and she's the one leader who has what it takes to get every part of the job done.
262,1-25-16,primary_dem,CLINTON, I'm Hillary Clinton and I approved this message.
263,1-25-16,primary_dem,CLINTON,[end video clip]
264,1-25-16,primary_dem,CUOMO," The argument is sure, Bernie's got the heart, but I have the head."
265,1-25-16,primary_dem,CUOMO,"You have to be experienced, you have to know what to do."
266,1-25-16,primary_dem,CUOMO,"[laughter]

Is Secretary Clinton simply better prepared for the job than you, sir?"
267,1-25-16,primary_dem,CUOMO,Don't leave.
268,1-25-16,primary_dem,CUOMO,We have another 15 minutes.
269,1-25-16,primary_dem,CUOMO,[laughter]
270,1-25-16,primary_dem,SANDERS," No, this calls for a standing up response."
271,1-25-16,primary_dem,CUOMO, OK.
272,1-25-16,primary_dem,SANDERS, That's all.
273,1-25-16,primary_dem,SANDERS,"[laughter] All right, let me shock everybody here."
274,1-25-16,primary_dem,SANDERS,This is true.
275,1-25-16,primary_dem,SANDERS,I've known Hillary Clinton for 25 years.
276,1-25-16,primary_dem,SANDERS,You know what?
277,1-25-16,primary_dem,SANDERS,I like Hillary Clinton and I respect Hillary Clinton.
278,1-25-16,primary_dem,SANDERS,"And Hillary Clinton has devoted her life to public service and I have tried, as I hope you all know, not to run a negative campaign, not to be attacking every other day, to keep this discussion on a high level, where we debate the issues facing this country."
279,1-25-16,primary_dem,SANDERS,"[applause]

And by the way, with a few exceptions, we're doing a lot better than the Republicans in that regard."
280,1-25-16,primary_dem,SANDERS,"[applause]

But on the other hand, that's not a very high bar to reach, so... [laughter] ...all right."
281,1-25-16,primary_dem,SANDERS,But what is - what is this?
282,1-25-16,primary_dem,SANDERS,"All right, what do I think?"
283,1-25-16,primary_dem,SANDERS,Let me just give you a couple of examples.
284,1-25-16,primary_dem,SANDERS,The truth is that the most significant vote and issue regarding foreign policy that we have seen in this country in modern history was the vote on the war in Iraq.
285,1-25-16,primary_dem,SANDERS,"OK, that's the fact."
286,1-25-16,primary_dem,SANDERS,"I voted against the war in Iraq and if you go to my Web site, listen to the speech that I gave when I was in the House in 2002, saying, yes, it's easy to get rid of a dictator like Saddam Hussein, but there's going to be a political vacuum, there will be instability."
287,1-25-16,primary_dem,SANDERS,"And it gives me no pleasure to tell that much of what I feared, in fact, happened."
288,1-25-16,primary_dem,SANDERS,Hillary Clinton voted for the war in Iraq.
289,1-25-16,primary_dem,SANDERS,"All right, in terms of Wall Street, I fought against deregulation, led the opposition to doing away with the Glass-Steagall legislation."
290,1-25-16,primary_dem,SANDERS,"Unfortunately, my side lost."
291,1-25-16,primary_dem,SANDERS,Wall Street became deregulated.
292,1-25-16,primary_dem,SANDERS,The rest is history.
293,1-25-16,primary_dem,SANDERS,"Wall Street has operated, in a very significant way in a fraudulent way, and obviously their greed and recklessness helped destroy our economy and create the worst recession since the Great Depression."
294,1-25-16,primary_dem,SANDERS,I led the effort against Wall Street deregulation.
295,1-25-16,primary_dem,SANDERS,See where Hillary Clinton was on this issue.
296,1-25-16,primary_dem,SANDERS,"In terms of climate change, which everybody here knows - and apparently everybody in the world knows except Republican candidates for president, is one of the great environmental crises facing this nation."
297,1-25-16,primary_dem,SANDERS,"On day one, I said the Keystone Pipeline is a dumb idea."
298,1-25-16,primary_dem,SANDERS,[applause]
299,1-25-16,primary_dem,CUOMO, Senator...
300,1-25-16,primary_dem,SANDERS, OK.
301,1-25-16,primary_dem,SANDERS,I think the Bakken Pipeline and pipelines in Vermont and New Hampshire are dumb.
302,1-25-16,primary_dem,SANDERS,I think we've got to break our dependence on fossil fuel.
303,1-25-16,primary_dem,SANDERS,Why did it take... [applause] ...Why did it take Hillary Clinton such a long time before she came into opposition to the Keystone Pipeline?
304,1-25-16,primary_dem,SANDERS,"Trade policy - I have understood from day one that our trade policies have cost us - NAFTA, CAFTA, PNTR with China, millions of decent-paying jobs."
305,1-25-16,primary_dem,SANDERS,I didn't have to think hard about opposing the Transpacific Partnership.
306,1-25-16,primary_dem,SANDERS,"[applause]

It took Hillary Clinton a long time to come on board that."
307,1-25-16,primary_dem,CUOMO, So...
308,1-25-16,primary_dem,SANDERS," In other words, yes, I do think I have the background and the judgment to take this very, very difficult job of being president of the United States."
309,1-25-16,primary_dem,CUOMO, One point of push back... [applause] ...we know we're in the final stretch here.
310,1-25-16,primary_dem,CUOMO,Intensity gets higher when you're in the final stretch like we are right now.
311,1-25-16,primary_dem,SANDERS, Yes.
312,1-25-16,primary_dem,CUOMO," But on January 19th, you were talking about Secretary Clinton's experience argument and you referred to Dick Cheney."
313,1-25-16,primary_dem,CUOMO,"You said he had a lot of experience, too."
314,1-25-16,primary_dem,SANDERS, Right.
315,1-25-16,primary_dem,CUOMO, Now... [laughter] ...referring to Dick Cheney when talking about Hillary Clinton not exactly the most high brow way to conduct the election...
316,1-25-16,primary_dem,SANDERS, Look...
317,1-25-16,primary_dem,CUOMO, - some might suggest.
318,1-25-16,primary_dem,SANDERS," - my - my only point was, look, Secretary Clinton was secretary of State of this country for four years."
319,1-25-16,primary_dem,SANDERS,That is a lot of experience.
320,1-25-16,primary_dem,SANDERS,There's no debate about that.
321,1-25-16,primary_dem,SANDERS,I was not secretary of State.
322,1-25-16,primary_dem,SANDERS,"But, experience is important, but judgement is also important."
323,1-25-16,primary_dem,SANDERS,"And, my own point was in talking Dick Cheney, he had a lot of experience too."
324,1-25-16,primary_dem,SANDERS,His policies with regard to foreign affairs was an absolute disaster.
325,1-25-16,primary_dem,SANDERS,"So, experience is important, but it is not the only thing."
326,1-25-16,primary_dem,SANDERS,"And, I would urge people to check out my views on foreign policy, how we deal with ISIS, and I think they will make a lot of sense to the people of Iowa, and the people of our country."
327,1-25-16,primary_dem,CUOMO, Let's get a question.
328,1-25-16,primary_dem,CUOMO,Carrie Crawford says she's undecided.
329,1-25-16,primary_dem,CUOMO,Mother of three grown kids.
330,1-25-16,primary_dem,CUOMO,What is your question?
331,1-25-16,primary_dem,QUESTION," Hello, Senator Sanders."
332,1-25-16,primary_dem,QUESTION,"In light of the recent mass shootings, I'm intered to know how you're going to make inroads with the powerful gun lobby to establish more effective gun control legislation."
333,1-25-16,primary_dem,QUESTION,"And, the second part of my question is how will you support easier access to mental health care clinics."
334,1-25-16,primary_dem,SANDERS, Good.
335,1-25-16,primary_dem,SANDERS,Excellent questions.
336,1-25-16,primary_dem,SANDERS,"Now, I have been attacked - in fact, this is an issue that Hillary Clinton has focused on, and that's politics."
337,1-25-16,primary_dem,SANDERS,And that's fine.
338,1-25-16,primary_dem,SANDERS,"Although, some of you might recall that back in 2007, when she was running against Barack Obama, she also focused on that issue."
339,1-25-16,primary_dem,SANDERS,But she thought that Obama was too strong on gun issues.
340,1-25-16,primary_dem,SANDERS,"You may remember him referring to her as ""Annie Oakley"", alright?"
341,1-25-16,primary_dem,SANDERS,"Today, Hillary Clinton's running a lot of advertisements on gun issues."
342,1-25-16,primary_dem,SANDERS,"Interestingly enough, she's running most of them in New Hampshire where she thinks it'll work, not running so many of them in rural Iowa."
343,1-25-16,primary_dem,SANDERS,"Well, you can form your own judgement as to why that is the case."
344,1-25-16,primary_dem,SANDERS,"To answer your question, in 1988 I ran Vermont's lone seat in the U.S. House of Representatives."
345,1-25-16,primary_dem,SANDERS,I ran as an Independent against a Democrat and a Republican.
346,1-25-16,primary_dem,SANDERS,"The gun lobby said vote for either the Democrat or the Republican, don't vote for Bernie Sanders."
347,1-25-16,primary_dem,SANDERS,This is 1988.
348,1-25-16,primary_dem,SANDERS,Because Bernie thinks that we should not be selling military style assault weapons in the United States of America.
349,1-25-16,primary_dem,SANDERS,Back in 1988.
350,1-25-16,primary_dem,SANDERS,I lost that election by three percentage points.
351,1-25-16,primary_dem,SANDERS,"I cannot tell you that that was the only reason, but I had the gun groups working against me back then."
352,1-25-16,primary_dem,SANDERS,"Since then, I have supported instant background checks, the expansion of instant background checks because I believe our job, if we're going to end these horrific mass murders, or at least have some impact in lessening the occurrence of them, we have got to do our best to make sure that guns do not get into the hands of people who should not have them."
353,1-25-16,primary_dem,SANDERS,"Criminals, people with mental instability."
354,1-25-16,primary_dem,SANDERS,"I believe as President Obama does that we got to deal with this gun show loophole, and that's what he's working on now with his executive order."
355,1-25-16,primary_dem,SANDERS,"People should not be able to circumvent the instant background check through the gun show, or through the Internet."
356,1-25-16,primary_dem,SANDERS,"I believe that we should make a federal crime of the so-called, ""Strawman Situation"", where people are buying guns legally, going through the instant background check, and then selling them to criminals."
357,1-25-16,primary_dem,CUOMO," Senator, address your shift on the issue regarding manufacturers and their liability..."
358,1-25-16,primary_dem,SANDERS, ...
359,1-25-16,primary_dem,SANDERS,Here is the issue...
360,1-25-16,primary_dem,CUOMO, ... Just to remind you guys.
361,1-25-16,primary_dem,CUOMO,"Tell them where you were first, and what you just said recently."
362,1-25-16,primary_dem,SANDERS," I voted for the bill, and the reason I voted for the bill is you got a bill which has a number of elements in it, among other things it has a section which says we should not be selling ammunition which will pierce policemans armor and protection."
363,1-25-16,primary_dem,SANDERS,I think that's a right thing.
364,1-25-16,primary_dem,SANDERS,It had a section in it which said that we want to have safety locks for children on guns.
365,1-25-16,primary_dem,SANDERS,That makes sense to me.
366,1-25-16,primary_dem,SANDERS,"It also had a provision in it which says the following - and people may disagree with me, this is my view."
367,1-25-16,primary_dem,SANDERS,"Is that if you are a small gun shop in Vermont, and I legally sell you a weapon, OK?"
368,1-25-16,primary_dem,SANDERS,"You go out, buy that gun legally, and then you go out and kill somebody."
369,1-25-16,primary_dem,SANDERS,I think the gun shop owner should not be held liable to your criminal act.
370,1-25-16,primary_dem,SANDERS,That's what I believe.
371,1-25-16,primary_dem,SANDERS,"Now, within that bill also there was some onerous provision."
372,1-25-16,primary_dem,SANDERS,Not good provisions.
373,1-25-16,primary_dem,SANDERS,"What happens if a gun manufacturer is selling a whole lot of guns into an area, far more guns than that area can consume?"
374,1-25-16,primary_dem,SANDERS,"And, what happens if that gun owner - that gun manufacturer should know that those guns are going into criminal hands."
375,1-25-16,primary_dem,SANDERS,Should that gun manufacturer be held liable?
376,1-25-16,primary_dem,SANDERS,"Yes, he should."
377,1-25-16,primary_dem,SANDERS,"So, I am willing now to look at that legislation, maintain what was good in it, get rid of what is bad in it."
378,1-25-16,primary_dem,CUOMO, But isn't that having it both ways?
379,1-25-16,primary_dem,CUOMO,"Like, either they have liability as a manufacturer or they don't."
380,1-25-16,primary_dem,CUOMO,The first argument seems to make sense.
381,1-25-16,primary_dem,CUOMO,Why would they be exposed to liability that other manufacturers are not?
382,1-25-16,primary_dem,CUOMO,But are you having it both ways?
383,1-25-16,primary_dem,SANDERS," I don't think so, Chris."
384,1-25-16,primary_dem,SANDERS,"If you sell, if you are a small gun shop owner and you sell somebody a gun, legally, all right, you don't do anything wrong."
385,1-25-16,primary_dem,SANDERS,That's what you do.
386,1-25-16,primary_dem,SANDERS,You sell guns.
387,1-25-16,primary_dem,SANDERS,"Somebody buys the gun and then goes out and kills somebody, do I think that gun shop owner should be held liable?"
388,1-25-16,primary_dem,SANDERS,I don't.
389,1-25-16,primary_dem,CUOMO," What's the difference between selling one or selling 1,000?"
390,1-25-16,primary_dem,SANDERS," No, but the point is - ah, but here's the point."
391,1-25-16,primary_dem,SANDERS,"If a gun shop owner should know, why should somebody be buying 1,000 guns?"
392,1-25-16,primary_dem,SANDERS,Somebody should be thinking that does not make a lot of sense.
393,1-25-16,primary_dem,SANDERS,"In that case, that gun shop owner or the gun manufacturer should be held liable, OK?"
394,1-25-16,primary_dem,SANDERS,And that's the issue that I want to - now you're asking me also about mental health.
395,1-25-16,primary_dem,SANDERS,"When I talk about health care for all, I absolutely include in that the fact that mental health should be treated as part of health care, should be available to all people."
396,1-25-16,primary_dem,SANDERS,"[applause]

I get calls - I have gotten calls in my office, and I'm sure other senators have as well."
397,1-25-16,primary_dem,SANDERS,This is the call.
398,1-25-16,primary_dem,SANDERS,"Somebody calls us up and said, I'm very worried about my brother."
399,1-25-16,primary_dem,SANDERS,"I'm worried what he might do to himself or, to answer your question, to somebody else."
400,1-25-16,primary_dem,SANDERS,He may be homicidal.
401,1-25-16,primary_dem,SANDERS,He may be suicidal.
402,1-25-16,primary_dem,SANDERS,We have searched desperately to find health care - mental health treatment for him.
403,1-25-16,primary_dem,SANDERS,"We cannot find mental health treatment which is affordable, which is accessible."
404,1-25-16,primary_dem,SANDERS,"In my view, we have got to move in the direction of making sure that everybody in this country who has a mental health crisis gets health care when they need it, not two months from today."
405,1-25-16,primary_dem,CUOMO," Carrie, how do you feel about the answer?"
406,1-25-16,primary_dem,CRAWFORD, I like the answer.
407,1-25-16,primary_dem,CRAWFORD,That's sufficient.
408,1-25-16,primary_dem,CRAWFORD,Thank you very much.
409,1-25-16,primary_dem,SANDERS, Thank you.
410,1-25-16,primary_dem,CUOMO," Have a seat, Senator."
411,1-25-16,primary_dem,CUOMO,I'm tired following you around there.
412,1-25-16,primary_dem,CUOMO,[laughter]
413,1-25-16,primary_dem,SANDERS," If you followed me around today, you'd be a lot more tired."
414,1-25-16,primary_dem,SANDERS,[laughter]
415,1-25-16,primary_dem,CUOMO," CNN today, your brother was on."
416,1-25-16,primary_dem,SANDERS, Excuse me?
417,1-25-16,primary_dem,CUOMO, Your brother was on CNN today.
418,1-25-16,primary_dem,SANDERS, Yes.
419,1-25-16,primary_dem,CUOMO, Gave a great interview.
420,1-25-16,primary_dem,CUOMO,He said that back in the day you were a great athlete.
421,1-25-16,primary_dem,CUOMO,Is that true?
422,1-25-16,primary_dem,CUOMO,"And if so, what was the sport?"
423,1-25-16,primary_dem,CUOMO,I'm not saying I don't believe it to be true.
424,1-25-16,primary_dem,CUOMO,"I'm saying, is it true and what was the sport?"
425,1-25-16,primary_dem,SANDERS, You know families exaggerate a little bit.
426,1-25-16,primary_dem,SANDERS,I was a very good athlete.
427,1-25-16,primary_dem,SANDERS,I wouldn't say I was a great athlete.
428,1-25-16,primary_dem,SANDERS,I was a pretty good basketball player.
429,1-25-16,primary_dem,SANDERS,My elementary school in Brooklyn won the borough championship.
430,1-25-16,primary_dem,SANDERS,"[laughter and applause]

Hardly worth mentioning, but we did, yes."
431,1-25-16,primary_dem,SANDERS,"And, yes, I did take third place in the New York City indoor one mile race."
432,1-25-16,primary_dem,SANDERS,"OK, well, you know, I would - I was a very good long-distance runner."
433,1-25-16,primary_dem,SANDERS,"I would say not a great runner, but I was captain of my track team and won a number of cross-country meets and certainly won a whole lot of races."
434,1-25-16,primary_dem,SANDERS,"So good, very good, not great."
435,1-25-16,primary_dem,CUOMO, Right.
436,1-25-16,primary_dem,CUOMO,Now this is what they call a bait and switch.
437,1-25-16,primary_dem,CUOMO,I don't really care about your athletic record.
438,1-25-16,primary_dem,CUOMO,"[laughter]

If you were elected president, you are 75 now."
439,1-25-16,primary_dem,CUOMO,You would be...
440,1-25-16,primary_dem,SANDERS, Seventy-four!
441,1-25-16,primary_dem,SANDERS,[laughter] [applause]
442,1-25-16,primary_dem,CUOMO, You are 74 going on 75.
443,1-25-16,primary_dem,CUOMO,You are close to 75.
444,1-25-16,primary_dem,SANDERS, I'm going on 75.
445,1-25-16,primary_dem,SANDERS,So are you!
446,1-25-16,primary_dem,SANDERS,You're going to be 75 some day.
447,1-25-16,primary_dem,SANDERS,[laughter]
448,1-25-16,primary_dem,CUOMO, That's true.
449,1-25-16,primary_dem,CUOMO,That's true.
450,1-25-16,primary_dem,CUOMO,You would be the oldest person elected president.
451,1-25-16,primary_dem,CUOMO,You have medical records.
452,1-25-16,primary_dem,CUOMO,You say you're going to release them.
453,1-25-16,primary_dem,CUOMO,"Should you release them, to be fair to the voters of Iowa, before they vote?"
454,1-25-16,primary_dem,SANDERS, Absolutely.
455,1-25-16,primary_dem,SANDERS,"They're sitting - where are they, Jane?"
456,1-25-16,primary_dem,SANDERS,They're on our table right now?
457,1-25-16,primary_dem,SANDERS,All right.
458,1-25-16,primary_dem,SANDERS,We will release them.
459,1-25-16,primary_dem,SANDERS,That's my wife.
460,1-25-16,primary_dem,SANDERS,"Yes, of course, we'll release them."
461,1-25-16,primary_dem,CUOMO, And you're going to do it before Iowa?
462,1-25-16,primary_dem,SANDERS," Yes, sure."
463,1-25-16,primary_dem,SANDERS,"And, you know, I am - you know, if there's wood here, I would knock on it."
464,1-25-16,primary_dem,CUOMO, My head is close enough.
465,1-25-16,primary_dem,CUOMO,[laughter]
466,1-25-16,primary_dem,SANDERS, I have been blessed with good health and good endurance.
467,1-25-16,primary_dem,SANDERS,And there's nothing in the medical records that is going to surprise anybody.
468,1-25-16,primary_dem,SANDERS,And we will get them out as soon as possible.
469,1-25-16,primary_dem,CUOMO, All right.
470,1-25-16,primary_dem,CUOMO,Thank you for clarifying that.
471,1-25-16,primary_dem,CUOMO,Something else your brother said.
472,1-25-16,primary_dem,CUOMO,He got emotional.
473,1-25-16,primary_dem,CUOMO,"He was saying, boy, would our parents be proud of the success that Bernie has had."
474,1-25-16,primary_dem,CUOMO,You have to think about that as well.
475,1-25-16,primary_dem,CUOMO,"When you think about why you are doing this and what it means, what does it mean to you about what your parents would think if they saw you now?"
476,1-25-16,primary_dem,SANDERS, That they wouldn't believe it.
477,1-25-16,primary_dem,SANDERS,"I mean, we grew up - my dad came from Poland at the age of 17 without a nickel in his pocket, couldn't speak English and he never made a whole lot of money."
478,1-25-16,primary_dem,SANDERS,"And my brother and I and mom and dad grew up in a three-and-a-half-room rent-controlled apartment in Brooklyn, New York."
479,1-25-16,primary_dem,SANDERS,And we never had a whole lot of money.
480,1-25-16,primary_dem,SANDERS,"And if you ask me, you know, Chris, this would be so unimaginable the fact that I'm a United States senator would've been beyond really anything that they would have thought possible."
481,1-25-16,primary_dem,SANDERS,"The fact that I am running for president of the United States, you know I do think about it and you know think they're very proud."
482,1-25-16,primary_dem,SANDERS,But it's certainly something that I don't think they ever believed would've happened.
483,1-25-16,primary_dem,CUOMO, You got 30 seconds.
484,1-25-16,primary_dem,CUOMO,Tell the voters of Iowa what you want them to know.
