,Date,Debate Type,Speaker,Sents
501,1-28-16,primary_rep,KELLY," Dr. Carson, this week a female Muslim who served in the U.S. Air Force asked Hillary Clinton the question, she asked whether the United States is still the best place in which to raise her three Muslim children."
502,1-28-16,primary_rep,KELLY,Given what she perceives as a rise in Islamaphobia in this country.
503,1-28-16,primary_rep,KELLY,"Do you think the GOP messaging on Muslims has stoked the flames of bias on this as the Democrats suggest, and how would you answer this veteran?"
504,1-28-16,primary_rep,CARSON," Well, I don't know about the GOP messaging, but I can tell you about my messaging."
505,1-28-16,primary_rep,CARSON,"You know, need to stop allowing political correctness to dictate our policies, because it's going to kill us if we don't."
506,1-28-16,primary_rep,CARSON,"[applause]

And in the Holy Land Foundation trial in 2006 in Texas, they had a memorandum, an explanatory memorandum that talked about the fact that Americans would be easy to overcome and to commit civilization jihad because they were going to be trying to protect the rights of the very people who were trying to subvert them."
507,1-28-16,primary_rep,CARSON,But I believe in the Teddy Roosevelt philosophy.
508,1-28-16,primary_rep,CARSON,"Teddy Roosevelt said, we are a nation of immigrants."
509,1-28-16,primary_rep,CARSON,"As such, everybody is welcome from any race, any country, any religion, if they want to be Americans."
510,1-28-16,primary_rep,CARSON,If they want to accept our values and our laws.
511,1-28-16,primary_rep,CARSON,"If not, they can stay where they are."
512,1-28-16,primary_rep,CARSON,[applause]
513,1-28-16,primary_rep,KELLY," Governor Kasich, stand back."
514,1-28-16,primary_rep,KELLY,"You appear to back in another debate, a so-called back door to encrypted cell phone technology, which protects most smartphones that we all have from hacking."
515,1-28-16,primary_rep,KELLY,And it includes our phones and it also protects the cell phones of the terrorist.
516,1-28-16,primary_rep,KELLY,"Now the tech companies and a group of MIT scientists, smart guys, right, warn that if they create a way for the FBI to have a back door into our encrypted communications, then the bad guys will exploit it too."
517,1-28-16,primary_rep,KELLY,And they say that this is going to cause more security problems than it would solve for everyday Americans.
518,1-28-16,primary_rep,KELLY,Are they wrong?
519,1-28-16,primary_rep,KASICH," Well, look the Joint Terrorism Task Force needs resources and tools."
520,1-28-16,primary_rep,KASICH,"And those are made up of the FBI, state and local law enforcement."
521,1-28-16,primary_rep,KASICH,"And Megyn, it's best not to talk anymore about back doors and encryption, it will get solved, but it needs to be solved in the situation of the White House with the technology folks."
522,1-28-16,primary_rep,KELLY, But this is public testimony.
523,1-28-16,primary_rep,KASICH, But I just have to tell you that it's best with some of these things not be said.
524,1-28-16,primary_rep,KASICH,Now I want to go back something.
525,1-28-16,primary_rep,KASICH,"See, I was there when Reagan rebuilt the military."
526,1-28-16,primary_rep,KASICH,I was there in '89 when the wall came tumbling down because we were strong.
527,1-28-16,primary_rep,KASICH,And I was there when we went into the Gulf War.
528,1-28-16,primary_rep,KASICH,"We didn't win that war just from the air, we won that war by assembling a group of Arab leaders who stood in the Rose Garden and stood with America."
529,1-28-16,primary_rep,KASICH,"We want to destroy ISIS, it has to be in the air and on the ground."
530,1-28-16,primary_rep,KASICH,"It has to be with our friends in the Arab world and our friends in Europe, the coalition that we had when we went to the first Gulf War."
531,1-28-16,primary_rep,KASICH,"And then when we win that, and we will win that against ISIS as it settles down, and we should leave."
532,1-28-16,primary_rep,KASICH,Because we shouldn't be policemen of the world.
533,1-28-16,primary_rep,KASICH,But what we need to do is turn it over to the regional powers to be able to handle that.
534,1-28-16,primary_rep,KASICH," But we have a unique time in America to connect with people all around the world that understand that there's an existential threat against all of them, the Arabs, the Jordanians, the Saudis, the Egyptians, our friends in Europe, including the Turks."
535,1-28-16,primary_rep,KASICH,So we have a unique opportunity to bring everybody together.
536,1-28-16,primary_rep,KASICH,"I saw Reagan do it, I've seen other presidents do it."
537,1-28-16,primary_rep,KASICH,"And frankly, if you want to be commander in chief, you have to have the experience."
538,1-28-16,primary_rep,KASICH,"At the same time we're doing all that, the Pentagon must be reformed so we get what we need for our men and women in uniform."
539,1-28-16,primary_rep,KASICH,"All of that together, we're going to be just fine and America is going to continue to lead the world."
540,1-28-16,primary_rep,KELLY," Governor, thank you."
541,1-28-16,primary_rep,KELLY,[applause]
542,1-28-16,primary_rep,BAIER," Governor Bush, just today, a wounded warrior organization designed to help wounded veterans and their families is coming under fire for raising tens of millions of dollars, but spending almost half of that on travel and hotels and dinners and luxury, lavish conferences."
543,1-28-16,primary_rep,BAIER,So taking care of veterans is obviously a huge issue in the country that has asked so many to serve and sacrifice so much.
544,1-28-16,primary_rep,BAIER,If you were president.
545,1-28-16,primary_rep,BAIER,would you police these charity organizations that say they're helping vets?
546,1-28-16,primary_rep,BUSH, Of course.
547,1-28-16,primary_rep,BUSH,"And there's all sorts of ways that can be done at the state, local and federal level to do that."
548,1-28-16,primary_rep,BUSH,But the first duty of the next president of the United States is to fix the mess at the Department of Veterans Affairs.
549,1-28-16,primary_rep,BUSH,That's his first responsibility.
550,1-28-16,primary_rep,BUSH,"[applause]

Look, we have waiting lists for veterans that are — that are leaving because of the sequester where we're gutting the military."
551,1-28-16,primary_rep,BUSH,"More and more military personnel are leaving becoming veterans, and the waiting list grows."
552,1-28-16,primary_rep,BUSH,"They've given out $140 million of bonuses to Veterans Department employees, including reducing the waiting lists, without giving veterans care."
553,1-28-16,primary_rep,BUSH,"People died, and only three people have been fired."
554,1-28-16,primary_rep,BUSH,I will make sure that we fire the sheer incompetence inside the Department of Veterans Affairs and then we'll give veterans a choice card so that they don't have to travel hours and hours to get care if they want to go to their private provider.
555,1-28-16,primary_rep,BUSH,"You want to make the Veterans Administration do a better job, give them — give veterans choices and you'll get a much better result."
556,1-28-16,primary_rep,BUSH,"And as it relates to all the other organizations, let me give you a good example."
557,1-28-16,primary_rep,BUSH,"In Houston, Texas, there's an organization in place because someone acted on their heart, wanted to make sure that there's no homeless veterans in Houston."
558,1-28-16,primary_rep,BUSH,And they've come pretty close to that without federal government assistance.
559,1-28-16,primary_rep,BUSH,We need to mobilize the entire country to treat our veterans and treat them with much more respect than they get today.
560,1-28-16,primary_rep,BAIER," Governor Bush, thank you."
561,1-28-16,primary_rep,BAIER,"[applause]

Speaking of veterans, we have a question from a veteran who is one of the top Youtube creators."
562,1-28-16,primary_rep,BAIER,"Over the course of the evening, gentlemen, we will hear from some of Youtube's most followed stars."
563,1-28-16,primary_rep,BAIER,And here's one of them.
564,1-28-16,primary_rep,QUESTION, I'm Mark Watson.
565,1-28-16,primary_rep,QUESTION,"I'm known for my [inaudible] views on Youtube, but I'm also a veteran who served in the Army for eight years."
566,1-28-16,primary_rep,QUESTION,"As an African-American living near Ferguson, I've seen the strain between police officers and the communities they serve firsthand."
567,1-28-16,primary_rep,QUESTION,"Now, there are great tools like body cameras that — to protect both officers and citizens, but we all currently have better cameras in our pockets than in our precincts."
568,1-28-16,primary_rep,QUESTION,Why aren't we using the technology available to better protect our communities?
569,1-28-16,primary_rep,BAIER," Senator Paul, that question to you."
570,1-28-16,primary_rep,PAUL," You know, I've supported legislation to allow body cameras."
571,1-28-16,primary_rep,PAUL,"I've been to Ferguson, I've been trying to look for solutions to our criminal justice problem."
572,1-28-16,primary_rep,PAUL,One thing I discovered in Ferguson was that a third of the budget for the city of Ferguson was being reaped by civil fines.
573,1-28-16,primary_rep,PAUL,People were just being fined to death.
574,1-28-16,primary_rep,PAUL,"Now you and I and many of the people in this audience, if we get a $100 fine, we can survive it."
575,1-28-16,primary_rep,PAUL,"If you're living on the edge of poverty and you get a $100 fine or your car towed, a lot of times you lose your job."
576,1-28-16,primary_rep,PAUL,"I also think the war on drugs has disproportionately affected our African-American community, and what we need to do is make sure that the war on drugs is equal protection under the law and that we don't unfairly incarcerate another generation of young African-American males."
577,1-28-16,primary_rep,PAUL,"In Ferguson, for every 100 African-American women, there are only 60 African-American men."
578,1-28-16,primary_rep,PAUL,"Drug use is about equal between white and black, but our prisons — three out of four people in prison are black or brown."
579,1-28-16,primary_rep,PAUL,I think something has to change.
580,1-28-16,primary_rep,PAUL,"I think it's a big thing that our party needs to be part of, and I've been a leader in Congress on trying to bring about criminal justice reform."
581,1-28-16,primary_rep,PAUL,[applause]
582,1-28-16,primary_rep,BAIER," Senator Paul, thank you."
583,1-28-16,primary_rep,WALLACE, This debate is just getting started.
584,1-28-16,primary_rep,WALLACE,"Coming up, the role of the federal government."
585,1-28-16,primary_rep,WALLACE,"But first, join tonight's conversation right from your home."
586,1-28-16,primary_rep,WALLACE,Go to google.com or open your Google search app and search Fox News Debate to vote on which issue is most important to you in this election.
587,1-28-16,primary_rep,WALLACE,More from the Iowa Events Center and the Republican presidential debate in a moment.
588,1-28-16,primary_rep,WALLACE,"[applause]

[commercial break]"
589,1-28-16,primary_rep,KELLY," Welcome back, everybody."
590,1-28-16,primary_rep,KELLY,"We are live in Des Moines, Iowa."
591,1-28-16,primary_rep,KELLY,And let's get right back to the questions — Bret.
592,1-28-16,primary_rep,BAIER," Thank you, Megyn."
593,1-28-16,primary_rep,BAIER,"Gentlemen, I'll ask you some questions about federal spending and the role of the federal government."
594,1-28-16,primary_rep,BAIER,"Everybody always said they want to cut federal spending and usually they start by saying they'll cut waste, fraud, and abuse, but that really doesn't ever materialize."
595,1-28-16,primary_rep,BAIER,We all know that.
596,1-28-16,primary_rep,BAIER,"Governor Christie, you talk a lot about entitlement reform and you say that that's where the federal government can get savings needed to balance the budget."
597,1-28-16,primary_rep,BAIER,But can you name even one thing that the federal government does now that it should not do at all?
598,1-28-16,primary_rep,CHRISTIE, Yes.
599,1-28-16,primary_rep,CHRISTIE,You want one?
600,1-28-16,primary_rep,CHRISTIE,[laughter]
601,1-28-16,primary_rep,BAIER, I want one.
602,1-28-16,primary_rep,BAIER,Yes.
603,1-28-16,primary_rep,BAIER,[laughter]
604,1-28-16,primary_rep,CHRISTIE, How about one that I've done in New Jersey for the last six years.
605,1-28-16,primary_rep,CHRISTIE,That's get rid of Planned Parenthood funding from the United States of America.
606,1-28-16,primary_rep,CHRISTIE,[applause]
607,1-28-16,primary_rep,BAIER, Anything bigger than that?
608,1-28-16,primary_rep,CHRISTIE, Bigger than that?
609,1-28-16,primary_rep,CHRISTIE,"Let me tell you something, when you see thousands upon thousands upon thousands of children being murdered in the womb, I can't think of anything better than that."
610,1-28-16,primary_rep,CHRISTIE,[applause]
611,1-28-16,primary_rep,BAIER," And, Governor, I realize everyone on this stage opposes Obamacare and you're not alone."
612,1-28-16,primary_rep,BAIER,"Google Data shows that in the last month when people searched ""policy repeals,"" that there were a lot of them."
613,1-28-16,primary_rep,BAIER,Obamacare took the top two spots.
614,1-28-16,primary_rep,BAIER,But today there are millions of people who gained health insurance from Obamacare and they now rely on it.
615,1-28-16,primary_rep,BAIER,"So the question, Senator Cruz, if you repeal Obamacare, as you say you will, will you be fine if millions of those people don't have health insurance?"
616,1-28-16,primary_rep,BAIER,And what is your specific plan for covering the uninsured?
617,1-28-16,primary_rep,CRUZ, Sure.
618,1-28-16,primary_rep,CRUZ,"Well, let's take it one at a time."
619,1-28-16,primary_rep,CRUZ,"First of all, we have seen now in six years of Obamacare that it has been a disaster."
620,1-28-16,primary_rep,CRUZ,It is the biggest job-killer in this country.
621,1-28-16,primary_rep,CRUZ,"Millions of Americans have lost their jobs, have been forced into part-time work, have lost their health insurance, have lost their doctors, have seen their premiums skyrocket."
622,1-28-16,primary_rep,CRUZ,"If I'm elected president, we will repeal every word of Obamacare."
623,1-28-16,primary_rep,CRUZ,"[applause]

Now, once that is done, everyone agrees we need healthcare reform."
624,1-28-16,primary_rep,CRUZ,"It should follow the principles of expanding competition, empowering patients, and keeping government from getting in between us and our doctors."
625,1-28-16,primary_rep,CRUZ,Three specific reforms that reflect those principles.
626,1-28-16,primary_rep,CRUZ,"Number one, we should allow people to purchase health insurance across state lines."
627,1-28-16,primary_rep,CRUZ,"That will create a true 50-state national marketplace which will drive down the cost of low-cost, catastrophic health insurance."
628,1-28-16,primary_rep,CRUZ,"Number two, we should expand health savings accounts so people can save in a tax-advantaged way for more routine healthcare needs."
629,1-28-16,primary_rep,CRUZ,"And number three, we should work to de-link health insurance from employment so if you lose your job, your health insurance goes with you and it is personal, portable and affordable."
630,1-28-16,primary_rep,CRUZ,"And I'll tell you, Bret, I think that's a much more attractive vision for healthcare than the Washington-drive, top-down Obamacare that is causing so many millions of people to hurt."
631,1-28-16,primary_rep,CRUZ,[applause]
632,1-28-16,primary_rep,BAIER," Senator Cruz, thank you."
633,1-28-16,primary_rep,BAIER,"Governor Bush, you've advocated for statehood for Puerto Rico."
634,1-28-16,primary_rep,BAIER,The Puerto Rican economy is collapsing under unsustainable debt burden.
635,1-28-16,primary_rep,BAIER,Only about 1 million of its 4 million residents are currently employed.
636,1-28-16,primary_rep,BAIER,"So should American citizens who you say are already overtaxed, bail out Puerto Rico as well?"
637,1-28-16,primary_rep,BUSH," No, they shouldn't."
638,1-28-16,primary_rep,BUSH,And I believe that Puerto Rico ought to have the right of self-determination.
639,1-28-16,primary_rep,BUSH,"If I was a Puerto Rican, I'd vote for statehood so that they have full citizenship."
640,1-28-16,primary_rep,BUSH,They serve in the military.
641,1-28-16,primary_rep,BUSH,They would have to pay federal taxes.
642,1-28-16,primary_rep,BUSH,They would — they would accept the responsibilities of full U.S. citizenship.
643,1-28-16,primary_rep,BUSH,But they should have the right of determine — self-determination.
644,1-28-16,primary_rep,BUSH,"Before you get to that, though, Puerto Rico is going to have to deal with the structural problems they face."
645,1-28-16,primary_rep,BUSH,"You know, it's — it's a fact that if you can pay for a $79 one-way ticket to Orlando, and you can escape the challenges of a declining economy and high crime rates, you move to Orlando."
646,1-28-16,primary_rep,BUSH,And a lot of people are doing that.
647,1-28-16,primary_rep,BUSH,And the spiraling out-of- control requires Puerto Rico to make structural reforms.
648,1-28-16,primary_rep,BUSH,"The federal government can play a role in allowing them to do that, but they should not — the process of statehood or the status of Puerto Rico won't be solved until we get to the bigger issue of how you deal with the structural economic problems they're facing right now."
649,1-28-16,primary_rep,BAIER," Governor Kasich, you're one of two remaining sitting governors still in the race."
650,1-28-16,primary_rep,BAIER,"Your colleague, Governor Rick Snyder of Michigan is under fire — he and his administration — for the Flint, Michigan water crisis and the botched response to it."
651,1-28-16,primary_rep,BAIER,How would you have handled that?
652,1-28-16,primary_rep,KASICH," Well, you've got to be on top of it right away."
653,1-28-16,primary_rep,KASICH,"And, you know, I don't know all the details of what Rick Snyder has done."
654,1-28-16,primary_rep,KASICH,I know there have been people who have been fired; people who are being held accountable.
655,1-28-16,primary_rep,KASICH,"But the fact is, every single engine of government has to move when you see a crisis like that."
656,1-28-16,primary_rep,KASICH,"And I've had many situations in the state of Ohio where we've had to move, whether it's storms, whether it was a horrible school shooting."
657,1-28-16,primary_rep,KASICH,There are many crises that come — a water crisis in Toledo.
658,1-28-16,primary_rep,KASICH,You've got to be on top of it.
659,1-28-16,primary_rep,KASICH,You've got to go the extra mile.
660,1-28-16,primary_rep,KASICH,You've got to work with local communities and you've got to work with the federal government.
661,1-28-16,primary_rep,KASICH,Because you realize that people depending on you.
662,1-28-16,primary_rep,KASICH,"And so, you go the extra mile."
663,1-28-16,primary_rep,KASICH,But people have to be alert.
664,1-28-16,primary_rep,KASICH,They have to be alert to problems.
665,1-28-16,primary_rep,KASICH,"And when you see a problem, you must act quickly to get on top of it."
666,1-28-16,primary_rep,KASICH,"And people at home are saying they've got a problem, listen to them."
667,1-28-16,primary_rep,KASICH,"Because most of the time, they're absolutely correct."
668,1-28-16,primary_rep,KASICH,So the fact is that we work for the people.
669,1-28-16,primary_rep,KASICH,The people don't work for us.
670,1-28-16,primary_rep,KASICH,And we have to have an attitude when we're in government of serving-hood.
671,1-28-16,primary_rep,KASICH,That's what really matters.
672,1-28-16,primary_rep,KASICH,We serve you.
673,1-28-16,primary_rep,KASICH,You don't serve us.
674,1-28-16,primary_rep,KASICH,We listen to you and — and then we act.
675,1-28-16,primary_rep,KASICH,[applause]
676,1-28-16,primary_rep,BAIER," Senator Rubio, on the issue of climate change, in 2008, you wanted Florida to get ahead of other states and establish a cap- and-trade system, a program for carbon emissions, which many Republicans thought at the time would hurt the Florida economy."
677,1-28-16,primary_rep,BAIER,"Now, you're a skeptic of climate change science."
678,1-28-16,primary_rep,BAIER,"And in fact, you warn that federal efforts to fight climate change will cost U.S. jobs and hurt the U.S. economy."
679,1-28-16,primary_rep,BAIER,So why the change?
680,1-28-16,primary_rep,RUBIO," Well, Bret, first that's not entirely the story."
681,1-28-16,primary_rep,RUBIO,"At the time, the liberal governor of Florida, who claimed he was a Republican — his name was Charlie Crist — he wanted to impose cap-and-trade on Florida."
682,1-28-16,primary_rep,RUBIO,And I opposed it.
683,1-28-16,primary_rep,RUBIO,I was the first person out of the box that opposed him on it.
684,1-28-16,primary_rep,RUBIO,"And then we saw that the leading candidates for president at the time, both the Republican and the Democrats, all supported it."
685,1-28-16,primary_rep,RUBIO,"And what we said is, if they're going to impose this on us, we better prepare to protect the state from it."
686,1-28-16,primary_rep,RUBIO,But I have never supported cap- and-trade and I never thought it was a good idea.
687,1-28-16,primary_rep,RUBIO,And I was clear about that at the time.
688,1-28-16,primary_rep,RUBIO,And I do not believe it's a good idea now.
689,1-28-16,primary_rep,RUBIO,I do not believe that we have to destroy our economy in order to protect our environment.
690,1-28-16,primary_rep,RUBIO,"And especially what these programs are asking us to pass that will do nothing to help the environment, but will be devastating for our economy."
691,1-28-16,primary_rep,RUBIO,"When I am president of the United States of America, there will never be any cap-and-trade in the United States."
692,1-28-16,primary_rep,RUBIO,[applause]
693,1-28-16,primary_rep,BAIER," Thanks, Senator."
694,1-28-16,primary_rep,KELLY, All right.
695,1-28-16,primary_rep,KELLY,We're going to move on.
696,1-28-16,primary_rep,KELLY,"Because coming up, immigration, and something you've never seen before."
697,1-28-16,primary_rep,KELLY,"Stay tuned, right after this break."
698,1-28-16,primary_rep,KELLY,[commercial break]
699,1-28-16,primary_rep,KELLY, Welcome back everyone.
700,1-28-16,primary_rep,KELLY,"Live, in Des Moines, Iowa."
701,1-28-16,primary_rep,KELLY,"Now, we move onto the topic of immigration."
702,1-28-16,primary_rep,KELLY,"Senator Rubio, we'll start with you."
703,1-28-16,primary_rep,KELLY,"When you ran for Senate in 2010, you made clear that you opposed legalization and citizenship for illegal immigrants."
704,1-28-16,primary_rep,KELLY,You promised repeatedly that you would oppose it as a U.S.
705,1-28-16,primary_rep,KELLY,Senator as well.
706,1-28-16,primary_rep,KELLY,Here are just a few examples.
707,1-28-16,primary_rep,KELLY,Watch.
708,1-28-16,primary_rep,KELLY,[begin video clip]
709,1-28-16,primary_rep,RUBIO, Never support.
710,1-28-16,primary_rep,RUBIO,"Never have and never will support any effort to grant blanket legalization amnesty to folks who have entered, or stayed in this country illegally."
711,1-28-16,primary_rep,RUBIO,"[end video clip]

[begin video clip]"
712,1-28-16,primary_rep,RUBIO," First of all, earned path to citizenship is basically code for amnesty."
713,1-28-16,primary_rep,RUBIO,It's what they call it.
714,1-28-16,primary_rep,RUBIO,"And, the reality of it is this, it is unfair to the people that have legally entered this country to create an alternative for individuals who entered illegally, and knowingly did so."
715,1-28-16,primary_rep,RUBIO,"[end video clip]

[begin video clip]"
716,1-28-16,primary_rep,RUBIO, You cannot grant amnesty.
717,1-28-16,primary_rep,RUBIO,If the American people see us granting amnesty they will never again believe in legal immigration.
718,1-28-16,primary_rep,RUBIO,"They will never again support it, and that's wrong for our country, bad for our future."
719,1-28-16,primary_rep,RUBIO,[end video clip]
720,1-28-16,primary_rep,KELLY," Within two years of getting elected you were co-sponsoring legislation to create a path to citizenship, in your words, amnesty."
721,1-28-16,primary_rep,KELLY,Haven't you already proven that you cannot be trusted on this issue?
722,1-28-16,primary_rep,RUBIO," No, because if you look at the quote, and it's very specific."
723,1-28-16,primary_rep,RUBIO,"And, it says blanket amnesty, I do not support blanket amnesty..."
724,1-28-16,primary_rep,KELLY, ...
725,1-28-16,primary_rep,KELLY,"But, you went on from there..."
726,1-28-16,primary_rep,RUBIO, ...
727,1-28-16,primary_rep,RUBIO,I do not support amnesty...
728,1-28-16,primary_rep,KELLY," ... You said more than that, Senator..."
729,1-28-16,primary_rep,RUBIO," ... No, I said I do not support blanket amnesty..."
730,1-28-16,primary_rep,KELLY, ... You said earned path to citizenship is basically code for amnesty.
731,1-28-16,primary_rep,KELLY,You...
732,1-28-16,primary_rep,RUBIO, ...
733,1-28-16,primary_rep,RUBIO,It was...
734,1-28-16,primary_rep,KELLY, ... supported earned path to citizenship...
735,1-28-16,primary_rep,RUBIO, ...
736,1-28-16,primary_rep,RUBIO,"It absolutely has been, and at the time in the context of that was in 2009, and 2010, where the last effort for legalization was an effort done in the Senate."
737,1-28-16,primary_rep,RUBIO,It was an effort led by several people that provided almost an instant path with very little obstacles moving forward.
738,1-28-16,primary_rep,RUBIO,What I've always said is that this issue does need to be solved.
739,1-28-16,primary_rep,RUBIO,"They've been talking about this issue for 30 years, and nothing ever happens."
740,1-28-16,primary_rep,RUBIO,"And, I'm going to tell you exactly how we're going to deal with it when I am president."
741,1-28-16,primary_rep,RUBIO,"Number one, we're going to keep ISIS out of America."
742,1-28-16,primary_rep,RUBIO,"If we don't know who you are, or why you're coming, you will not get into the United States."
