,Date,Debate Type,Speaker,Sents
244,1-28-16,primary_rep,CRUZ,"Today, we have 272."
245,1-28-16,primary_rep,CRUZ,You want to know what carpet bombing is?
246,1-28-16,primary_rep,CRUZ,"It's what we did in the first Persian Gulf war; 1,100 air attacks a day, saturation bombing that utterly destroyed the enemy."
247,1-28-16,primary_rep,CRUZ,"Right now, Barack Obama is launching between 15 and 30 air attacks a day."
248,1-28-16,primary_rep,CRUZ,He's not arming the Kurds.
249,1-28-16,primary_rep,CRUZ,We need to define the enemy.
250,1-28-16,primary_rep,CRUZ,We need to rebuild the military to defeat the enemy.
251,1-28-16,primary_rep,CRUZ,And we need to be focused and lift the rules of engagement so we're not sending our fighting men and women into combat with their arms tied behind their backs.
252,1-28-16,primary_rep,CRUZ,[applause]
253,1-28-16,primary_rep,WALLACE," Senator Rubio, does Senator Cruz's record match his rhetoric?"
254,1-28-16,primary_rep,RUBIO," Well, again, I mean, obviously, as already has been pointed out, the only budget that Ted has ever voted for is a budget that Rand Paul sponsored that brags about cutting defense spending."
255,1-28-16,primary_rep,RUBIO,And I think that's a bad idea for the following reason.
256,1-28-16,primary_rep,RUBIO,ISIS is the most dangerous jihadist group in the history of mankind.
257,1-28-16,primary_rep,RUBIO,ISIS is now found in affiliates in over a dozen countries.
258,1-28-16,primary_rep,RUBIO,ISIS is a group that burns people alive in cages; that sells off little girls as brides.
259,1-28-16,primary_rep,RUBIO,ISIS is a group that wants to trigger an apocalyptic showdown in the city of Dabiq — not the city of Dubuque; I mis-said — mis-said that wrong once [inaudible] time — the city of Dabiq in Syria.
260,1-28-16,primary_rep,RUBIO,They want to trigger an apocalyptic Armageddon showdown.
261,1-28-16,primary_rep,RUBIO,This group needs to be confronted and defeated.
262,1-28-16,primary_rep,RUBIO,They are not going to go away on their own.
263,1-28-16,primary_rep,RUBIO,They're not going to turn into stockbrokers overnight or open up a chain of car washes.
264,1-28-16,primary_rep,RUBIO,"They need to be defeated militarily, and that will take overwhelming U.S. force."
265,1-28-16,primary_rep,RUBIO,"Today, we are on pace to have the smallest Army since the end of World War II, the smallest Navy in 100 years, the smallest Air Force in our history."
266,1-28-16,primary_rep,RUBIO,You cannot destroy ISIS with a military that's being diminished.
267,1-28-16,primary_rep,RUBIO,"When I'm president, we are rebuilding the U.S. military because the world is a safer and a better place when America is the strongest military in the world."
268,1-28-16,primary_rep,RUBIO,[crosstalk]
269,1-28-16,primary_rep,WALLACE," Senator Cruz, you've got 30 seconds."
270,1-28-16,primary_rep,WALLACE,You were mentioned.
271,1-28-16,primary_rep,WALLACE,[applause]
272,1-28-16,primary_rep,CRUZ," Chris, in 1981, when Ronald Reagan came to the Oval Office, he encountered a military that had been debilitated just as the current military has, just like Jimmy Carter weakened our readiness, undermined our ability to defend this country, so too has Barack Obama."
273,1-28-16,primary_rep,CRUZ,"Just as morale in the military has plummeted in the last seven, so it had then."
274,1-28-16,primary_rep,CRUZ,"What Reagan did is he began with tax reform and regulatory reform, unleashing the engine of the American free enterprise system."
275,1-28-16,primary_rep,CRUZ,It brought booming economic growth and that growth fueled rebuilding the military.
276,1-28-16,primary_rep,CRUZ,I intend to do the exact same thing to defeat radical Islamic terrorism —
277,1-28-16,primary_rep,WALLACE, Gentlemen.
278,1-28-16,primary_rep,CRUZ," ... and to devote the resources from the booming economy to rebuilding our Navy, rebuilding our Air Force, rebuilding our Army and ensuring we have the capacity to keep this country safe."
279,1-28-16,primary_rep,PAUL, My budget was mentioned.
280,1-28-16,primary_rep,PAUL,My budget was mentioned.
281,1-28-16,primary_rep,WALLACE," May I — may I just say, we are going to continue the questions about foreign terror, gentlemen, right after this break."
282,1-28-16,primary_rep,KELLY," But first, you can join tonight's conversation right from home."
283,1-28-16,primary_rep,KELLY,Go to google.com or open your Google search app and search Fox News debate to vote on which candidate you think has the best plan to defeat ISIS.
284,1-28-16,primary_rep,KELLY,We'll be right back.
285,1-28-16,primary_rep,KELLY,[commercial break]
286,1-28-16,primary_rep,BAIER, Welcome back.
287,1-28-16,primary_rep,BAIER,Let's get right back to the questions.
288,1-28-16,primary_rep,BAIER,Chris.
289,1-28-16,primary_rep,WALLACE, Thank you.
290,1-28-16,primary_rep,WALLACE,"Governor Christie, you have compared both Senators Cruz and Rubio to Barack Obama, saying that we cannot afford another inexperienced President."
291,1-28-16,primary_rep,WALLACE,You've also said that Senator Cruz's vote to curtail the NSA surveillance program made America less safe.
292,1-28-16,primary_rep,WALLACE,Is either of them ready to be Commander in Chief?
293,1-28-16,primary_rep,CHRISTIE," Well, let me say that I do believe that the vote on NSA made the country less safe."
294,1-28-16,primary_rep,CHRISTIE,"Well, let me tell you what the country should really be worried about."
295,1-28-16,primary_rep,CHRISTIE,"I watched that town hall meeting with the Democrats the other night, and I heard Hillary Clinton asked a direct question by an Iowan, and that's what Iowans like to do."
296,1-28-16,primary_rep,CHRISTIE,They like to ask direct questions.
297,1-28-16,primary_rep,CHRISTIE,"And, they asked about her email situation."
298,1-28-16,primary_rep,CHRISTIE,"And, here's what she said to the American people."
299,1-28-16,primary_rep,CHRISTIE,She did it for convenience.
300,1-28-16,primary_rep,CHRISTIE,For her convenience.
301,1-28-16,primary_rep,CHRISTIE,She put America's secrets at risk for her convenience.
302,1-28-16,primary_rep,CHRISTIE,She put American intelligence officers at risk for her convenience.
303,1-28-16,primary_rep,CHRISTIE,She put American strategy at risk for her convenience.
304,1-28-16,primary_rep,CHRISTIE,"Let me tell you who's not qualified to be President of the United States, Chris."
305,1-28-16,primary_rep,CHRISTIE,Hillary Rodham Clinton did that to our country.
306,1-28-16,primary_rep,CHRISTIE,She is not qualified to be President of the United States.
307,1-28-16,primary_rep,CHRISTIE,"[cheering]

The fact is what we need is someone on that stage who has been tested, who has been through it, who has made decisions, who has sit in the chair of consequence and can prosecute the case against Hillary Clinton on... [bell rings] ... that stage, and that is exactly what I am ready to do."
308,1-28-16,primary_rep,CHRISTIE,[applause]
309,1-28-16,primary_rep,WALLACE, Governor Bush...
310,1-28-16,primary_rep,CRUZ, Chris?
311,1-28-16,primary_rep,CRUZ,Chris I was mentioned in that question.
312,1-28-16,primary_rep,BUSH," No, you weren't."
313,1-28-16,primary_rep,BUSH,"Your name wasn't mentioned, Ted."
314,1-28-16,primary_rep,CRUZ," ... Actually, I was..."
315,1-28-16,primary_rep,BUSH," ... Chris, keep it coming..."
316,1-28-16,primary_rep,WALLACE, ...
317,1-28-16,primary_rep,WALLACE,I don't think that your name was mentioned...
318,1-28-16,primary_rep,CRUZ," ... Chris, your questions that you..."
319,1-28-16,primary_rep,WALLACE," ... Sir, I think — I think the question was..."
320,1-28-16,primary_rep,CRUZ, ... What was your question...
321,1-28-16,primary_rep,WALLACE, ...
322,1-28-16,primary_rep,WALLACE,"It's not my question that you get a chance to respond to, it's his answer."
323,1-28-16,primary_rep,WALLACE,"[laughter]

You don't get 30 seconds to respond to me..."
324,1-28-16,primary_rep,CRUZ, ...
325,1-28-16,primary_rep,CRUZ,Your question was you have disagreed... [audience reaction]
326,1-28-16,primary_rep,WALLACE, ... You don't get 30 seconds to respond to me...
327,1-28-16,primary_rep,CRUZ, ... [inaudible] opening statement.
328,1-28-16,primary_rep,WALLACE, ...
329,1-28-16,primary_rep,WALLACE,If I could go on.
330,1-28-16,primary_rep,WALLACE,"Sir, I know you like to argue about the rules, but we're going to conduct a debate..."
331,1-28-16,primary_rep,BUSH, ...
332,1-28-16,primary_rep,BUSH,Thank you Chris...
333,1-28-16,primary_rep,WALLACE, ...
334,1-28-16,primary_rep,WALLACE,Governor Bush...
335,1-28-16,primary_rep,CRUZ, ...
336,1-28-16,primary_rep,CRUZ,"This entire question was an attack, but that's [inaudible]"
337,1-28-16,primary_rep,WALLACE," Governor Bush, here's the question — I'm going to ask Governor Bush the question."
338,1-28-16,primary_rep,WALLACE,"You criticized several candidates in this field on this stage for what you call unrealistic ideas about how to fight terrorists, including Rubio, and Cruz on the issue of their refusing to give the President authority to enforce the redline in Syria."
339,1-28-16,primary_rep,WALLACE,"But, given the fact that your brother got us into two wars in Iraq and Afghanistan that have still not ended."
340,1-28-16,primary_rep,WALLACE,"That have still not ended, what lessons have you learned from his mistakes, sir?"
341,1-28-16,primary_rep,BUSH," Well, first, I was critical of the Senators not giving the authorization for the use of military force."
342,1-28-16,primary_rep,BUSH,They should have made it more open ended for the next president.
343,1-28-16,primary_rep,BUSH,"We shouldn't have the war fighters have their arms tied behind their back as President Obama wanted to do, but they had a chance to show support and it wasn't popular at the time."
344,1-28-16,primary_rep,BUSH,"It became popular after the attack in Paris, and San Bernardino."
345,1-28-16,primary_rep,BUSH,Now we hear the tough talk.
346,1-28-16,primary_rep,BUSH,"Prior to that, in the Reagan Library, I gave a detailed plan."
347,1-28-16,primary_rep,BUSH,Exactly what to do as it relates to ISIS.
348,1-28-16,primary_rep,BUSH,"And it is from the lessons from history that we do this because if we allow this to fester, we're going to have Islamic terrorism, multi-generations of it all across this country."
349,1-28-16,primary_rep,BUSH,"The caliphate of ISIS has to be destroyed, which means we need to arm directly to Kurds, imbed our troops with the Iraqi military, re engage with the Sunni tribal leaders."
350,1-28-16,primary_rep,BUSH,Get the lawyers off the damn backs of the military once and for all.
351,1-28-16,primary_rep,BUSH,"[cheering]

Have a no fly zone in Syria and create safe zones to deal with the refugees."
352,1-28-16,primary_rep,BUSH,"But, more importantly, to train a Sunni-led force in Syria to take out ISIS with our support... [bell rings] ... ground and air."
353,1-28-16,primary_rep,BUSH,"That's what we need to to, and I laid that out prior to the crisis with the advice of a lot of people, including 12 Medal of Honor recipients that I'm proud that they're supporting my campaign."
354,1-28-16,primary_rep,BUSH,[applause]
355,1-28-16,primary_rep,WALLACE," Senator Cruz, now you get a chance to respond."
356,1-28-16,primary_rep,CRUZ," Chris, I would note that that the last four questions have been, ""Rand, please attack Ted."
357,1-28-16,primary_rep,CRUZ,"Marco, please attack Ted."
358,1-28-16,primary_rep,CRUZ,"Chris, please attack Ted."
359,1-28-16,primary_rep,CRUZ,"Jeb, please attack Ted..."" [audience reaction]

Let me just say this..."
360,1-28-16,primary_rep,WALLACE, ...
361,1-28-16,primary_rep,WALLACE,"It is a debate, sir."
362,1-28-16,primary_rep,CRUZ," ... Well, no, no."
363,1-28-16,primary_rep,CRUZ,"A debate actually is a policy issue, but I will say this."
364,1-28-16,primary_rep,CRUZ,"Gosh, if you guys ask one more mean question I may have to leave the stage."
365,1-28-16,primary_rep,CRUZ,"[applause]

Chris, the most important determination any voter is going to make in this election is who's best prepared to be Commander in Chief."
366,1-28-16,primary_rep,CRUZ,"Who has the experience, who has the knowledge, who has the judgement, who has the clarity, and vision and strength of resolve to keep this country safe."
367,1-28-16,primary_rep,CRUZ,"That is what this debate is all about, and I would suggest let's stay focused on those issues — rather than just attacks directed at each other."
368,1-28-16,primary_rep,WALLACE, I think the questions were about issues.
369,1-28-16,primary_rep,WALLACE,"Senator Rubio, what would you like to respond sir... [applause]

[crosstalk]"
370,1-28-16,primary_rep,PAUL, ...
371,1-28-16,primary_rep,PAUL,"Senator Cruz, I'd like to respond..."
372,1-28-16,primary_rep,RUBIO," ... First of all — Let me go first, and then you can please recognize Rand after."
373,1-28-16,primary_rep,RUBIO,"[laughter]

First of all..."
374,1-28-16,primary_rep,PAUL, ... and I'd like to respond.
375,1-28-16,primary_rep,RUBIO," ... do I go — let me go first, and then you can please recognize Rand after."
376,1-28-16,primary_rep,RUBIO,But... [laughter] ... first of all...
377,1-28-16,primary_rep,WALLACE, Thank you.
378,1-28-16,primary_rep,PAUL," Thank you, Marco."
379,1-28-16,primary_rep,RUBIO," ... first of all, I'm — don't worry, I'm not leaving the stage no matter what you ask me."
380,1-28-16,primary_rep,WALLACE, Good.
381,1-28-16,primary_rep,RUBIO," And second of all... [applause] ... and I think — you know, Governor — Jeb, you — the attack that — the authorization that Barack Obama asked for was not against ISIS."
382,1-28-16,primary_rep,RUBIO,It was against Assad.
383,1-28-16,primary_rep,RUBIO,And John Kerry described it as attacks that would be unbelievably small.
384,1-28-16,primary_rep,RUBIO,I don't think the United States should be engaged in symbolic military activity.
385,1-28-16,primary_rep,RUBIO,"So it was not against ISIS, it was against — it was against Assad."
386,1-28-16,primary_rep,RUBIO,I think the United States military is operating under rules of engagement that are too strict... [bell rings] ...and that do not allow us to pursue victory.
387,1-28-16,primary_rep,RUBIO,"When I'm president, that will change."
388,1-28-16,primary_rep,RUBIO,[crosstalk]
389,1-28-16,primary_rep,WALLACE," Senator Paul, go ahead."
390,1-28-16,primary_rep,PAUL, Thank you.
391,1-28-16,primary_rep,PAUL,"The issue in Syria's a very important one, and it's one we need to get right."
392,1-28-16,primary_rep,PAUL,"The question is, should we be bombing both sides of the war?"
393,1-28-16,primary_rep,PAUL,Some want to topple Assad.
394,1-28-16,primary_rep,PAUL,"In fact, they want to bomb ISIS and Assad simultaneously."
395,1-28-16,primary_rep,PAUL,"I think that's a really, really bad idea."
396,1-28-16,primary_rep,PAUL,"In fact, I've said for several years that arming the allies of ISIS will make the situation worse, That what we really need to do is defeat ISIS."
397,1-28-16,primary_rep,PAUL,"But if you defeat Assad, what you will wind up with is a larger and more powerful ISIS that occupies that space."
398,1-28-16,primary_rep,PAUL,You might — you may well see an ISIS that takes over all of Syria.
399,1-28-16,primary_rep,PAUL,[bell rings]
400,1-28-16,primary_rep,KASICH," Chris... [applause] ... there was a question about foreign policy, by the way, and experience."
401,1-28-16,primary_rep,KASICH,"And I — I thought, if I didn't jump in, I might not be able to tell everybody this."
402,1-28-16,primary_rep,KASICH,I think they'd want to hear it.
403,1-28-16,primary_rep,KASICH,"Look, I served on..."
404,1-28-16,primary_rep,WALLACE, Well... [crosstalk] ... we'll be talking about foreign policy a little bit later.
405,1-28-16,primary_rep,WALLACE,We're going to talk...
406,1-28-16,primary_rep,KELLY, We have a lot — we have a lot to cover.
407,1-28-16,primary_rep,KELLY,"But we want to — we want to turn the page to domestic...

[crosstalk]"
408,1-28-16,primary_rep,KASICH, ... but wait a minute...
409,1-28-16,primary_rep,KELLY," No, no."
410,1-28-16,primary_rep,KELLY,No.
411,1-28-16,primary_rep,KASICH, ...the only reason is — look...
412,1-28-16,primary_rep,KELLY," No no no, because we want to turn the page to domestic terror, and let me tell you why: we're partnering with Google on this debate, and they're telling us..."
413,1-28-16,primary_rep,KASICH, OK.
414,1-28-16,primary_rep,KELLY, ... that their search results have gone through the roof on — on people...
415,1-28-16,primary_rep,KASICH," I've always listened to you, Megyn."
416,1-28-16,primary_rep,KASICH,Go ahead.
417,1-28-16,primary_rep,KELLY," ... you're a good man, Governor Kasich."
418,1-28-16,primary_rep,KASICH, Yes — thank you.
419,1-28-16,primary_rep,KELLY," People — the search results — the searches for terror issues, for safety issues in America have gone through the roof, increased over 400 percent since 2008."
420,1-28-16,primary_rep,KELLY,People are worried.
421,1-28-16,primary_rep,KELLY,"They're worried about what's happening in the country and about a domestic terror attack, as all of you know."
422,1-28-16,primary_rep,KELLY,"Now, when combating this threat, Senator Rubio, you've advocated closing down mosques — we'll get back to you."
423,1-28-16,primary_rep,KELLY,"Well, you have advocated closing down — closing down mosques, diners, any place where radicalization is occurring."
424,1-28-16,primary_rep,KELLY,You told me that.
425,1-28-16,primary_rep,KELLY,But the Supreme Court has made clear that hateful speech is generally protected by the First Amendment.
426,1-28-16,primary_rep,KELLY,"In other words, radical Muslims have the right to be radical Muslims, unless they turn to terror."
427,1-28-16,primary_rep,KELLY,Doesn't your position run afoul of the First Amendment?
428,1-28-16,primary_rep,RUBIO," Megyn, that's the problem."
429,1-28-16,primary_rep,RUBIO,Radical Muslims and radical Islam is not just hate talk.
430,1-28-16,primary_rep,RUBIO,It's hate action.
431,1-28-16,primary_rep,RUBIO,They blow people up.
432,1-28-16,primary_rep,RUBIO,Look what they did in San Bernardino.
433,1-28-16,primary_rep,RUBIO,"Look at the attack they inspired in Philadelphia, that the White House still refuses to link to terror, where a guy basically shot a police officer three times."
434,1-28-16,primary_rep,RUBIO,"He told the police, ""I did it because I was inspired by ISIS,"" and to this day, the White House still refuses to acknowledge it had anything to do with terror."
435,1-28-16,primary_rep,RUBIO,"Look, the threat we face from ISIS is unprecedented."
436,1-28-16,primary_rep,RUBIO,There has never been a jihadist group like this.
437,1-28-16,primary_rep,RUBIO,They have affiliates in over a dozen countries now.
438,1-28-16,primary_rep,RUBIO,"They are the best funded radical jihadist group in the history of the world, and they have shown a sophisticated understanding of the laws of other countries on how to insert fighters into places, and they are actively plotting to attack us here at home and around the world."
439,1-28-16,primary_rep,RUBIO,We must keep America safe from this threat.
440,1-28-16,primary_rep,RUBIO,"And yes, when I am president of the United States, if there is some place in this country where radical jihadists are planning to attack the United States, we will go after them wherever they are, and if we capture them alive, they are going to Guantanamo."
441,1-28-16,primary_rep,RUBIO,[applause]
442,1-28-16,primary_rep,PAUL, [inaudible].
443,1-28-16,primary_rep,KELLY," Senator Paul, do you agree with that?"
444,1-28-16,primary_rep,KELLY,"We're gonna close down mosques, we're gonna close down diners where we think radical thinking's occurring?"
445,1-28-16,primary_rep,KELLY,[crosstalk]
446,1-28-16,primary_rep,PAUL," Yeah, no, I think that's a — that's a huge mistake, to be closing down mosques."
447,1-28-16,primary_rep,PAUL,"But I would say that if you want to defend the country, it begins with border security."
448,1-28-16,primary_rep,PAUL,And this is where I've had my disagreement with Senator Rubio.
449,1-28-16,primary_rep,PAUL,"When he brought forward the ""Gang of Eight"" bill to give citizenship to those who came here illegally, I put forward an amendment that says we should have more scrutiny on those who are coming as students, those who are coming as immigrants, those who are coming as refugees, because we had two refugees come to my town in Bowling Green and try to attack us."
450,1-28-16,primary_rep,PAUL,Marco opposed this because they made a deal.
451,1-28-16,primary_rep,PAUL,He made a deal with Chuck Schumer that he would oppose any conservative amendments.
452,1-28-16,primary_rep,PAUL,"And I think that's a mistake, and I just don't think Marco can have it both ways."
453,1-28-16,primary_rep,PAUL,You can't be in favor of defend us... [bell rings] ... against Islam — radical Islam — if you're not for border security.
454,1-28-16,primary_rep,RUBIO, Might I respond?
455,1-28-16,primary_rep,RUBIO,"[applause]

The first thing — I don't know of anyone who's not in favor of fully vetting people that are trying to come into this country, other than perhaps Barack Obama and Hillary Clinton."
456,1-28-16,primary_rep,RUBIO,I think we all support that.
457,1-28-16,primary_rep,RUBIO,Rand's amendment was not the right way to do it.
458,1-28-16,primary_rep,RUBIO,I do believe that people who are trying to come to the United States — this country has a right to know who they are and why they are coming.
459,1-28-16,primary_rep,RUBIO,"And that's why I've been clear, when I am the president of the United States of America, we don't know who you are, and we don't know why you're trying to come to the United States, you are not going to get in, because the radical threat that we now face from ISIS is extraordinary and unprecedented... [bell rings] ... and when I'm president, we are keeping ISIS out of America."
460,1-28-16,primary_rep,KELLY," Governor Christie, let's talk about profiling."
461,1-28-16,primary_rep,KELLY,"[applause]

In December..."
462,1-28-16,primary_rep,CHRISTIE, Talk about what?
463,1-28-16,primary_rep,CHRISTIE,I...
464,1-28-16,primary_rep,KELLY, ... profiling.
465,1-28-16,primary_rep,KELLY,Profiling.
466,1-28-16,primary_rep,KELLY,"In December, two radical Muslims killed 14 people in San Bernardino, California."
467,1-28-16,primary_rep,KELLY,"Neighbors of the terrorists said that they did not report the couple to law enforcement prior to the crime, because they were afraid that they would be accused of profiling."
468,1-28-16,primary_rep,KELLY,"Now, you have said that we should not profile."
469,1-28-16,primary_rep,KELLY,How do you square that with the San Bernardino case?
470,1-28-16,primary_rep,CHRISTIE," Well, because you can do it without profiling, Megyn, when you do it on the facts."
471,1-28-16,primary_rep,CHRISTIE,What those facts knew was that these folks had weapons.
472,1-28-16,primary_rep,CHRISTIE,They knew that they were talking about trying to take our country and attack it.
473,1-28-16,primary_rep,CHRISTIE,"That's not profiling, that's law enforcement."
474,1-28-16,primary_rep,CHRISTIE,And that's the difference between somebody who knows how to do this and somebody who's never done it before.
475,1-28-16,primary_rep,KELLY, They didn't know they were going to attack the country.
476,1-28-16,primary_rep,CHRISTIE," They knew they were talking about the issues of attacking people, Megyn."
477,1-28-16,primary_rep,CHRISTIE,They knew that.
478,1-28-16,primary_rep,CHRISTIE,[crosstalk]
479,1-28-16,primary_rep,KELLY, That's not true.
480,1-28-16,primary_rep,KELLY,The neighbors said they saw men going in and out of the garage.
481,1-28-16,primary_rep,KELLY,They saw packages being delivered.
482,1-28-16,primary_rep,KELLY,"They saw Muslims, and they did not think that was enough to call the cops."
483,1-28-16,primary_rep,KELLY,Do you?
484,1-28-16,primary_rep,CHRISTIE," Listen, I think that what people should do is use their common sense."
485,1-28-16,primary_rep,CHRISTIE,"And the fact is, let law enforcement make those decisions."
486,1-28-16,primary_rep,CHRISTIE,I've told people that from the time I was U.S. attorney 13 years ago.
487,1-28-16,primary_rep,CHRISTIE,"It's not for them to make those decisions about whether or not something is legal or illegal, or profiling or not."
488,1-28-16,primary_rep,CHRISTIE,"You see something that's suspicious, you call law enforcement and let law enforcement make those decisions."
489,1-28-16,primary_rep,CHRISTIE,That's what should be done.
490,1-28-16,primary_rep,CHRISTIE,That can be done.
491,1-28-16,primary_rep,CHRISTIE,That can be done without profiling people.
492,1-28-16,primary_rep,CHRISTIE,"What that is, is just common sense."
493,1-28-16,primary_rep,CHRISTIE,They thought something was wrong.
494,1-28-16,primary_rep,CHRISTIE,And here's the problem in this country right now.
495,1-28-16,primary_rep,CHRISTIE,"The problem is that Barack Obama has made law enforcement the enemy, Hillary Clinton has made law enforcement the enemy."
496,1-28-16,primary_rep,CHRISTIE,"They're not supporting our law enforcement officers, it's making everybody nervous to get out of their cars, if you're a law enforcement officer."
497,1-28-16,primary_rep,CHRISTIE,It's making... [bell rings]... everybody nervous to get out of their cars if you're a law enforcement officer.
498,1-28-16,primary_rep,CHRISTIE,"[bell rings]

It's making people in neighborhoods nervous to go to law enforcement."
499,1-28-16,primary_rep,CHRISTIE,"As president, I will support law enforcement and we'll stop radical terrorist attacks in this country by supporting our intelligence community and law enforcement community."
500,1-28-16,primary_rep,CHRISTIE,[applause]
