,Date,Debate Type,Speaker,Sents
502,11-10-15,primary_rep,FIORINA,We need to try the free market.
503,11-10-15,primary_rep,FIORINA,The free market.
504,11-10-15,primary_rep,FIORINA,Where people actually have to compete.
505,11-10-15,primary_rep,FIORINA,"[applause]

And, we 'ought to have the government ensure that you must — and I don't use that term often, that government 'ought to do something, but every healthcare provider 'ought to publish its costs, its prices, its outcomes, because as patients we don't know what we're buying."
506,11-10-15,primary_rep,FIORINA,"[applause] Now, let me just say — let me just say, I know more about innovation and entrepreneurship than anyone on this panel because I have led innovative businesses in the most highly competitive industry in the world for decades."
507,11-10-15,primary_rep,FIORINA,"The truth is the secret sauce of America is innovation, and entrepreneurship, it is why we must cut our government down to size, and hold it accountable."
508,11-10-15,primary_rep,FIORINA,"It's why we have to take our government back, because innovation and entrepreneurship is crushed by the crushing load of a 73,000 page tax code."
509,11-10-15,primary_rep,FIORINA,"It is crushed... [bell ringing]

...by regulatory thicket that is so vast we don't even know what's in it anymore."
510,11-10-15,primary_rep,FIORINA,"It is crushed as well by government bureaucrats who don't do their jobs very well, and who are not held accountable, which is why I've said we got to take our government back, and to do that, we have to know where every dollar being spent, and be able to move any dollar."
511,11-10-15,primary_rep,FIORINA,"We have to hack through this regulatory thicket, repeal so much, but, also, know what's in that regulatory thicket — we don't even know what regulations have been passed."
512,11-10-15,primary_rep,FIORINA,"Third, we need to build a meritocracy — Scott Walker, by the way, is trying now to do in Wisconsin... [bell ringing]...Finally, we need to get to a three page tax code, and, yes, that plan exists."
513,11-10-15,primary_rep,BARTIROMO," Just to be clear, you want to repeal Obamacare... [applause]..but, what's the alternative?"
514,11-10-15,primary_rep,FIORINA," Sorry, I can't hear you."
515,11-10-15,primary_rep,BARTIROMO," Just to be clear, you say you would repeal Obamacare..."
516,11-10-15,primary_rep,FIORINA, ...Absolutely...
517,11-10-15,primary_rep,BARTIROMO," ...But, what is the alternative..."
518,11-10-15,primary_rep,FIORINA, ...You need to give...
519,11-10-15,primary_rep,BARTIROMO, ...and how does that help small business...
520,11-10-15,primary_rep,FIORINA, The alternative is to allow states to manage high risk pools for those who really need help.
521,11-10-15,primary_rep,FIORINA,"Look, I'm a cancer survivor, OK?"
522,11-10-15,primary_rep,FIORINA,I understand that you cannot have someone who's battled cancer just become known as a pre-existing condition.
523,11-10-15,primary_rep,FIORINA,I understand that you cannot allow families to go bankrupt if they truly need help.
524,11-10-15,primary_rep,FIORINA,"But, I also understand that Obamacare isn't helping anyone."
525,11-10-15,primary_rep,FIORINA,"We're throwing more, and more people into Medicaid, and fewer, and fewer doctors are taking those payments."
526,11-10-15,primary_rep,FIORINA,"The point is Obamacare is crushing small businesses, it is not helping the families it was intended to help."
527,11-10-15,primary_rep,FIORINA,"So, let us allow states to manage high risk pools."
528,11-10-15,primary_rep,FIORINA,"Let us try the one thing in health insurance we've never tried, the free market."
529,11-10-15,primary_rep,FIORINA,"Let us ensure that as patients, and customers..."
530,11-10-15,primary_rep,BARTIROMO, ...Thank you...
531,11-10-15,primary_rep,FIORINA, ...that we have information to shop wisely for our health care.
532,11-10-15,primary_rep,CAVUTO," Alright, thank you."
533,11-10-15,primary_rep,CAVUTO,We're going to take a break here.
534,11-10-15,primary_rep,CAVUTO,"Coming up, a big issue many Americans are facing, taxes."
535,11-10-15,primary_rep,CAVUTO,"The Republican Presidential Debate continues now, live, from Milwaukee."
536,11-10-15,primary_rep,CAVUTO,[commercial break]
537,11-10-15,primary_rep,CAVUTO, Welcome back to the Republican presidential debate live from Milwaukee.
538,11-10-15,primary_rep,CAVUTO,Let's get back to the questions.
539,11-10-15,primary_rep,CAVUTO,"And we want to touch on obviously one of the biggest of this issue in this year, taxes."
540,11-10-15,primary_rep,CAVUTO,And this will go to several of you.
541,11-10-15,primary_rep,CAVUTO,One of the biggest economic concerns of course in the country are taxes.
542,11-10-15,primary_rep,CAVUTO,Facebook data certainly backs that up.
543,11-10-15,primary_rep,CAVUTO,"Once again the green on this map that we're going to see here shows how the conversation around taxes is resonating across the nation, especially here in Wisconsin."
544,11-10-15,primary_rep,CAVUTO,"First off, Dr. Carson, to you."
545,11-10-15,primary_rep,CAVUTO,"You say you are in favor of a tax system, I guess akin to tithing, sir, with a flat tax rate of up to 15 percent because you said, if everybody pays this, I think God is a pretty fair guy, so tithing is a pretty fair process."
546,11-10-15,primary_rep,CAVUTO,But Donald Trump says that is not fair.
547,11-10-15,primary_rep,CAVUTO,That wealthier taxpayers should pay a higher rate because it's a fair thing to do.
548,11-10-15,primary_rep,CAVUTO,"So whose plan would God endorse then, Doctor?"
549,11-10-15,primary_rep,CAVUTO,"[laughter]

Yours or Mr. Trump's?"
550,11-10-15,primary_rep,CARSON," Well, you know, when I say tithing, I'm talking about the concept of proportionality."
551,11-10-15,primary_rep,CAVUTO, Right.
552,11-10-15,primary_rep,CARSON, Everybody should pay the same proportion of what they make.
553,11-10-15,primary_rep,CARSON,"You make $10 billion, you pay a billion."
554,11-10-15,primary_rep,CARSON,"You make $10, you pay one."
555,11-10-15,primary_rep,CARSON,You get same rights and privileges.
556,11-10-15,primary_rep,CARSON,I don't see how anything gets a whole lot fairer than that.
557,11-10-15,primary_rep,CARSON,But you also have to get rid of all the deductions and all the loopholes because that is the thing that tilts it in one direction or another.
558,11-10-15,primary_rep,CARSON,And you have to set the rate at an appropriate level.
559,11-10-15,primary_rep,CARSON,"Now I will say that, there are a lot of people who say, if you get rid of the deductions, you ruin the American dream because, you know, home mortgage deduction."
560,11-10-15,primary_rep,CARSON,"But the fact of the matter is, people had homes before 1913 when we introduced the federal income tax, and later after that started deductions."
561,11-10-15,primary_rep,CARSON,And they say there will be no more charitable giving.
562,11-10-15,primary_rep,CARSON,We had churches before that and charitable organizations before that.
563,11-10-15,primary_rep,CARSON,"The fact of the matter is, I believe if you put more money in people's pockets that they will actually be more generous rather than less generous."
564,11-10-15,primary_rep,CARSON,And it's... [applause] ... the money that they earned.
565,11-10-15,primary_rep,CARSON,"And, the other thing is, I do care about the poor people."
566,11-10-15,primary_rep,CARSON,"And in the system that we're putting together, there will be a rebate for people at the poverty level."
567,11-10-15,primary_rep,CARSON,"But I also want to emphasize the fact that as we get the economy moving, and I hope I get a question about how do we get the economy moving, there will be a lot more opportunities for poor people not to be poor people because this is America."
568,11-10-15,primary_rep,CARSON,This is the land of dreams.
569,11-10-15,primary_rep,CARSON,And our policies should be aimed at allowing people to realize that dream.
570,11-10-15,primary_rep,CARSON,[applause]
571,11-10-15,primary_rep,CAVUTO, Thank you very much.
572,11-10-15,primary_rep,CAVUTO,"Senator Paul, you said you want to blow up the tax code and start over with an across-the-board 14.5 percent fair and flat tax."
573,11-10-15,primary_rep,CAVUTO,You happily offered that it is not revenue neutral and that's the idea.
574,11-10-15,primary_rep,CAVUTO,You want to choke off the amount of money coming into Washington.
575,11-10-15,primary_rep,CAVUTO,"But don't you risk, sir, creating a near-term budget crisis just as your presidency would be beginning?"
576,11-10-15,primary_rep,PAUL," Well, it's a great question, Neil, and thanks for including me in the tax debate."
577,11-10-15,primary_rep,PAUL,"I think what's important about the tax debate is, is that we have to ask the question, where is money best spent, in the private sector or in the government sector?"
578,11-10-15,primary_rep,PAUL,"I want a government really, really small, so small you can barely see it."
579,11-10-15,primary_rep,PAUL,So I want lower taxes and much more money in the private sector.
580,11-10-15,primary_rep,PAUL,"[cheering and applause]

My tax plan, however, is the only tax plan among any of the candidates on the stage that is part of a balanced budget plan."
581,11-10-15,primary_rep,PAUL,I put forward three plans that actually balance the budget over a five-year period.
582,11-10-15,primary_rep,PAUL,Each of these plans have details on exactly where we would cut.
583,11-10-15,primary_rep,PAUL,"The question came up earlier, where would you cut?"
584,11-10-15,primary_rep,PAUL,Nobody likes to say where they would cut.
585,11-10-15,primary_rep,PAUL,I've put pencil to paper and done three budgets that actually balance.
586,11-10-15,primary_rep,PAUL,I'm also in favor of a plan called the penny plan where we'd just cut 1 percent across the board and the budget actually balances in less than five years.
587,11-10-15,primary_rep,PAUL,So I think what is extraordinary about my tax plan is it is in the context of balancing the budget.
588,11-10-15,primary_rep,PAUL,What is also extraordinary about my tax plan is it gets rid of the payroll tax.
589,11-10-15,primary_rep,PAUL,"Democrats demagogue this issue to death, and when they do they say, oh, a millionaire would get a bigger tax cut than someone making $10,000."
590,11-10-15,primary_rep,PAUL,"That's proportionality, as Ben is trying to explain to folks."
591,11-10-15,primary_rep,PAUL,"But the thing is, is if we get rid of the payroll tax, everybody is going to get a tax cut."
592,11-10-15,primary_rep,PAUL,And this is something that I think the public at large will support and could win an election.
593,11-10-15,primary_rep,PAUL,[applause]
594,11-10-15,primary_rep,CAVUTO, There are no deductions on your — under your plan?
595,11-10-15,primary_rep,PAUL," Ours is 14.5 percent for corporations, 14.5 percent for individuals."
596,11-10-15,primary_rep,PAUL,No payroll tax for the employee.
597,11-10-15,primary_rep,PAUL,"The business tax pays for social security, and there would be two remaining deductions — home mortgage and charity."
598,11-10-15,primary_rep,CAVUTO," Thank you, Senator."
599,11-10-15,primary_rep,PAUL, Thank you.
600,11-10-15,primary_rep,PAUL,[applause]
601,11-10-15,primary_rep,BARTIROMO," Senator Cruz, there isn't anyone in this audience or watching at home tonight who would not like to pay less in taxes."
602,11-10-15,primary_rep,BARTIROMO,"Most people just want a fair shake, and they don't want their money to be wasted."
603,11-10-15,primary_rep,BARTIROMO,But explain how your plan works.
604,11-10-15,primary_rep,BARTIROMO,How can you cut taxes as much as you propose without running up debt and deficits?
605,11-10-15,primary_rep,CRUZ," Well, sure, you put your finger on what the problem is."
606,11-10-15,primary_rep,CRUZ,The current system isn't fair.
607,11-10-15,primary_rep,CRUZ,Washington is fundamentally corrupt.
608,11-10-15,primary_rep,CRUZ,There are more words in the IRS code than there are in the Bible — and — and not a one of them is as good.
609,11-10-15,primary_rep,CRUZ,"[laughter]

Every one of them reflects a carve-out or a subsidy, and it's all about empowering the Washington cartel."
610,11-10-15,primary_rep,CRUZ,"My simple Flat Tax says that, for a family of four, for the first $36,000 you earn, you pay no taxes whatsoever."
611,11-10-15,primary_rep,CRUZ,"No income taxes, no payroll taxes, no nothing."
612,11-10-15,primary_rep,CRUZ,"Above that, every American pays 10 percent across the board — a flat, fair tax."
613,11-10-15,primary_rep,CRUZ,Which means that no longer do you have hedge-fund billionaires paying a lower tax rate than their secretaries.
614,11-10-15,primary_rep,CRUZ,"On the business side, I've got a business flat tax of 16 percent — again, that applies across the board."
615,11-10-15,primary_rep,CRUZ,"Right now, with our corporate income tax, giant corporations with armies of accountants regularly are paying little to no taxes while small businesses are getting hammered."
616,11-10-15,primary_rep,CRUZ,This is fair and across-the-board.
617,11-10-15,primary_rep,CRUZ,"Now, you ask, how do the numbers add up?"
618,11-10-15,primary_rep,CRUZ,"I would encourage folks, if you go to our website, tedcruz.org, we have the specific numbers on the website."
619,11-10-15,primary_rep,CRUZ,"This plan eliminates the payroll tax, eliminates the death tax, eliminates the corporate income tax, and it abolishes the IRS."
620,11-10-15,primary_rep,CRUZ,"[applause]

And the effect of that is incredible economic growth."
621,11-10-15,primary_rep,CRUZ,"It means every income group will see double-digit increases, from the very poorest to the very weakest, of at least 14 percent."
622,11-10-15,primary_rep,CRUZ,"So if you're a single mom, if you're making $40,000 a year, what that means is an extra about $5,000 in your pocket to provide for your kids, to make ends meet."
623,11-10-15,primary_rep,CRUZ,"It has a powerful, powerful effect."
624,11-10-15,primary_rep,CRUZ,"And there's one other really powerful feature of my plan, which is that it's border-adjustable."
625,11-10-15,primary_rep,CRUZ,"Which means, if you're an exporter — if you're a farmer, if you're a rancher, if you're a manufacturer, you don't pay the businesses flat tax."
626,11-10-15,primary_rep,CRUZ,"Exports are free of that tax, but all imports pay that 16 percent business flat tax, which means this tax plan would cause jobs to boom, and it would let America compete with China and the world on a level playing field."
627,11-10-15,primary_rep,CRUZ,[applause]
628,11-10-15,primary_rep,BARTIROMO, But you haven't told us how to pay for it.
629,11-10-15,primary_rep,CRUZ," Well, the numbers the Tax Foundation had put out is that the static cost of the plan is $3.6 trillion over 10 years, but the dynamic cost of the plan, which — which is the cost that factors in growth, is about $768 billion."
630,11-10-15,primary_rep,CRUZ,It is less than a trillion.
631,11-10-15,primary_rep,CRUZ,"It costs less than virtually every other plan people have put up here, and yet it produces more growth and it's one of the very few plans that abolishes the IRS."
632,11-10-15,primary_rep,CRUZ,"But on top of that, today, we rolled out a spending plan."
633,11-10-15,primary_rep,CRUZ,$500 billion in specific cuts — five major agencies that I would eliminate.
634,11-10-15,primary_rep,CRUZ,"The IRS, the Department of Commerce, the Department of Energy, the Department of Commerce, and HUD — and then 25 specific programs."
635,11-10-15,primary_rep,CRUZ,"Again, that's on our website at tedcruz.org."
636,11-10-15,primary_rep,CRUZ,You want to look at specificity?
637,11-10-15,primary_rep,CRUZ,"It's easy for everyone to say, ""cut spending""."
638,11-10-15,primary_rep,CRUZ,"It's much harder and riskier to put out, chapter and verse, specifically the programs you would cut to stop bankrupting our kids and grandkids."
639,11-10-15,primary_rep,BARTIROMO," Thank you, Senator."
640,11-10-15,primary_rep,BARTIROMO,"[applause]

Governor Bush, Republican primary voters say tax reform should be a priority for Congress and the administration."
641,11-10-15,primary_rep,BARTIROMO,"But, Governor Bush, how important is tax reform in your domestic policy agenda?"
642,11-10-15,primary_rep,BARTIROMO,Will you guarantee it in the first year of your presidency?
643,11-10-15,primary_rep,BUSH," I'm gonna fight as hard as I can to make sure that we shift power away from Washington, simplify the tax code, to spur economic activity in this country."
644,11-10-15,primary_rep,BUSH,Of course it's the highest priority.
645,11-10-15,primary_rep,BUSH,"If we don't do that, we're stuck with the ""new normal"" of 2 percent growth."
646,11-10-15,primary_rep,BUSH,"Hillary Clinton says, basically, we just gotta get used to it."
647,11-10-15,primary_rep,BUSH,Two percent growth means declining income for the middle class.
648,11-10-15,primary_rep,BUSH,It means more than 6 million people are stuck in poverty than the day that Barack Obama was inaugurated.
649,11-10-15,primary_rep,BUSH,"It means — it means more demands on government — growing the economy is the first job, if we're going to be serious about dealing with the deficit and debt."
650,11-10-15,primary_rep,BUSH,"And more importantly, people are really struggling right now."
651,11-10-15,primary_rep,BUSH,"In this economy, the disposable income of the great middle is down 2,300 bucks."
652,11-10-15,primary_rep,BUSH,"So yeah, we've created jobs, your — argue (ph) — brought that up early, and it was a good question."
653,11-10-15,primary_rep,BUSH,"Jobs are being created, but they're lower-income jobs than the jobs that were lost."
654,11-10-15,primary_rep,BUSH,And the net effect of this is we need to jump-start the economy.
655,11-10-15,primary_rep,BUSH,"I think of Jonathan (ph) and Reagan Love (ph), who are supporters of mine."
656,11-10-15,primary_rep,BUSH,"Jonathan has been deployed by the National Guard, he is — he's in Oklahoma."
657,11-10-15,primary_rep,BUSH,"Reagan Love — by the way, pretty great name, I think — is a teacher."
658,11-10-15,primary_rep,BUSH,"When — if they had this tax cut, what they told me was that that $2,300 of money in their pocket — they would go back to South Carolina and start a business."
659,11-10-15,primary_rep,BUSH,"Imagine what it would be like, instead of having more businesses closed than started, we had it the exact opposite."
660,11-10-15,primary_rep,BUSH,"We would grow our economy, and the government would get the revenue necessary to make things — make things better."
661,11-10-15,primary_rep,BUSH,"Hillary Clinton's approach to this is more top-down, more regulation, more taxes, more government, and it will destroy our economy."
662,11-10-15,primary_rep,BUSH,[applause]
663,11-10-15,primary_rep,BARTIROMO," Thank you, Governor."
664,11-10-15,primary_rep,BAKER, Senator Rubio.
665,11-10-15,primary_rep,BAKER,Can I just come to Senator Rubio?
666,11-10-15,primary_rep,BAKER,"We're coming to you, Mr. Trump, in one second."
667,11-10-15,primary_rep,BAKER,I — I promise.
668,11-10-15,primary_rep,TRUMP, Yes.
669,11-10-15,primary_rep,BAKER," Senator Rubio, your tax plan includes a large expansion of child tax credits to raise off (ph) the tax incomes for low-income parents."
670,11-10-15,primary_rep,BAKER,"A similar tax credit that you previously proposed in the Senate was estimated to cost as much as $170 billion a year, according to the Tax Foundation."
671,11-10-15,primary_rep,BAKER,Isn't — isn't there a risk you're just adding another expensive entitle program to an already overburdened federal budget?
672,11-10-15,primary_rep,RUBIO," The most important job I'm ever going to have, the most important job anyone in this room will ever have, is the job of being a parent."
673,11-10-15,primary_rep,RUBIO,"Not the job of being president, or the job of being a senator, or the job of being a congressman."
674,11-10-15,primary_rep,RUBIO,"The most important job any of us will ever do is the job of being a president (sic), because the most important institution in society is the family."
675,11-10-15,primary_rep,RUBIO,"If the family breaks down, society breaks down."
676,11-10-15,primary_rep,RUBIO,"You can't have a strong nation without strong values, and no one is born with strong values."
677,11-10-15,primary_rep,RUBIO,They have to be taught to you in strong families and reinforced in you in strong communities.
678,11-10-15,primary_rep,RUBIO,"And so when we set out to do tax reform, we endeavor to have a pro-family tax code, and we endeavor to do it because we know how difficult it is for families in the 21st century to afford the cost of living."
679,11-10-15,primary_rep,RUBIO,"It is expensive to raise children in the 21st century, and families that are raising children are raising the future taxpayers of the United States, and everything costs more."
680,11-10-15,primary_rep,RUBIO,"In 35 out of 50 states, child care costs more than college."
681,11-10-15,primary_rep,RUBIO,There are millions of people watching this broadcast tonight that understand exactly what I'm talking about.
682,11-10-15,primary_rep,RUBIO,"They don't know how they're going to make that payment every month, and if they can't make it, they can't work, because someone needs to watch their kids during the day."
683,11-10-15,primary_rep,RUBIO,"They don't know how they're going to save for their kids' future, to go to college."
684,11-10-15,primary_rep,RUBIO,"And so, yes, I have a child tax credit increase, and I'm proud of it."
685,11-10-15,primary_rep,RUBIO,"I am proud that I have a pro-family tax code, because the pro- family tax plan I have will strengthen the most important institution in the — in the country, the family."
686,11-10-15,primary_rep,PAUL," Neil, there's a point I'd like to make here... [applause] ....Neil, a point that I'd like to make about the tax credits."
687,11-10-15,primary_rep,PAUL,We have to decide what is conservative and what isn't conservative.
688,11-10-15,primary_rep,PAUL,Is it fiscally conservative to have a trillion-dollar expenditure?
689,11-10-15,primary_rep,PAUL,We're not talking about giving people back their tax money.
690,11-10-15,primary_rep,PAUL,He's talking about giving people money they didn't pay.
691,11-10-15,primary_rep,PAUL,It's a welfare transfer payment.
692,11-10-15,primary_rep,PAUL,So here's what we have.
693,11-10-15,primary_rep,PAUL,Is it conservative to have $1 trillion in transfer payments — a new welfare program that's a refundable tax credit?
694,11-10-15,primary_rep,PAUL,"Add that to Marco's plan for $1 trillion in new military spending, and you get something that looks, to me, not very conservative."
695,11-10-15,primary_rep,PAUL,Thank you.
696,11-10-15,primary_rep,PAUL,"[applause]

[crosstalk]"
697,11-10-15,primary_rep,BAKER, Governor Kasich?
698,11-10-15,primary_rep,BAKER,Let me come to Governor Kasich.
699,11-10-15,primary_rep,TRUMP," No, I'm sorry."
700,11-10-15,primary_rep,TRUMP,"No, excuse me."
701,11-10-15,primary_rep,TRUMP,I was there.
702,11-10-15,primary_rep,BAKER, Governor Kasich.
703,11-10-15,primary_rep,BAKER,[crosstalk]
704,11-10-15,primary_rep,BAKER," Very quickly, Senator."
705,11-10-15,primary_rep,RUBIO, Now I get my 60 seconds to respond.
706,11-10-15,primary_rep,RUBIO,He's talking about my tax plan.
707,11-10-15,primary_rep,BAKER, Please.
708,11-10-15,primary_rep,RUBIO, So let me begin with this.
709,11-10-15,primary_rep,RUBIO,"I actually believe — first of all, this is their money."
710,11-10-15,primary_rep,RUBIO,They do pay.
711,11-10-15,primary_rep,RUBIO,"It is refundable, not just against the taxes they pay to the government, but also the — on their federal income tax, it's refundable against the payroll tax."
712,11-10-15,primary_rep,RUBIO,Everyone pays payroll tax.
713,11-10-15,primary_rep,RUBIO,This is their money.
714,11-10-15,primary_rep,RUBIO,This is not our money.
715,11-10-15,primary_rep,RUBIO,"And here's what I don't understand — if you invest that money in a piece of equipment, if you invest that money in a business, you get to write it off your taxes."
716,11-10-15,primary_rep,RUBIO,"But if you invest it in your children, in the future of America and strengthening your family, we're not going to recognize that in our tax code?"
717,11-10-15,primary_rep,RUBIO,The family is the most important institution in society.
718,11-10-15,primary_rep,RUBIO,"And, yes..."
719,11-10-15,primary_rep,PAUL," Nevertheless, it's not very conservative, Marco."
720,11-10-15,primary_rep,RUBIO, ...
721,11-10-15,primary_rep,RUBIO,I do want to rebuild the American military.
722,11-10-15,primary_rep,PAUL, How is it conservative?
723,11-10-15,primary_rep,RUBIO, I know that Rand is a committed isolationist.
724,11-10-15,primary_rep,RUBIO,I'm not.
725,11-10-15,primary_rep,RUBIO,"I believe the world is a stronger and a better place, when the United States is the strongest military power in the world."
726,11-10-15,primary_rep,PAUL," Yeah, but, Marco!"
727,11-10-15,primary_rep,PAUL,Marco!
728,11-10-15,primary_rep,PAUL,"How is it conservative, how is it conservative to add a trillion-dollar expenditure for the federal government that you're not paying for?"
729,11-10-15,primary_rep,RUBIO, Because...
730,11-10-15,primary_rep,PAUL, How is it conservative?
731,11-10-15,primary_rep,RUBIO," ...are you talking about the military, Rand?"
732,11-10-15,primary_rep,PAUL, How is it conservative to add a trillion dollars in military expenditures?
733,11-10-15,primary_rep,PAUL,You can not be a conservative if you're going to keep promoting new programs that you're not going to pay for.
734,11-10-15,primary_rep,PAUL,[applause]
735,11-10-15,primary_rep,RUBIO, We can't even have an economy if we're not safe.
736,11-10-15,primary_rep,RUBIO,There are radical jihadist in the Middle East beheading people and crucifying Christians.
