,Date,Debate Type,Speaker,Sents
737,11-10-15,primary_rep,RUBIO,"A radical Shia cleric in Iran trying to get a nuclear weapon, the Chinese taking over the South China Sea... [applause] ...Yes, I believe the world is a safer — no, no, I don't believe, I know that the world is a safer place when America is the strongest military power in the world."
738,11-10-15,primary_rep,RUBIO,[cheering and applause]
739,11-10-15,primary_rep,PAUL, No.
740,11-10-15,primary_rep,PAUL,I don't think we're any safer — I do not think we are any safer from bankruptcy court.
741,11-10-15,primary_rep,PAUL,"As we go further, and further into debt, we become less, and less safe."
742,11-10-15,primary_rep,PAUL,This is the most important thing we're going to talk about tonight.
743,11-10-15,primary_rep,PAUL,"Can you be a conservative, and be liberal on military spending?"
744,11-10-15,primary_rep,PAUL,"Can you be for unlimited military spending, and say, Oh, I'm going to make the country safe?"
745,11-10-15,primary_rep,PAUL,"No, we need a safe country, but, you know, we spend more on our military than the next ten countries combined?"
746,11-10-15,primary_rep,PAUL,"I want a strong national defense, but I don't want us to be bankrupt."
747,11-10-15,primary_rep,PAUL,"[bell ringing]

[crosstalk]"
748,11-10-15,primary_rep,CRUZ, ...Middle ground that brings both of these together...
749,11-10-15,primary_rep,FIORINA," ...Yes, the middle ground is this..."
750,11-10-15,primary_rep,CRUZ," ...Exactly right, that we have to defend this nation."
751,11-10-15,primary_rep,CRUZ,"You think defending this nation is expensive, try not defending it."
752,11-10-15,primary_rep,CRUZ,That's a lot more expensive.
753,11-10-15,primary_rep,CRUZ,"[applause and cheering]

But, you can do that, and pay for it."
754,11-10-15,primary_rep,CRUZ,"You can do that, and also be fiscally responsible."
755,11-10-15,primary_rep,CRUZ,"You know, I mention that the 25 programs that I put today, that I would eliminate them."
756,11-10-15,primary_rep,CRUZ,"Among them are corporate welfare, like sugar subsidies."
757,11-10-15,primary_rep,CRUZ,Let's take that as an example.
758,11-10-15,primary_rep,CRUZ,Sugar subsidies.
759,11-10-15,primary_rep,CRUZ,"Sugar farmers farm under... [bell ringing] ...under roughly 0.2% of the farmland in America, and yet they give 40% of the lobbying money."
760,11-10-15,primary_rep,CRUZ,"That sort of corporate welfare is why we're bankrupting our kids, and grandkids."
761,11-10-15,primary_rep,CRUZ,I would end those subsidies to pay for defending this nation...
762,11-10-15,primary_rep,BAKER," ...Gentleman, we need to move on..."
763,11-10-15,primary_rep,FIORINA," ...This is why — this is why we must combine, actually, zero-based budgeting with tax reform because unless we can examine, and cut, and move, every single dollar of discretionary spending in the federal government, we cannot reform taxes and reduce spending at the same time."
764,11-10-15,primary_rep,FIORINA,"Ask yourself this question, how is it possible that the federal government gets more money each and every year, which the federal government has been doing, receiving more money every year for 50 years under republicans and democrats alike, and yet, never has enough money to do the important things?"
765,11-10-15,primary_rep,FIORINA,The answer?
766,11-10-15,primary_rep,FIORINA,All the money's always spoken for.
767,11-10-15,primary_rep,FIORINA,All the money's spoken for.
768,11-10-15,primary_rep,FIORINA,"So, we have to go to zero-based budgeting, which is a simple idea — by the way, there's been a bill for zeros-based (ph) budgeting... [bell ringing] ...It exists, it can be voted on."
769,11-10-15,primary_rep,FIORINA,Every dollar must be examined.
770,11-10-15,primary_rep,FIORINA,Any dollar can be cut.
771,11-10-15,primary_rep,FIORINA,"Any dollar can be cut, any dollar can be moved."
772,11-10-15,primary_rep,FIORINA,We have to go to a three page tax code.
773,11-10-15,primary_rep,FIORINA,"You lower every rate, you close every loophole, why?"
774,11-10-15,primary_rep,FIORINA,"Because the government uses the tax code to decide winners, and losers."
775,11-10-15,primary_rep,FIORINA,You have to strip the corruption out of the tax code to pay for it.
776,11-10-15,primary_rep,FIORINA,You have to know where every single dollar is being spent...
777,11-10-15,primary_rep,BAKER, ...We need to move...
778,11-10-15,primary_rep,FIORINA," ...Cut where you need to, and invest where you need to..."
779,11-10-15,primary_rep,BAKER, ...We need too...
780,11-10-15,primary_rep,FIORINA, ...The two go hand in hand...
781,11-10-15,primary_rep,BAKER, ...We do need to move on.
782,11-10-15,primary_rep,BAKER,Mr. Trump...
783,11-10-15,primary_rep,TRUMP," Please, if I could just..."
784,11-10-15,primary_rep,BAKER, ...Very quick.
785,11-10-15,primary_rep,TRUMP," We have to make our military bigger, better, stronger than ever before so that nobody messes with us, and a long run, it's going to save us."
786,11-10-15,primary_rep,TRUMP,"I agree with Marco, I agree with Ted, we have no choice."
787,11-10-15,primary_rep,TRUMP,"And, I can tell you this with certainty."
788,11-10-15,primary_rep,TRUMP,We all have a different tax plan.
789,11-10-15,primary_rep,TRUMP,Some I don't totally agree with.
790,11-10-15,primary_rep,TRUMP,"One thing we understand, each one of those tax plans is better than the mess that we have right now."
791,11-10-15,primary_rep,TRUMP,[applause]
792,11-10-15,primary_rep,BAKER," Let's talk about — No, no, Governor, I really must move on."
793,11-10-15,primary_rep,BAKER,I really want to move on.
794,11-10-15,primary_rep,BAKER,"Mr. Trump, let's talk about the international economy..."
795,11-10-15,primary_rep,KASICH," ...Mr. Baker, everybody got to talk about taxes..."
796,11-10-15,primary_rep,BAKER, ...We really need to move on...
797,11-10-15,primary_rep,KASICH, ...I think you were coming to me and then...
798,11-10-15,primary_rep,BAKER," ...No, governor, I promise I will come to you..."
799,11-10-15,primary_rep,KASICH," ...Look, I hate to crash the party to you, Mr. Baker, but, you know, what's fair..."
800,11-10-15,primary_rep,BAKER, ...Listen...
801,11-10-15,primary_rep,KASICH," ...Yes, sir..."
802,11-10-15,primary_rep,BAKER," ...Mr. Trump, can I ask you about..."
803,11-10-15,primary_rep,TRUMP, ...Yes...
804,11-10-15,primary_rep,BAKER, ...the U.S. just concluded an international trade agreement with 11 countries in the Pacific.
805,11-10-15,primary_rep,BAKER,You've said that you'd rather have no deal...
806,11-10-15,primary_rep,TRUMP, ...Yeah...
807,11-10-15,primary_rep,BAKER, ...than sign the one that's on the table...
808,11-10-15,primary_rep,TRUMP, ...It's a horrible deal...
809,11-10-15,primary_rep,BAKER," ...Most economists — most economists say that trade is boosted growth, and every single post war president has supported the expansion of international trade, including the last three republican presidents."
810,11-10-15,primary_rep,BAKER,Why would you reverse more than 50 years of U.S. trade policy?
811,11-10-15,primary_rep,TRUMP, The TPP is horrible deal.
812,11-10-15,primary_rep,TRUMP,It is a deal that is going to lead to nothing but trouble.
813,11-10-15,primary_rep,TRUMP,"It's a deal that was designed for China to come in, as they always do, through the back door and totally take advantage of everyone."
814,11-10-15,primary_rep,TRUMP,"It's 5,600 pages long."
815,11-10-15,primary_rep,TRUMP,So complex that nobodies read it.
816,11-10-15,primary_rep,TRUMP,It's like Obamacare; nobody ever read it.
817,11-10-15,primary_rep,TRUMP,They passed it; nobody read it.
818,11-10-15,primary_rep,TRUMP,And look at mess we have right now.
819,11-10-15,primary_rep,TRUMP,And it will be repealed.
820,11-10-15,primary_rep,TRUMP,But this is one of the worst trade deals.
821,11-10-15,primary_rep,TRUMP,"And I would, yes, rather not have it."
822,11-10-15,primary_rep,TRUMP,"With all of these countries, and all of the bad ones getting advantage and taking advantage of what the good ones would normally get, I'd rather make individual deals with individual countries."
823,11-10-15,primary_rep,TRUMP,We will do much better.
824,11-10-15,primary_rep,TRUMP,We lose a fortune on trade.
825,11-10-15,primary_rep,TRUMP,The United States loses with everybody.
826,11-10-15,primary_rep,TRUMP,"We're losing now over $500 billion in terms of imbalance with China, $75 billion a year imbalance with Japan."
827,11-10-15,primary_rep,TRUMP,"By the way, Mexico, $50 billion a year imbalance."
828,11-10-15,primary_rep,TRUMP,"So I must say, Gerard, I just think it's a terrible deal."
829,11-10-15,primary_rep,TRUMP,I love trade.
830,11-10-15,primary_rep,TRUMP,"I'm a free trader, 100 percent."
831,11-10-15,primary_rep,TRUMP,"But we need smart people making the deals, and we don't have smart people making the deals."
832,11-10-15,primary_rep,BAKER," The — the deal, as you say, the terms of the deal were published — were published just last week, the details, 5,000 pages of it, and 80 percent of U.S. trade with countries in the Pacific, these countries, these 11 countries, is actually tariff-free, and these — the trade deal only affects the other 20 percent."
833,11-10-15,primary_rep,BAKER,Which — are there particular parts of the deal that you think were badly negotiated?
834,11-10-15,primary_rep,TRUMP, Yes.
835,11-10-15,primary_rep,TRUMP,"Well, the currency manipulation they don't discuss in the agreement, which is a disaster."
836,11-10-15,primary_rep,TRUMP,"If you look at the way China and India and almost everybody takes advantage of the United States — China in particular, because they're so good."
837,11-10-15,primary_rep,TRUMP,It's the number-one abuser of this country.
838,11-10-15,primary_rep,TRUMP,"And if you look at the way they take advantage, it's through currency manipulation."
839,11-10-15,primary_rep,TRUMP,"It's not even discussed in the almost 6,000-page agreement."
840,11-10-15,primary_rep,TRUMP,It's not even discussed.
841,11-10-15,primary_rep,BAKER," There was a separate — separate...

[crosstalk]"
842,11-10-15,primary_rep,TRUMP," And as you understand, I mean, you understand very well from the Wall Street Journal, currency manipulation is the single great weapon people have."
843,11-10-15,primary_rep,TRUMP,They don't even discuss it in this agreement.
844,11-10-15,primary_rep,TRUMP,"So I say, it's a very bad deal, should not be approved."
845,11-10-15,primary_rep,TRUMP,"If it is approved, it will just be more bad trade deals, more loss of jobs for our country."
846,11-10-15,primary_rep,TRUMP,We are losing jobs like nobody's ever lost jobs before.
847,11-10-15,primary_rep,TRUMP,I want to bring jobs back into this country.
848,11-10-15,primary_rep,PAUL," Hey, Gerard, you know, we might want to point out China is not part of this deal."
849,11-10-15,primary_rep,UNKNOWN, True.
850,11-10-15,primary_rep,UNKNOWN,It's true.
851,11-10-15,primary_rep,BARTIROMO, That's right.
852,11-10-15,primary_rep,BARTIROMO,That's right.
853,11-10-15,primary_rep,PAUL, Before we get a little bit off-kilter here...
854,11-10-15,primary_rep,BAKER, But isn't that — isn't that part of the problem?
855,11-10-15,primary_rep,BAKER,"When I say, Senator, that if — if this deal is not ratified by — by the U.S. — by the Senate, then it would actually give China an opportunity to grow its economic leadership, which it's been seeking to do?"
856,11-10-15,primary_rep,BAKER,"And if the U.S. is unable to take part in this trade deal with these countries in Asia, China will take the lead?"
857,11-10-15,primary_rep,PAUL," There is an argument that China doesn't like the deal, because in us doing the deal, we'll be trading with their competitors."
858,11-10-15,primary_rep,PAUL,You're exactly right.
859,11-10-15,primary_rep,PAUL,But I think we've sort of missed the point a little bit here.
860,11-10-15,primary_rep,PAUL,"There is an important point, though, about how we discuss these trade treaties that I do agree with Mr. Trump on."
861,11-10-15,primary_rep,PAUL,We should negotiate from a position of strength.
862,11-10-15,primary_rep,PAUL,And we also should negotiate using the full force and the constitutional power that was given to us.
863,11-10-15,primary_rep,PAUL,I think it's a mistake that we give up power to the presidency on these trade deals.
864,11-10-15,primary_rep,PAUL,"We give up the power to filibuster, and I'm kind of fond of that power."
865,11-10-15,primary_rep,PAUL,"[laughter]

We give up the power to amend."
866,11-10-15,primary_rep,PAUL,"And I think, really, one of the big problems we have in our country is, over the last century, really, so much power has gravitated to the executive branch."
867,11-10-15,primary_rep,PAUL,"Really, Congress is kind of a bystander."
868,11-10-15,primary_rep,PAUL,We don't write the rules.
869,11-10-15,primary_rep,PAUL,We don't make the laws.
870,11-10-15,primary_rep,PAUL,The executive branch does.
871,11-10-15,primary_rep,PAUL,So even in trade — and I am for trade — I think we should be careful about giving so much power to the presidency.
872,11-10-15,primary_rep,PAUL,[applause]
873,11-10-15,primary_rep,BAKER, Thank you.
874,11-10-15,primary_rep,BAKER,"Thanks, Senator."
875,11-10-15,primary_rep,BARTIROMO," Coming up, the biggest threats facing the next commander-in-chief."
876,11-10-15,primary_rep,BARTIROMO,"You're watching the Republican presidential debate, live tonight from Milwaukee."
877,11-10-15,primary_rep,BARTIROMO,We'll be right back.
878,11-10-15,primary_rep,BARTIROMO,[commercial break]
879,11-10-15,primary_rep,BARTIROMO, Welcome back.
880,11-10-15,primary_rep,BARTIROMO,Welcome back to the Republican presidential debate.
881,11-10-15,primary_rep,BARTIROMO,The candidates taking the questions you want answered.
882,11-10-15,primary_rep,BARTIROMO,"Also tonight, you can see what America is saying about the debate."
883,11-10-15,primary_rep,BARTIROMO,Go to Facebook and type #gopdebate into the search box.
884,11-10-15,primary_rep,BARTIROMO,"Now, back to the questions."
885,11-10-15,primary_rep,BARTIROMO,Americans face security threats at home and abroad.
886,11-10-15,primary_rep,BARTIROMO,"Last year, terrorist attacks rose 61 percent, according to the Institute for Economics and Peace, with the most deaths occurring in just five countries, Iraq, Afghanistan, Pakistan, Nigeria, and Syria."
887,11-10-15,primary_rep,BARTIROMO,"Dr. Carson, you were against putting troops on the ground in Iraq and against a large military force in Afghanistan."
888,11-10-15,primary_rep,BARTIROMO,"Do you support the president's decision to now put 50 special ops forces in Syria and leave 10,000 U.S. troops in Afghanistan?"
889,11-10-15,primary_rep,CARSON," Well, putting the special ops people in there is better than not having them there, because they — that's why they're called special ops, they're actually able to guide some of the other things that we're doing there."
890,11-10-15,primary_rep,CARSON,And what we have to recognize is that Putin is trying to really spread his influence throughout the Middle East.
891,11-10-15,primary_rep,CARSON,This is going to be his base.
892,11-10-15,primary_rep,CARSON,And we have to oppose him there in an effective way.
893,11-10-15,primary_rep,CARSON,We also must recognize that it's a very complex place.
894,11-10-15,primary_rep,CARSON,"You know, the Chinese are there, as well as the Russians, and you have all kinds of factions there."
895,11-10-15,primary_rep,CARSON,"What we've been doing so far is very ineffective, but we can't give up ground right there."
896,11-10-15,primary_rep,CARSON,But we have to look at this on a much more global scale.
897,11-10-15,primary_rep,CARSON,We're talking about global jihadists.
898,11-10-15,primary_rep,CARSON,And their desire is to destroy us and to destroy our way of life.
899,11-10-15,primary_rep,CARSON,"So we have to be saying, how do we make them look like losers?"
900,11-10-15,primary_rep,CARSON,Because that's the way that they're able to gather a lot of influence.
901,11-10-15,primary_rep,CARSON,"And I think in order to make them look like losers, we have to destroy their caliphate."
902,11-10-15,primary_rep,CARSON,And you look for the easiest place to do that?
903,11-10-15,primary_rep,CARSON,It would be in Iraq.
904,11-10-15,primary_rep,CARSON,"And if — outside of Anbar in Iraq, there's a big energy field."
905,11-10-15,primary_rep,CARSON,Take that from them.
906,11-10-15,primary_rep,CARSON,Take all of that land from them.
907,11-10-15,primary_rep,CARSON,"We could do that, I believe, fairly easily, I've learned from talking to several generals, and then you move on from there."
908,11-10-15,primary_rep,CARSON,"But you have to continue to face them, because our goal is not to contain them, but to destroy them before they destroy us."
909,11-10-15,primary_rep,CARSON,[applause]
910,11-10-15,primary_rep,BARTIROMO," We asked Facebook to take a look at some of the major issues we're talking about, and tackling in this debate tonight."
911,11-10-15,primary_rep,BARTIROMO,This word cloud shows what people are focusing on the most.
912,11-10-15,primary_rep,BARTIROMO,"The bigger the word, the more the talk."
913,11-10-15,primary_rep,BARTIROMO,"One of the most discussed issues in the last month, homeland security."
914,11-10-15,primary_rep,BARTIROMO,"Governor Bush, what is the biggest threat facing America today?"
915,11-10-15,primary_rep,BUSH," It is — I'd say it is Islamic terrorism, and, back to the question of what we are dealing with in Iraq, when we pull back voids are filled."
916,11-10-15,primary_rep,BUSH,"That's the lesson of history, and, sadly, this president does not believe in American leadership."
917,11-10-15,primary_rep,BUSH,"He does not believe it, and the net result is that we have a caliphate the size of Indiana that gains energy each and everyday to recruit Americans in our own country, and the threat to the homeland relates to the fact that we have not dealt with this threat of terror in the Middle East."
918,11-10-15,primary_rep,BUSH,We should have a no fly zone in Syria.
919,11-10-15,primary_rep,BUSH,"We should have a support for the remnants of the Syrian Free Army, and create safe zones."
920,11-10-15,primary_rep,BUSH,"If you want to deal with the four million refugees that are leaving Syria because of the devastation there, then we 'ought to create safe zones for them to stay in the region rather than go to Europe."
921,11-10-15,primary_rep,BUSH,"And, that requires American leadership."
922,11-10-15,primary_rep,BUSH,Without American leadership every other country in the neighborhood beings to change their priorities.
923,11-10-15,primary_rep,BUSH,"It is tragic that you see Iraq, and other countries now talking to Russia."
924,11-10-15,primary_rep,BUSH,It wasn't that long ago that Russia had no influence in the region at all.
925,11-10-15,primary_rep,BUSH,"And, so, the United States needs to lead across the board."
926,11-10-15,primary_rep,BUSH,"This president, and Hillary Clinton both do not believe the United States has a leadership role to play, and we're now paying a price, and it will have a huge impact on the economy of this country if we don't deal with this."
927,11-10-15,primary_rep,BUSH,[applause]
928,11-10-15,primary_rep,BARTIROMO," Thank you, sir."
929,11-10-15,primary_rep,BARTIROMO,"Mr. Trump, in 2012 debate, President Obama mocked Mitt Romney's assertion that Russia was the top geopolitical challenge facing the United States, saying he was a Cold War dinosaur."
930,11-10-15,primary_rep,BARTIROMO,"Now, Russia has invaded Ukraine, and has put troops in Syria."
931,11-10-15,primary_rep,BARTIROMO,You have said you will have a good relationship with Mr. Putin.
932,11-10-15,primary_rep,BARTIROMO,"So, what does President Trump do in response to Russia's aggression?"
933,11-10-15,primary_rep,TRUMP," Well, first of all, it's not only Russia."
934,11-10-15,primary_rep,TRUMP,We have problems with North Korea where they actually have nuclear weapons.
935,11-10-15,primary_rep,TRUMP,"You know, nobody talks about it, we talk about Iran, and that's one of the worst deals ever made."
936,11-10-15,primary_rep,TRUMP,"One of the worst contracts ever signed, ever, in anything, and it's a disgrace."
937,11-10-15,primary_rep,TRUMP,"But, we have somebody over there, a madman, who already has nuclear weapons we don't talk about that."
938,11-10-15,primary_rep,TRUMP,That's a problem.
939,11-10-15,primary_rep,TRUMP,"China is a problem, both economically in what they're doing in the South China Sea, I mean, they are becoming a very, very major force."
940,11-10-15,primary_rep,TRUMP,"So, we have more than just Russia."
941,11-10-15,primary_rep,TRUMP,"But, as far as the Ukraine is concerned, and you could Syria — as far as Syria, I like — if Putin wants to go in, and I got to know him very well because we were both on 60 Minutes, we were stablemates, and we did very well that night."
942,11-10-15,primary_rep,TRUMP,"But, you know that."
943,11-10-15,primary_rep,TRUMP,"But, if Putin wants to go and knocked the hell out of ISIS, I am all for it, 100%, and I can't understand how anybody would be against it..."
944,11-10-15,primary_rep,BUSH, ...They're not doing that...
945,11-10-15,primary_rep,TRUMP, ...They blew up — hold it....
946,11-10-15,primary_rep,BUSH, [inaudible]
947,11-10-15,primary_rep,TRUMP," ...They blew up, wait a minute... [audience reaction] ...They blew up a Russian airplane."
948,11-10-15,primary_rep,TRUMP,He cannot be in love with these people.
949,11-10-15,primary_rep,TRUMP,"He's going in, and we can go in, and everybody should go in."
950,11-10-15,primary_rep,TRUMP,"As far as the Ukraine is concerned, we have a group of people, and a group of countries, including Germany — tremendous economic behemoth — why are we always doing the work?"
951,11-10-15,primary_rep,TRUMP,"We are — I'm all for protecting Ukraine and working — but, we have countries that are surrounding the Ukraine that aren't doing anything."
952,11-10-15,primary_rep,TRUMP,"They say, ""Keep going, keep going, you dummies, keep going."
953,11-10-15,primary_rep,TRUMP,"Protect us..."" [bell ringing] ...And we have to get smart."
954,11-10-15,primary_rep,TRUMP,We can't continue to be the policeman of the world.
955,11-10-15,primary_rep,TRUMP,"We are $19 trillion dollars, we have a country that's going to hell, we have an infrastructure that's falling apart."
956,11-10-15,primary_rep,TRUMP,"Our roads, our bridges, our schools, our airports, and we have to start investing money in our country."
957,11-10-15,primary_rep,TRUMP,[applause]
958,11-10-15,primary_rep,BARTIROMO," Thank you, sir."
959,11-10-15,primary_rep,BUSH, Donald — Donald's wrong on this.
960,11-10-15,primary_rep,BUSH,He is absolutely wrong on this.
961,11-10-15,primary_rep,BUSH,"We're not going to be the world's policeman, but we sure as heck better be the world's leader."
962,11-10-15,primary_rep,BUSH,"That's — there's a huge difference where, without us leading... [cheering] ...voids are filled, and the idea that it's a good idea for Putin to be in Syria, let ISIS take out Assad, and then Putin will take out ISIS?"
963,11-10-15,primary_rep,BUSH,"I mean, that's like a board game, that's like playing Monopoly or something."
964,11-10-15,primary_rep,BUSH,That's not how the real world works.
965,11-10-15,primary_rep,BUSH,"We have to lead, we have to be involved."
966,11-10-15,primary_rep,BUSH,We should have a no fly zone in Syria.
967,11-10-15,primary_rep,BUSH,There are — they are barrel bombing the innocents in that country.
968,11-10-15,primary_rep,BUSH,"If you're a Christian, increasingly in Lebanon, or Iraq, or Syria, you're going to be beheaded."
969,11-10-15,primary_rep,BUSH,"And, if you're a moderate Islamist, you're not going to be able to survive either."
970,11-10-15,primary_rep,BUSH,We have to play a role in this be able to bring the rest of the world to this issue before it's too late.
971,11-10-15,primary_rep,TRUMP," Assad is a bad guy, but we have no idea who the so-called rebels — I read about the rebels, nobody even knows who they are."
972,11-10-15,primary_rep,TRUMP,"I spoke to a general two weeks ago, he said — he was very up on exactly what we're talking about."
973,11-10-15,primary_rep,TRUMP,"He said, ""You know, Mr. Trump?"
974,11-10-15,primary_rep,TRUMP,"We're giving hundreds of millions of dollars of equipment to these people, we have no idea who they are."""
975,11-10-15,primary_rep,TRUMP,"So, I don't like Assad."
976,11-10-15,primary_rep,TRUMP,Who's going to like Assad?
977,11-10-15,primary_rep,TRUMP,"But, we have no idea who these people, and what they're going to be, and what they're going to represent."
978,11-10-15,primary_rep,TRUMP,They may be far worse than Assad.
979,11-10-15,primary_rep,TRUMP,Look at Libya.
980,11-10-15,primary_rep,TRUMP,Look at Iraq.
981,11-10-15,primary_rep,TRUMP,"Look at the mess we have after spending $2 trillion dollars, thousands of lives, wounded warriors all over the place — who I love, OK?"
982,11-10-15,primary_rep,TRUMP,All over.
983,11-10-15,primary_rep,TRUMP,We have nothing.
984,11-10-15,primary_rep,TRUMP,"And, I said, keep the oil."
985,11-10-15,primary_rep,TRUMP,"And we should have kept the oil, believe me."
986,11-10-15,primary_rep,TRUMP,We should have kept the oil.
987,11-10-15,primary_rep,TRUMP,"And, you know what?"
988,11-10-15,primary_rep,TRUMP,"We should have given the oil... [bell ringing] ..We should've given big chunks to the people that lost their arms, their legs, and their families, and their sons, and daughters, because right now, you know who has a lot of that oil?"
989,11-10-15,primary_rep,TRUMP,"Iran, and ISIS."
990,11-10-15,primary_rep,FIORINA," You know, Mr. Trump fancies himself a very good negotiator."
