,Date,Debate Type,Speaker,Sents
2,11-14-15,primary_dem,DICKERSON, Before we start the debate here are the rules.
3,11-14-15,primary_dem,DICKERSON,The candidates have one minute to respond to our questions and 30 seconds to respond to our follow-up.
4,11-14-15,primary_dem,DICKERSON,Any candidate who is attacked by another candidate gets 30 seconds for rebuttal.
5,11-14-15,primary_dem,DICKERSON,"Here's how we'll keep time, after a question is asked the green light goes on."
6,11-14-15,primary_dem,DICKERSON,When there are 15 seconds left the candidate gets a yellow warning light.
7,11-14-15,primary_dem,DICKERSON,And when time's up the light turns red.
8,11-14-15,primary_dem,DICKERSON,That means stop talking.
9,11-14-15,primary_dem,DICKERSON,[laughter] Those are the rules.
10,11-14-15,primary_dem,DICKERSON,So let's get started.
11,11-14-15,primary_dem,DICKERSON,You will each have one minute for an opening statement to share your thoughts about the attacks in your Paris and lay out your visions for America.
12,11-14-15,primary_dem,DICKERSON,"First, Senator Sanders."
13,11-14-15,primary_dem,SANDERS," Well, John, let me concur with you and with all Americans who are shocked and disgusted by what we saw in Paris yesterday."
14,11-14-15,primary_dem,SANDERS,"Together, leading the world, this country will rid our planet of this barbarous organization called ISIS."
15,11-14-15,primary_dem,SANDERS,"I'm running for president, because as I go around this nation, I talk to a lot of people."
16,11-14-15,primary_dem,SANDERS,And what I hear is people's concern that the economy we have is a rigged economy.
17,11-14-15,primary_dem,SANDERS,"People are working longer hours for lower wages, and almost all of the new income and wealth goes to the top one percent."
18,11-14-15,primary_dem,SANDERS,"And then on top of that, we've got a corrupt campaign finance system in which millionaires and billionaires are pouring huge sums of money into super PACS heavily influencing the political process."
19,11-14-15,primary_dem,SANDERS,"What my campaign is about is a political revolution -- millions of people standing up and saying, enough is enough."
20,11-14-15,primary_dem,SANDERS,"Our government belongs to all of us, and not just the hand full of billionaires."
21,11-14-15,primary_dem,DICKERSON," All right, Senator Sanders."
22,11-14-15,primary_dem,DICKERSON,Secretary Clinton.
23,11-14-15,primary_dem,CLINTON," Well, our prayers are with the people of France tonight, but that is not enough."
24,11-14-15,primary_dem,CLINTON,"We need to have a resolve that will bring the world together to root out the kind of radical jihadist ideology that motivates organizations like ISIS, a barbaric, ruthless, violent jihadist terrorist group."
25,11-14-15,primary_dem,CLINTON,This election is not only about electing a president.
26,11-14-15,primary_dem,CLINTON,It's also about choosing our next commander-in-chief.
27,11-14-15,primary_dem,CLINTON,"And I will be laying out in detail, what I think we need to do with our friends and allies in Europe and elsewhere to do a better job of coordinating efforts against the scourge of terrorism."
28,11-14-15,primary_dem,CLINTON,"Our country deserves no less, because all of the other issues we want to deal with depend upon us being secure and strong."
29,11-14-15,primary_dem,DICKERSON, Governor O'Malley.
30,11-14-15,primary_dem,O," My heart, like all of us in this room, John, and all the people across our country, my hearts go out to the people of France in this moment of loss."
31,11-14-15,primary_dem,O,"Parents, and sons, and daughters and family members, and as our hearts go out to them and as our prayers go out to them, we must remember this, that this isn't the new face of conflict and warfare, not in the 20th century but the new face of conflict and warfare in the 21st century."
32,11-14-15,primary_dem,O,And there is no nation on the planet better able to adapt to this change than our nation.
33,11-14-15,primary_dem,O,We must able to work collaboratively with others.
34,11-14-15,primary_dem,O,We must anticipate these threats before they happen.
35,11-14-15,primary_dem,O,"This is the new sort of challenge, the new sort of threat that does, in fact, require new thinking, fresh approaches and new leadership."
36,11-14-15,primary_dem,O,"As a former mayor and a former governor, there was never a single day, John, when I went to bed or woke up without realizing that this could happen in our own country."
37,11-14-15,primary_dem,O,"We have a lot of work to do, to better prepare our nation and to better lead this world into this new century."
38,11-14-15,primary_dem,DICKERSON," All right, thank you, Governor."
39,11-14-15,primary_dem,DICKERSON,Thank all of you.
40,11-14-15,primary_dem,DICKERSON,The terror attacks last night underscore biggest challenge facing the next president of the United States.
41,11-14-15,primary_dem,DICKERSON,"At a time of crisis, the country and the world look to the president for leadership and for answers."
42,11-14-15,primary_dem,DICKERSON,"So, Secretary Clinton, I'd like to start with you."
43,11-14-15,primary_dem,DICKERSON,"Hours before the attacks, President Obama said, ""I don't think ISIS is gaining strength."""
44,11-14-15,primary_dem,DICKERSON,Seventy-two percent of Americans think the fight against ISIS is going badly.
45,11-14-15,primary_dem,DICKERSON,"Won't the legacy of this administration, which is-- which you were a part of, won't that legacy be that it underestimated the threat from ISIS?"
46,11-14-15,primary_dem,CLINTON," Well, John, I think that we have to look at ISIS as the leading threat of an international terror network."
47,11-14-15,primary_dem,CLINTON,"It cannot be contained, it must be defeated."
48,11-14-15,primary_dem,CLINTON,"There is no question in my mind that if we summon our resources, both our leadership resources and all of the tools at our disposal, not just military force, which should be used as a last resort, but our diplomacy, our development aid, law enforcement, sharing of intelligence in a much more open and cooperative way -- that we can bring people together."
49,11-14-15,primary_dem,CLINTON,But it cannot be an American fight.
50,11-14-15,primary_dem,CLINTON,And I think what the president has consistently said-- which I agree with-- is that we will support those who take the fight to ISIS.
51,11-14-15,primary_dem,CLINTON,"That is why we have troops in Iraq that are helping to train and build back up the Iraqi military, why we have special operators in Syria working with the Kurds and Arabs, so that we can be supportive."
52,11-14-15,primary_dem,CLINTON,"But this cannot be an American fight, although American leadership is essential."
53,11-14-15,primary_dem,DICKERSON," But as -- Secretary Clinton, the question was about, was ISIS underestimated?"
54,11-14-15,primary_dem,DICKERSON,"And I'll just add, the president referred to ISIS as the JVU (sic), in a speech at the Council of Foreign Relations in June of 2014 said, ""I could not have predicted the extent to which ISIS could be effective in seizing cities in Iraq."""
55,11-14-15,primary_dem,DICKERSON,"So you've got prescriptions for the future, but how do we even those prescript prescriptions are any good if you missed it in the past?"
56,11-14-15,primary_dem,CLINTON," Well, John, look, I think that what happened when we abided by the agreement that George W. Bush made with the Iraqis to leave by 2011, is that an Iraqi army was left that had been trained and that was prepared to defend Iraq."
57,11-14-15,primary_dem,CLINTON,"Unfortunately, Nouri al-Maliki, the prime minister, set about decimating it."
58,11-14-15,primary_dem,CLINTON,"And then, with the revolution against Assad -- and I did early on say we needed to try to find a way to train and equip moderates very early so that we would have a better idea of how to deal with Assad because I thought there would be extremist groups filling the vacuum."
59,11-14-15,primary_dem,CLINTON,"So, yes, this has developed."
60,11-14-15,primary_dem,CLINTON,"I think that there are many other reasons why it has in addition to what happened in the region, but I don't think that the United States has the bulk of the responsibility."
61,11-14-15,primary_dem,CLINTON,I really put that on Assad and on the Iraqis and on the region itself.
62,11-14-15,primary_dem,DICKERSON," Okay, Governor O'Malley, would you critique the administration's response to ISIS."
63,11-14-15,primary_dem,DICKERSON,"If the United States doesn't lead, who leads?"
64,11-14-15,primary_dem,O," John, I would disagree with Secretary Clinton respectfully on this score."
65,11-14-15,primary_dem,O,This actually is America's fight.
66,11-14-15,primary_dem,O,It cannot solely be America's fight.
67,11-14-15,primary_dem,O,America is best when we work in collaboration with our allies.
68,11-14-15,primary_dem,O,America is best when we are actually standing up to evil in this world.
69,11-14-15,primary_dem,O,"And ISIS, make no mistake about it, is an evil in this world."
70,11-14-15,primary_dem,O,ISIS has brought down a Russian airliner.
71,11-14-15,primary_dem,O,ISIS has now attacked a western democracy in -- in France.
72,11-14-15,primary_dem,O,And we do have a role in this.
73,11-14-15,primary_dem,O,"Not solely ours, but we must work collaboratively with other nations."
74,11-14-15,primary_dem,O,"The great failing of these last 10 or 15 years, John, has been our failing of human intelligence on the ground."
75,11-14-15,primary_dem,O,Our role in the world is not to roam the globe looking for new dictators to topple.
76,11-14-15,primary_dem,O,Our role in the world is to make ourselves a beacon of hope.
77,11-14-15,primary_dem,O,"Make ourselves stronger at home, but also our role in the world, yes, is also to confront evil when it rises."
78,11-14-15,primary_dem,O,"We took out the safe haven in Afghanistan, but now there is, undoubtedly, a larger safe haven and we must rise to this occasion in collaboration and with alliances to confront it, and invest in the future much better human intelligence so we know what the next steps are."
79,11-14-15,primary_dem,DICKERSON," Senator Sanders, you said you want to rid the planet of ISIS."
80,11-14-15,primary_dem,DICKERSON,In the previous debate you said the greatest threat to national security was climate change.
81,11-14-15,primary_dem,DICKERSON,Do you still believe that?
82,11-14-15,primary_dem,SANDERS, Absolutely.
83,11-14-15,primary_dem,SANDERS,"In fact, climate change is directly related to the growth of terrorism."
84,11-14-15,primary_dem,SANDERS,"And if we do not get our act together and listen to what the scientists say, you're going to see countries all over the world -- this is what the CIA says -- they're going to be struggling over limited amounts of water, limited amounts of land to grow their crops ask you're going to see all kinds of international conflict."
85,11-14-15,primary_dem,SANDERS,"But, of course, international terrorism is a major issue that we have got to address today."
86,11-14-15,primary_dem,SANDERS,And I agree with much of what the Secretary and the Governor have said.
87,11-14-15,primary_dem,SANDERS,But let me have one area of disagreement with the Secretary.
88,11-14-15,primary_dem,SANDERS,I think she said something like the bulk of the responsibility is not ours.
89,11-14-15,primary_dem,SANDERS,"Well, in fact, I would argue that the disastrous invasion of Iraq, something that I strongly opposed, has unraveled the region completely and led to the rise of al-Qaeda and to ISIS."
90,11-14-15,primary_dem,SANDERS,"Now, in fact, what we have got to do -- and I think there is widespread agreement here -- is the United States cannot do it alone."
91,11-14-15,primary_dem,SANDERS,What we need to do is lead an international coalition which includes very significantly the Muslim nations in that region who are going to have to fight and defend their way of life.
92,11-14-15,primary_dem,DICKERSON," Quickly, just let me ask you a follow-up on that, Senator Sanders."
93,11-14-15,primary_dem,DICKERSON,"When you say the disastrous vote on Iraq, let's just be clear about what you're saying."
94,11-14-15,primary_dem,DICKERSON,"You're saying Secretary Clinton, who was then Senator Clinton, voted for the Iraq war."
95,11-14-15,primary_dem,DICKERSON,And are you making a direct link between her vote for that or and what's happening now for ISIS.
96,11-14-15,primary_dem,DICKERSON,Just so everybody...
97,11-14-15,primary_dem,SANDERS, I don't think any -- I don't think any sensible person would disagree that the invasion of Iraq led to the massive level of instability we are seeing right now.
98,11-14-15,primary_dem,SANDERS,I think that was one of the worst foreign policy blunders in the more than history of the United States.
99,11-14-15,primary_dem,DICKERSON, Alright.
100,11-14-15,primary_dem,DICKERSON,Let's let Secretary Clinton respond to that.
101,11-14-15,primary_dem,CLINTON," Thank you, John."
102,11-14-15,primary_dem,CLINTON,"Well, thank you, John."
103,11-14-15,primary_dem,CLINTON,I think it's important we put this in historic context.
104,11-14-15,primary_dem,CLINTON,"The United States has, unfortunately, been victimized by terrorism going back decades."
105,11-14-15,primary_dem,CLINTON,"In the 1980s, it was in Beirut, Lebanon, under President Reagan's administration, and 258 Americans, marines, embassy personnel, and others were murdered."
106,11-14-15,primary_dem,CLINTON,"We also had attacks on two of our embassies in Tanzania, Kenya, when my husband was president."
107,11-14-15,primary_dem,CLINTON,"Again, Americans murdered."
108,11-14-15,primary_dem,CLINTON,"And then, of course, 9/11 happened, which happened before there was an invasion of Iraq."
109,11-14-15,primary_dem,CLINTON,I have said the invasion of Iraq was a mistake.
110,11-14-15,primary_dem,CLINTON,"But I think if we're ever going to really tackle the problems posed by jihadi extreme terrorism, we need to understand it and realize that it has antecedents to what happened in Iraq and we have to continue to be vigilant about it."
111,11-14-15,primary_dem,DICKERSON, Senator Sanders let me just follow this line of thinking.
112,11-14-15,primary_dem,DICKERSON,"You criticized then, Senator Clinton's vote."
113,11-14-15,primary_dem,DICKERSON,Do you have anything to criticize in the way she performed as Secretary of State?
114,11-14-15,primary_dem,SANDERS," I think we have a disagreement, and the disagreement is that not only did I vote against the war in Iraq."
115,11-14-15,primary_dem,SANDERS,"If you look at history, John, you will find that regime change -- whether it was in the early '50s in Iran, whether it was toppling Salvador Allende in Chile, whether it is overthrowing the government of Guatemala way back when -- these invasions, these toppling of governments, regime changes have unintended consequences."
116,11-14-15,primary_dem,SANDERS,"I would say that on this issue, I'm a little bit more conservative than the Secretary..."
117,11-14-15,primary_dem,DICKERSON, Alright.
118,11-14-15,primary_dem,SANDERS, ... And that I am not a great fan of regime change.
119,11-14-15,primary_dem,DICKERSON, Senator let me...
120,11-14-15,primary_dem,O," John, may I -- may I interject here?"
121,11-14-15,primary_dem,O,"Secretary Clinton also said we -- it was not just the invasion of Iraq which Secretary Clinton voted for and has since said was a big mistake -- and, indeed, it was."
122,11-14-15,primary_dem,O,But it was also the cascading effects that followed that.
123,11-14-15,primary_dem,O,It was also the disbanding of many elements of the Iraqi army that are now showing up as part of ISIS.
124,11-14-15,primary_dem,O,It was country after country without making the investment in human intelligence to understand who the new leaders were and the new forces were that are coming up.
125,11-14-15,primary_dem,O,We need to be much more far thinking in this new 21st century era of -- of nation state failures and conflict.
126,11-14-15,primary_dem,O,It's not just about getting rid of a single dictator.
127,11-14-15,primary_dem,O,It is about understanding the secondary and third consequences that fall next.
128,11-14-15,primary_dem,DICKERSON," All right, Secretary Clinton."
129,11-14-15,primary_dem,CLINTON," Well, of course, each of these cases needs to be looked at individually and analyzed."
130,11-14-15,primary_dem,CLINTON,Part of the problem that we have currently in the Middle East is that Assad has hung on to power with the very strong support of Russia and Iran and with the proxy of Hezbollah being there basically fighting his battles.
131,11-14-15,primary_dem,CLINTON,So I don't think you can paint with a broad brush.
132,11-14-15,primary_dem,CLINTON,This is an incredibly complicated region of the world.
133,11-14-15,primary_dem,CLINTON,It's become more complicated.
134,11-14-15,primary_dem,CLINTON,And many of the fights that are going on are not ones that the United States has either started or have a role in.
135,11-14-15,primary_dem,CLINTON,The Shi'a-Sunni split.
136,11-14-15,primary_dem,CLINTON,The dictatorships have suppressed people's aspirations.
137,11-14-15,primary_dem,CLINTON,The increasing globalization without any real safety valve for people to have a better life.
138,11-14-15,primary_dem,CLINTON,We saw that in Egypt.
139,11-14-15,primary_dem,CLINTON,We saw a dictator overthrown.
140,11-14-15,primary_dem,CLINTON,"We saw a Muslim brotherhood president installed, and then we saw him ousted and the army back."
141,11-14-15,primary_dem,CLINTON,"So, I think we've got to understand the complexity of the world that we are facing and no place is more so than in the Middle East."
142,11-14-15,primary_dem,DICKERSON, I understand.
143,11-14-15,primary_dem,DICKERSON,"Quickly, Senator."
144,11-14-15,primary_dem,SANDERS, The Secretary's obviously right.
145,11-14-15,primary_dem,SANDERS,It is enormously complicated.
146,11-14-15,primary_dem,SANDERS,"But here's something that I believe we have to do as we put together an international coalition, and that is we have to understand that the Muslim nations in the region -- Saudi Arabia, Iran, Turkey, Jordan -- all of these nations, they're going to have to get their hands dirty, their boots on the ground."
147,11-14-15,primary_dem,SANDERS,They are going to have to take on ISIS.
148,11-14-15,primary_dem,SANDERS,This is a war for the soul of Islam.
149,11-14-15,primary_dem,SANDERS,"And those countries who are opposed to Islam, they are going to have to get deeply involved in a way that is not the case today."
150,11-14-15,primary_dem,SANDERS,We should be supportive of that effort.
151,11-14-15,primary_dem,SANDERS,"So should the UK, so should France."
152,11-14-15,primary_dem,SANDERS,But those Muslim countries are going to have to lead the effort.
153,11-14-15,primary_dem,SANDERS,They are not doing it now.
154,11-14-15,primary_dem,DICKERSON, Secretary Clinton.
155,11-14-15,primary_dem,CLINTON," Well, I think -- I think that is very unfair to a few you mentioned, most particularly Jordan, which has put a lot on the line for the United States, has also taken in hundreds of thousands of refugees from Syria, and has been, therefore, subjected to threats and attacks by extremists themselves."
156,11-14-15,primary_dem,CLINTON,"I do agree that in particular, Turkey and the Gulf nations have got to make up their minds."
157,11-14-15,primary_dem,CLINTON,Are they going to stand with us against this kind of jihadi radicalism or not?
158,11-14-15,primary_dem,CLINTON,And there are many ways of doing it.
159,11-14-15,primary_dem,CLINTON,They can provide forces.
160,11-14-15,primary_dem,CLINTON,They can provide resources.
161,11-14-15,primary_dem,CLINTON,But they need to be absolutely clear about where they stand.
162,11-14-15,primary_dem,DICKERSON," Let me ask you, Secretary Clinton, a question about leadership."
163,11-14-15,primary_dem,DICKERSON,We're talking about what role does America take?
164,11-14-15,primary_dem,DICKERSON,Let me ask you about Libya.
165,11-14-15,primary_dem,DICKERSON,So Libya is a country in which ISIS has taken hold in part because of the chaos after Muammar Gaddafi.
166,11-14-15,primary_dem,DICKERSON,That was an operation you championed.
167,11-14-15,primary_dem,DICKERSON,President Obama says this is the lesson he took from that operation.
168,11-14-15,primary_dem,DICKERSON,"In an interview he said, the lesson was, do we have an answer for the day after?"
169,11-14-15,primary_dem,DICKERSON,Wasn't that suppose to be one of the lessons that we learned after the Iraq war?
170,11-14-15,primary_dem,DICKERSON,And how did you get it wrong with Libya if the key lesson of the Iraq war is have a plan for after?
171,11-14-15,primary_dem,CLINTON," Well, we did have a plan, and I think it's fair to say that of all of the Arab leaders, Gaddafi probably had more blood on his hands of Americans than anybody else."
172,11-14-15,primary_dem,CLINTON,"And when he moved on his own people, threatening a massacre, genocide, the Europeans and the Arabs, our allies and partners, did ask for American help and we provided it."
173,11-14-15,primary_dem,CLINTON,"And we didn't put a single boot on the ground, and Gaddafi was deposed."
174,11-14-15,primary_dem,CLINTON,"The Libyans turned out for one of the most successful, fairest elections that any Arab country has had."
175,11-14-15,primary_dem,CLINTON,They elected moderate leaders.
176,11-14-15,primary_dem,CLINTON,"Now, there has been a lot of turmoil and trouble as they have tried to deal with these radical elements which you find in this arc of instability, from north Africa to Afghanistan."
177,11-14-15,primary_dem,CLINTON,"And it is imperative that we do more not only to help our friends and partners protect themselves and protect our own homeland, but also to work to try to deal with this arc of instability, which does have a lot of impact on what happens in a country like Libya."
178,11-14-15,primary_dem,DICKERSON, Governor O' Malley I want to ask you a question and you can add whatever you'd like to.
179,11-14-15,primary_dem,DICKERSON,"But let me ask you, is the world too dangerous a place for a governor who has no foreign policy experience?"
180,11-14-15,primary_dem,O," John, the world is a very dangerous place, but the world is not too dangerous of a place for the United States of America, provided we act according to our principles, provided we act intelligently."
181,11-14-15,primary_dem,O,"I mean, let's talk about this arc of instability that Secretary Clinton talked about."
182,11-14-15,primary_dem,O,Libya is now a mess.
183,11-14-15,primary_dem,O,Syria is a mess.
184,11-14-15,primary_dem,O,Iraq is a mess.
185,11-14-15,primary_dem,O,Afghanistan is a mess.
186,11-14-15,primary_dem,O,"As Americans, we have shown ourselves to have the greatest military on the face of the planet, but we are not so very good at anticipating threats and appreciating just how difficult it is to build up stable democracies, to make the investments and sustainable development that we must as a nation if we are to attack the root causes of these sorts of instability."
187,11-14-15,primary_dem,O,"And I wanted to add one other thing, John, and I think it's important for all of us on this stage."
188,11-14-15,primary_dem,O,"I was in Burlington, Iowa."
189,11-14-15,primary_dem,O,"And a mom of a service member of ours who served two duties in Iraq said, Governor O' Malley, please, when you're with your other candidates and colleagues on stage, please don't use the term 'boots on the ground'."
190,11-14-15,primary_dem,O,Let's don't use the term 'boots on the ground'.
191,11-14-15,primary_dem,O,My son is not a pair of boots on the ground.
192,11-14-15,primary_dem,O,"These are American soldiers and we fail them when we fail to take into account what happens the day after a dictator falls and when we fail to act with a whole of government approach with sustainable development, diplomacy, and our economic power in alignment with our principles."
193,11-14-15,primary_dem,CLINTON," Well, I think it's perfectly fair to say that we invested quite a bit in development aid."
194,11-14-15,primary_dem,CLINTON,"Some of the bravest people that I had the privilege of working with as secretary of state were our development professionals who went sometimes alone, sometimes with our military, into very dangerous places in Iraq, in Afghanistan, elsewhere."
195,11-14-15,primary_dem,CLINTON,"So, there does need to be a whole of government approach, but just because we're involved and we have a strategy doesn't mean we're going to be able to dictate the outcome."
196,11-14-15,primary_dem,CLINTON,These are often very long- term kinds of investments that have to be made.
197,11-14-15,primary_dem,CLINTON,[crosstalk]
198,11-14-15,primary_dem,SANDERS," When you talk about the long-term consequences of war, let's talk about the men and women who came home from war."
199,11-14-15,primary_dem,SANDERS,"The 500,000 who came home with PTSD, and traumatic brain injury."
200,11-14-15,primary_dem,SANDERS,"And I would hope in the midst of all of this discussion, this country makes certain that we do not turn our backs on the men and women who put their lives on the line to defend us, and that we stand with them as they have stood with us."
201,11-14-15,primary_dem,DICKERSON," Secretary Clinton, you mentioned radical jihadists."
202,11-14-15,primary_dem,DICKERSON,"Marco Rubio, also running for president, said that this attack showed and the attack in Paris showed that we are at war with radical Islam."
203,11-14-15,primary_dem,DICKERSON,"Do you agree with that characterization, radical Islam?"
204,11-14-15,primary_dem,CLINTON, I don't think we're at war with Islam.
205,11-14-15,primary_dem,CLINTON,I don't think we're at war with all Muslims.
206,11-14-15,primary_dem,CLINTON,I think we're at war with jihadists who have --
207,11-14-15,primary_dem,DICKERSON, Just to interrupt.
