,Date,Debate Type,Speaker,Sents
202,11-14-15,primary_dem,DICKERSON,"Do you agree with that characterization, radical Islam?"
203,11-14-15,primary_dem,CLINTON, I don't think we're at war with Islam.
204,11-14-15,primary_dem,CLINTON,I don't think we're at war with all Muslims.
205,11-14-15,primary_dem,CLINTON,I think we're at war with jihadists who have --
206,11-14-15,primary_dem,DICKERSON, Just to interrupt.
207,11-14-15,primary_dem,DICKERSON,He didn't say all Muslims.
208,11-14-15,primary_dem,DICKERSON,He just said radical Islam.
209,11-14-15,primary_dem,DICKERSON,Is that a phrase you don't...
210,11-14-15,primary_dem,CLINTON," I think THAT you can talk about Islamists who clearly are also jihadists, but I think it's not particularly helpful to make the case that Senator Sanders was just making that I agree with, that we've got to reach out to Muslim countries."
211,11-14-15,primary_dem,CLINTON,We've got to have them be part of our coalition.
212,11-14-15,primary_dem,CLINTON,"If they hear people running for president who basically shortcut it to say we are somehow against Islam, that was one of the real contributions, despite all the other problems, that George W. Bush made after 9/11 when he basically said after going to a Mosque in Washington, we are not at war with Islam or Muslims."
213,11-14-15,primary_dem,CLINTON,We are at war with violent extremism.
214,11-14-15,primary_dem,CLINTON,We are at war with people who use their religion for purposes of power and oppression.
215,11-14-15,primary_dem,CLINTON,"And, yes, we are at war with those people."
216,11-14-15,primary_dem,CLINTON,But I don't want us to be painting with too broad a brush.
217,11-14-15,primary_dem,DICKERSON," The reason I ask is you gave a speech at Georgetown University in which you said, that it was important to show, quote, ""respect, even for one's enemies."
218,11-14-15,primary_dem,DICKERSON,"Trying to understand and in so far as psychologically possible, empathize with their perspective and point of view."""
219,11-14-15,primary_dem,DICKERSON,Can you explain what that means in the context of this kind of barbarism?
220,11-14-15,primary_dem,CLINTON," I think with this kind of barbarism and nihilism, it's very hard to understand, other than the lust for power, the rejection of modernity, the total disregard for human rights, freedom, or any other value that we know and respect."
221,11-14-15,primary_dem,CLINTON,"Historically, it is important to try to understand your adversary in order to figure out how they are thinking, what they will be doing, how they will react."
222,11-14-15,primary_dem,CLINTON,I plead that it's very difficult when you deal with ISIS and organizations like that whose behavior is so barbaric and so vicious that it doesn't seem to have any purpose other than lust for killing and power and that's very difficult to put ourselves in the other shoe.
223,11-14-15,primary_dem,CLINTON,[crosstalk]
224,11-14-15,primary_dem,DICKERSON," Just quickly, do either of you, radical Islam, do either of you use that phrase?"
225,11-14-15,primary_dem,SANDERS, I don't think the term is what's important.
226,11-14-15,primary_dem,SANDERS,"What is important to understand is we have organizations, whether it is ISIS or Al Qaida, who do believe we should go back several thousand years."
227,11-14-15,primary_dem,SANDERS,"We should make women third-class citizens, that we should allow children to be sexually assaulted, that they are a danger to modern society."
228,11-14-15,primary_dem,SANDERS,"And that this world, with American leadership, can and must come together to destroy them."
229,11-14-15,primary_dem,SANDERS,We can do that.
230,11-14-15,primary_dem,SANDERS,"And it requires an entire world to come together, including in a very active way, the Muslim nations."
231,11-14-15,primary_dem,DICKERSON," Governor O' Malley, you have been making the case when you talk about lack of forward vision, you're essentially saying that Secretary Clinton lacks that vision and this critique matches up with this discussion of language."
232,11-14-15,primary_dem,DICKERSON,The critique is that the softness of language betrays a softness of approach.
233,11-14-15,primary_dem,DICKERSON,"So if this language -- if you don't call it by what it is, how can your approach be effective to the cause?"
234,11-14-15,primary_dem,DICKERSON,that's the critique.
235,11-14-15,primary_dem,DICKERSON,"O'MALLEY: I believe calling it what it is, is to say radical jihadis."
236,11-14-15,primary_dem,DICKERSON,That's calling it what it is.
237,11-14-15,primary_dem,DICKERSON,"But John, let's not fall into the trap of thinking that all of our Muslim American neighbors in this country are somehow our enemies here."
238,11-14-15,primary_dem,DICKERSON,They are our first line of defense.
239,11-14-15,primary_dem,DICKERSON,"And we are going to be able to defeat ISIS on the ground there, as well as in this world, because of the Muslim Americans in our country and throughout the world who understand that this brutal and barbaric group is perverting the name of a great world religion."
240,11-14-15,primary_dem,DICKERSON,"And now, like never before, we need our Muslim American neighbors to stand up and to -- and to be a part of this."
241,11-14-15,primary_dem,DICKERSON," Secretary Clinton, the French president has called this attack an act of war."
242,11-14-15,primary_dem,CLINTON, Yes.
243,11-14-15,primary_dem,DICKERSON, A couple of days ago you were asked if you would declare war on ISIS and you said no.
244,11-14-15,primary_dem,DICKERSON,What would you say now?
245,11-14-15,primary_dem,CLINTON," Well, we have an authorization to use military force against terrorists."
246,11-14-15,primary_dem,CLINTON,We passed it after 9/11.
247,11-14-15,primary_dem,DICKERSON, And you think that covers all of this?
248,11-14-15,primary_dem,CLINTON, It certainly does cover it.
249,11-14-15,primary_dem,CLINTON,I would like to see it updated.
250,11-14-15,primary_dem,DICKERSON," If you were in the Senate, would you be okay with the commander in chief doing that without it coming back to you?"
251,11-14-15,primary_dem,CLINTON," No, it would have to go through the Congress, and I know the White House has actually been working with members of Congress."
252,11-14-15,primary_dem,CLINTON,"Maybe now we can get it moving again so that we can upgrade it so that it does include all the tools and everything in our arsenal that we can use to try to work with our allies and our friends, come up with better intelligence."
253,11-14-15,primary_dem,CLINTON,"You know, it is difficult finding intelligence that is actionable in a lot of these places, but we have to keep trying."
254,11-14-15,primary_dem,CLINTON,"And we have to do more to prevent the flood of foreign fighters that have gone to Syria, especially the ones with western passports, that come back."
255,11-14-15,primary_dem,CLINTON,"So there's a lot of work we need to do and I want to be sure what's called the AUMF, has the authority that is needed going forward."
256,11-14-15,primary_dem,DICKERSON," Senator, let me just -- let's add to whatever you've got to say."
257,11-14-15,primary_dem,DICKERSON,Refugees.
258,11-14-15,primary_dem,DICKERSON,You've been a little vague on what you would do about the Syrian refugees.
259,11-14-15,primary_dem,DICKERSON,What's your view on them now?
260,11-14-15,primary_dem,SANDERS," Let me do that but let me pick up on an issue, a very important issue that we have not yet discussed."
261,11-14-15,primary_dem,SANDERS,This nation is the most powerful military in the world.
262,11-14-15,primary_dem,SANDERS,"We're spending over $600 billion a year on the military and yet, significantly less than 10 percent of that money is used to be fighting international terrorism."
263,11-14-15,primary_dem,SANDERS,"We are spending hundreds of billions of dollars maintaining 5,000 nuclear weapons."
264,11-14-15,primary_dem,SANDERS,"I think we need major reform in the military, making it more cost effective, but also focusing on the real crisis that faces us."
265,11-14-15,primary_dem,SANDERS,The Cold War is over.
266,11-14-15,primary_dem,SANDERS,"And our focus has got to be on intelligence, increased manpower, fighting internationally targets."
267,11-14-15,primary_dem,SANDERS,"So, in terms of refugees, I believe that the United States has the moral responsibility with Europe, with Gulf countries like Saudi Arabia to make sure that when people leave countries like Afghanistan and Syria with nothing more than the clothing on their back that, of course, we reach out."
268,11-14-15,primary_dem,SANDERS,"Now, what the magic number is, I don't know, because we don't know the extent of the problem."
269,11-14-15,primary_dem,SANDERS,But I certainly think that the United States should take its full responsibility in helping those people.
270,11-14-15,primary_dem,DICKERSON," Governor O'Malley, you have a magic number."
271,11-14-15,primary_dem,DICKERSON,"I think it's 65,000."
272,11-14-15,primary_dem,DICKERSON,Does that number go up or down based on what happened yesterday?
273,11-14-15,primary_dem,DICKERSON,"O'MALLEY: John, I was the first person on this stage to say that we should accept the 65,000 Syrian refugees that were fleeing the sort of murder of ISIL, and I believe that that needs to be done with proper screening."
274,11-14-15,primary_dem,DICKERSON,"But accommodating 65,000 refugees in our country today, people of 320 million, is akin to making room for 6.5 more people in a baseball stadium with 32,000."
275,11-14-15,primary_dem,DICKERSON,"There are other ways to lead and to be a moral leader in this world, rather than at the opposite end of a drone strike."
276,11-14-15,primary_dem,DICKERSON,But I would want to agree with something that Senator Sanders says.
277,11-14-15,primary_dem,DICKERSON,The nature of warfare has changed.
278,11-14-15,primary_dem,DICKERSON,This is not a conflict where we send in the third divisions of Marines.
279,11-14-15,primary_dem,DICKERSON,"This is a new era of conflict where traditional ways of huge standing armies are not as -- serve our purposes as well as special ops, better intelligence and being more proactive."
280,11-14-15,primary_dem,DICKERSON," Just very quickly, 65,000, the number stays?"
281,11-14-15,primary_dem,DICKERSON,O'MALLEY: That's what I understand is the request from the international...
282,11-14-15,primary_dem,DICKERSON," But for you, what would you want?"
283,11-14-15,primary_dem,DICKERSON,O'MALLEY: I would want us to take our place among the nations of the world to alleviate this sort of death and the specter we saw of little kids' bodies washing up on a beach.
284,11-14-15,primary_dem,DICKERSON," Secretary Clinton, let me ask you a question from twitter which has come in and this is a question on this issue of refugees."
285,11-14-15,primary_dem,DICKERSON,"The question is, with the U.S. preparing to absorb Syrian refugees, how do you propose we screen those coming in to keep citizens safe?"
286,11-14-15,primary_dem,CLINTON, I think that is the number one requirement.
287,11-14-15,primary_dem,CLINTON,I also said that we should take increased numbers of refugees.
288,11-14-15,primary_dem,CLINTON,The administration originally said 10.
289,11-14-15,primary_dem,CLINTON,"I said we should go to 65, but only if we have as careful a screening and vetting process as we can imagine, whatever resources it takes because I do not want us to, in any way, inadvertently allow people who wish us harm to come into our country."
290,11-14-15,primary_dem,CLINTON,But I want to say a quick word about what Senator Sanders and then Governor O'Malley said.
291,11-14-15,primary_dem,CLINTON,"We do have to take a hard look at the defense budget and we do have to figure out how we get ready to fight the adversaries of the future, not the past."
292,11-14-15,primary_dem,CLINTON,But we have to also be very clear that we do have some continuing challenges.
293,11-14-15,primary_dem,CLINTON,We've got challenges in the South China Sea because of what China is doing in building up these military installations.
294,11-14-15,primary_dem,CLINTON,We have problems with Russia.
295,11-14-15,primary_dem,CLINTON,"Just the other day, Russia allowed a television camera to see the plans for a drone submarine that could carry a tactical nuclear weapon."
296,11-14-15,primary_dem,CLINTON,So we've got to look at the full range and then come to some smart decisions about having more streamlined and focused approach.
297,11-14-15,primary_dem,DICKERSON, Alright.
298,11-14-15,primary_dem,DICKERSON,"Senator Sanders, I'm sorry."
299,11-14-15,primary_dem,DICKERSON,We're going to have to take a break now.
300,11-14-15,primary_dem,DICKERSON,"We will have more of the Democratic debate here from Drake University in Des Moines, Iowa."
301,11-14-15,primary_dem,DICKERSON,"[applause]

[commercial break]"
302,11-14-15,primary_dem,DICKERSON," Want to turn now from terrorism to another important issue for many Americans, the financial squeeze on the the middle class."
303,11-14-15,primary_dem,DICKERSON,"For that, we go to my CBS News Colleague, Nancy Cordes."
304,11-14-15,primary_dem,DICKERSON,Nancy?
305,11-14-15,primary_dem,CORDES," John, thanks so much."
306,11-14-15,primary_dem,CORDES,"We've learned a lot during the course of this campaign about the things that you'd like to do that you say would help the middle class, but we haven't heard quite as much about who would pick up the tab."
307,11-14-15,primary_dem,CORDES,"So Secretary Clinton, first to you."
308,11-14-15,primary_dem,CORDES,You want to cap individuals' prescription drug costs at $250 a month.
309,11-14-15,primary_dem,CORDES,You want to make public college debt-free.
310,11-14-15,primary_dem,CORDES,You want community college to be free altogether.
311,11-14-15,primary_dem,CORDES,And you want mandatory paid family leave.
312,11-14-15,primary_dem,CORDES,So who pays for all that?
313,11-14-15,primary_dem,CORDES,Is it employers?
314,11-14-15,primary_dem,CORDES,"Is it the taxpayers, and which taxpayers?"
315,11-14-15,primary_dem,CLINTON," Well, first of all, it isn't the middle class."
316,11-14-15,primary_dem,CLINTON,"I have made very clear that hardworking, middle-class families need a raise, not a tax increase."
317,11-14-15,primary_dem,CLINTON,"In fact, wages adjusted for inflation haven't risen since the turn of the last century, after my husband's administration."
318,11-14-15,primary_dem,CLINTON,"So we have a lot of work to do to get jobs going again, get incomes rising again."
319,11-14-15,primary_dem,CLINTON,"And I have laid out specific plans -- you can go to my web site, hillaryclinton.com, and read the details."
320,11-14-15,primary_dem,CLINTON,"And I will pay for it by, yes, taxing the wealthy more, closing corporate loopholes, deductions, and other kinds of favorable treatment."
321,11-14-15,primary_dem,CLINTON,"And I can do it without raising the debt, without raising taxes on the middle class and making it reasonably manageable within our budget so that we can be fiscally responsible at the same time."
322,11-14-15,primary_dem,CORDES, But a quick follow-up on that $250-a-month cap.
323,11-14-15,primary_dem,CORDES,Wouldn't the pharmaceutical companies and the insurance companies just pass that cost on to the consumers in the form of higher premiums?
324,11-14-15,primary_dem,CLINTON," Well, we're going to have to redo the way the prescription drug industry does business."
325,11-14-15,primary_dem,CLINTON,"For example, it is outrageous that we don't have an opportunity for Medicare to negotiate for lower prices."
326,11-14-15,primary_dem,CLINTON,"In fact, American consumers pay the highest prices in the world for drugs that we help to be developed through the National Institute of Health and that we then tested through the FDA."
327,11-14-15,primary_dem,CLINTON,So there's more to my plan than just the cap.
328,11-14-15,primary_dem,CLINTON,We have to go after price gouging and monopolistic practices and get Medicare the authority to negotiate.
329,11-14-15,primary_dem,CORDES," Governor O'Malley, you also want to make public college debt-free."
330,11-14-15,primary_dem,CORDES,"You want...

O'MALLEY: That's right."
331,11-14-15,primary_dem,CORDES, ... states to freeze tuition.
332,11-14-15,primary_dem,CORDES,You've got your own family leave plan.
333,11-14-15,primary_dem,CORDES,How would you pay for it?
334,11-14-15,primary_dem,CORDES,"In Maryland, you raised the sales tax, you raised the gas tax and you raised taxes on families making over $150,000 a year."
335,11-14-15,primary_dem,CORDES,Is that the blueprint?
336,11-14-15,primary_dem,CORDES,"O'MALLEY: Nancy, the blueprint in Maryland that we followed was yes, we did in fact raise the sales tax by a penny and we made our public schools the best public schools in America for five years in a row with that investment."
337,11-14-15,primary_dem,CORDES,"And yes, we did ask everyone -- the top 14 percent of earners in our state to pay more in their income tax and we were the only state to go four years in a row without a penny's increase to college tuitions."
338,11-14-15,primary_dem,CORDES,"So while other candidates will talk about the things they would like to do, I actually got these things done in a state that defended not only a AAA bond rating, but the highest median income in America."
339,11-14-15,primary_dem,CORDES,"I believe that we pay for many of the things that we need to do again as a nation, investing in the skills of our people, our infrastructure, and research and development and also climate change by the elimination of one big entitlement that we can no longer afford as a people, and that is the entitlement that many of our super wealthiest citizens feel they are entitled to pay -- namely, a much lower income tax rate and a lower tax rate on capital gains."
340,11-14-15,primary_dem,CORDES,"I believe capital gains, for the most part, should be taxed the same way we tax income from hard work, sweat, and toil."
341,11-14-15,primary_dem,CORDES,"And if we do those things, we can be a country that actually can afford debt-free college again."
342,11-14-15,primary_dem,CORDES," Senator Sanders, you want to make public college free altogether."
343,11-14-15,primary_dem,CORDES,You want to increase Social Security benefits and you want to spend $1 trillion on infrastructure.
344,11-14-15,primary_dem,CORDES,"So you said that to do some of these things, you'll impose a tax on top earners."
345,11-14-15,primary_dem,CORDES,How high would their rate go in a Sanders administration?
346,11-14-15,primary_dem,SANDERS, Let me put those proposals-- and you're absolutely right.
347,11-14-15,primary_dem,SANDERS,That is what I want to do.
348,11-14-15,primary_dem,SANDERS,"That is what is going to have to happen, if we want to revitalize and rebuild the crumbling middle class."
349,11-14-15,primary_dem,SANDERS,"In the last 30 years, there has been a massive redistribution of wealth."
350,11-14-15,primary_dem,SANDERS,And I know that term gets my Republican friends nervous.
351,11-14-15,primary_dem,SANDERS,"The problem is, this redistribution has gone in the wrong direction."
352,11-14-15,primary_dem,SANDERS,Trillions of dollars have gone from the middle class and working families to the top one-tenth of one percent who have doubled the percentage of wealth they now own.
353,11-14-15,primary_dem,SANDERS,"Yes, I do believe that we must end corporate loopholes, such that major corporations year after year pay virtually zero in federal income tax, because they're stashing the money in the Cayman Islands."
354,11-14-15,primary_dem,SANDERS,"Yes, I do believe there must be a tax on Wall Street speculation."
355,11-14-15,primary_dem,SANDERS,We bailed out Wall Street.
356,11-14-15,primary_dem,SANDERS,"It's their time to bail out the middle class, help our kids be able to go to college tuition-free."
357,11-14-15,primary_dem,SANDERS,"So we pay for this by do demanding that the wealthiest people and the largest corporations, who have gotten away with murder for years, start paying their fair share."
358,11-14-15,primary_dem,CORDES, But let's get specific.
359,11-14-15,primary_dem,CORDES,How high would you go?
360,11-14-15,primary_dem,CORDES,You have said before you would go above 50 percent.
361,11-14-15,primary_dem,CORDES,How high?
362,11-14-15,primary_dem,SANDERS," We haven't come up with an exact number yet, but it will not be as high as the number under Dwight D. Eisenhower, which was 90 percent."
363,11-14-15,primary_dem,SANDERS,"But it will be...[laughter]

I'm not that much of a socialist compared to Eisenhower."
364,11-14-15,primary_dem,SANDERS,"[applause]

But -- but we are going to end the absurdity, as Warren Buffet often remind us."
365,11-14-15,primary_dem,SANDERS,O'MALLEY: That's right.
366,11-14-15,primary_dem,SANDERS, That billionaires pay an effective tax rate lower than nurses or truck drivers.
367,11-14-15,primary_dem,SANDERS,That makes no sense at all.
368,11-14-15,primary_dem,SANDERS,"There has to be real tax reform, and the wealthiest and large corporations will pay when I'm president."
369,11-14-15,primary_dem,SANDERS,"O'MALLEY: And may I point out that under Ronald Reagan's first term, the highest marginal rate was 70 percent."
370,11-14-15,primary_dem,SANDERS,"And in talking to a lot of our neighbors who are in that super wealthy, millionaire and billionaire category, a great numbers of them love their country enough to do more again in order to create more opportunity for America's middle class."
371,11-14-15,primary_dem,CORDES," Secretary Clinton, Americans say that health care costs and wages are their top financial concerns."
372,11-14-15,primary_dem,CORDES,"And health care deductibles, alone, have risen 67 percent over the past five years."
373,11-14-15,primary_dem,CORDES,Is this something that Obamacare was designed to address?
374,11-14-15,primary_dem,CORDES,"And if not, why not?"
375,11-14-15,primary_dem,CLINTON," Well, look, I believe that we've made great progress as a country with the Affordable Care Act."
376,11-14-15,primary_dem,CLINTON,We've been struggling to get this done since Harry Truman.
377,11-14-15,primary_dem,CLINTON,"And it was not only a great accomplishment of the Democratic Party, but of President Obama."
378,11-14-15,primary_dem,CLINTON,I do think that it's important to defend it.
379,11-14-15,primary_dem,CLINTON,The Republicans have voted to repeal it nearly 60 times.
380,11-14-15,primary_dem,CLINTON,"They would like to rip it up and start all over again, throw our nation back into this really contentious debate that we've had about health care for quite some time now."
381,11-14-15,primary_dem,CLINTON,I want to build on and improve the Affordable Care Act.
382,11-14-15,primary_dem,CLINTON,"I would certainly tackle the cost issues, because I think that once the foundation was laid with a system to try to get as many people as possible into it, to end insurance discrimination against people with preexisting conditions or women, for example, that, yes, we were going to have to figure out how to get more competition in the insurance market, how to get the costs of -- particularly, prescription drugs, but other out-of-pocket expenses down."
383,11-14-15,primary_dem,CLINTON,"But I think it's important to understand there's a significant difference that I have with Senator Sanders about how best to provide quality, affordable health care for everyone."
384,11-14-15,primary_dem,CLINTON,And it's-- it's a worthy debate.
385,11-14-15,primary_dem,CLINTON,It's an important one that we should be engaged in.
386,11-14-15,primary_dem,CORDES, It is -- it is a worthy debate.
387,11-14-15,primary_dem,CORDES,"Senator Sanders, a quick response, and then we'll get into health care again later."
388,11-14-15,primary_dem,SANDERS, I am on the committee that helped write the Affordable Care Act.
389,11-14-15,primary_dem,SANDERS,We have made some good progress.
390,11-14-15,primary_dem,SANDERS,Now what we have to take on is the pharmaceutical industry that is ripping off the American people every single day.
391,11-14-15,primary_dem,SANDERS,I am proud that I was the first member of Congress to take Americans over the Canadian border to buy breast cancer drugs for one-tenth the price they were paying in the United States.
392,11-14-15,primary_dem,SANDERS,"But at the end of the day, no doubt, the Affordable Care Act is a step forward."
393,11-14-15,primary_dem,SANDERS,I think we all support it.
394,11-14-15,primary_dem,SANDERS,I believe we've got to go further.
395,11-14-15,primary_dem,SANDERS,"I want to end the international embarrassment of the United States of America being the only major country on earth that doesn't guarantee health care to all people as a right, not a privilege."
396,11-14-15,primary_dem,SANDERS,"[applause]

And also -- also, what we should be clear about is we end up spending -- and I think the secretary knows this -- far more per capita on health care than any other major country, and our outcomes, health care outcomes are not necessarily that good."
397,11-14-15,primary_dem,SANDERS,"O'MALLEY: All right, Nancy, I really wish you'd come back to me on this on this one, John..."
398,11-14-15,primary_dem,DICKERSON," All right, I am sorry, Governor, we're going to have to go, I apologize."
399,11-14-15,primary_dem,DICKERSON,"O'MALLEY: Because we have found a way to reduce hospital costs, so whenever we come..."
400,11-14-15,primary_dem,DICKERSON," Governor -- Governor, you're breaking the rules."
401,11-14-15,primary_dem,DICKERSON,"[laughter]

I'm sorry, we're going to have to cut for a commercial."
402,11-14-15,primary_dem,DICKERSON,"We'll be right back here from Drake University here in Des Moines, Iowa."
403,11-14-15,primary_dem,DICKERSON,O'MALLEY: Thank you.
404,11-14-15,primary_dem,DICKERSON,[commercial break]
405,11-14-15,primary_dem,DICKERSON, There is a lot of presidential history here in Iowa.
