,Date,Debate Type,Speaker,Sents
406,11-14-15,primary_dem,DICKERSON,It hosted the first in the nation caucuses.
407,11-14-15,primary_dem,DICKERSON,"Herbert Hoover was born in West Branch, and tonight, we are in Polk County, named for our 11th president, with three people who hope to be number 45."
408,11-14-15,primary_dem,DICKERSON,"Joining my now to question them are Iowans Kevin Cooney of KCCI and Kathie Obradovich, of the Des Moines Register."
409,11-14-15,primary_dem,DICKERSON,Kevin?
410,11-14-15,primary_dem,COONEY," Thanks, John."
411,11-14-15,primary_dem,COONEY,"Candidates, we've already heard your answers on what you would do with Syrian refugees, but a crucial part of the immigration debate here at home is control of our own borders."
412,11-14-15,primary_dem,COONEY,Republicans say the borders -- securing borders is a top priority.
413,11-14-15,primary_dem,COONEY,Democrats say they want to plan for comprehensive immigration reform.
414,11-14-15,primary_dem,COONEY,"So, Governor O'Malley, are you willing to compromise on this particular issue to focus on border security first in favor of keeping the country safe?"
415,11-14-15,primary_dem,COONEY,"O'MALLEY: Well, Mr. Cooney, we've actually been focusing on border security to the exclusion of talking about comprehensive immigration reform."
416,11-14-15,primary_dem,COONEY,"In fact, if more border security and these -- and more and more deportations were going to bring our Republican brothers and sisters to the table, it would have happened long ago."
417,11-14-15,primary_dem,COONEY,"The fact of the matter is -- and let's say it in our debate, because you'll never hear this from that immigration-bashing carnival barker, Donald Trump, the truth of the matter is... [applause]

The truth of the matter is, net immigration from Mexico last year was zero."
418,11-14-15,primary_dem,COONEY,Fact check me.
419,11-14-15,primary_dem,COONEY,Go ahead.
420,11-14-15,primary_dem,COONEY,Check it out.
421,11-14-15,primary_dem,COONEY,"But the truth of the matter is, if we want wages to go up, we've got to get 11 million of our neighbors out of off the book shadow economy, and into the full light of an American economy."
422,11-14-15,primary_dem,COONEY,That's what our parents and grandparents always did.
423,11-14-15,primary_dem,COONEY,That's what we need to do as a nation.
424,11-14-15,primary_dem,COONEY,"Yes, we must protect our borders."
425,11-14-15,primary_dem,COONEY,"But there is no substitute for having comprehensive immigration reform with a pathway to citizenship for 11 million people, many of whom have known no other country but the United States of America."
426,11-14-15,primary_dem,COONEY,Our symbol is the Statue of Liberty.
427,11-14-15,primary_dem,COONEY,It is not a barbed wire fence.
428,11-14-15,primary_dem,COONEY, Thank you.
429,11-14-15,primary_dem,COONEY,"Now, Secretary Clinton said you would go further than the President when it comes to taking executive action to implement immigration reforms."
430,11-14-15,primary_dem,COONEY,But the President's already facing legal trouble on this.
431,11-14-15,primary_dem,COONEY,We've seen it more just in the past week.
432,11-14-15,primary_dem,COONEY,"Realistically, how could you go further with executive action?"
433,11-14-15,primary_dem,CLINTON," Well, first of all, I know that the President has appealed the decision to the Supreme Court."
434,11-14-15,primary_dem,CLINTON,"And my reading of the law and the Constitution convinces me that the President has the authority that he is attempting to exercise with respect to dreamers and their parents, because I think all of us on this stage agree that we need comprehensive immigration reform with a path to citizenship."
435,11-14-15,primary_dem,CLINTON,Border security has always been a part of that debate.
436,11-14-15,primary_dem,CLINTON,And it is a fact that the net immigration from Mexico and South has basically zeroed out.
437,11-14-15,primary_dem,CLINTON,"So, what we want to do is to say, look, we have 11 million people who have been here, many of them for decades."
438,11-14-15,primary_dem,CLINTON,"They have children who are doing so well, I've met and worked with dreamers."
439,11-14-15,primary_dem,CLINTON,I think any parent would be so proud of them.
440,11-14-15,primary_dem,CLINTON,So let's move toward what we should be doing as a nation and follow the values of our immigration history and begin to make it possible for them to come out of the shadows and to have a future that gives them a full chance of citizenship.
441,11-14-15,primary_dem,CLINTON,[applause]
442,11-14-15,primary_dem,COONEY, Kathie.
443,11-14-15,primary_dem,OBRADOVICH," Senator Sanders, you've actually talked about immigration as being a wage issue in the United States."
444,11-14-15,primary_dem,OBRADOVICH,And I want to actually go directly to the wage issue now.
445,11-14-15,primary_dem,OBRADOVICH,You called for raising the minimum wage to $15 an hour everywhere in the country.
446,11-14-15,primary_dem,OBRADOVICH,"But the President's former chair of the Council of Economic Advisers, Alan Krueger, has said a national increase of $15 could lead to undesirable and unintended consequences of job loss."
447,11-14-15,primary_dem,OBRADOVICH,What level of job loss would you consider unacceptable?
448,11-14-15,primary_dem,SANDERS," Kathie, let me say this."
449,11-14-15,primary_dem,SANDERS,"You know, no public policy doesn't have, in some cases, negative consequences."
450,11-14-15,primary_dem,SANDERS,"But at the end of the day, what you have right now are millions of Americans working two or three jobs because their wages that they are earning are just too low."
451,11-14-15,primary_dem,SANDERS,Real inflation accounted for wages has declined precipitously over the years.
452,11-14-15,primary_dem,SANDERS,"So I believe that, in fact, this country needs to move towards a living wage."
453,11-14-15,primary_dem,SANDERS,"It is not a radical idea to say that if somebody works 40 hours a week, that person should not be living in poverty."
454,11-14-15,primary_dem,SANDERS,It is not a radical idea to say that a single mom should be earning enough money to take care of her kids.
455,11-14-15,primary_dem,SANDERS,"So I believe that over the next few years, not tomorrow, but over the next few years, we have got to move the minimum wage to a living wage, 15 bucks an hour."
456,11-14-15,primary_dem,SANDERS,And I apologize to nobody for that.
457,11-14-15,primary_dem,OBRADOVICH," You said there are consequences... [applause]

You said there are consequences for -- for any policy."
458,11-14-15,primary_dem,OBRADOVICH,Do you think job losses are a consequence that are...
459,11-14-15,primary_dem,SANDERS," This is what I think -- this is what many economists believe that one of the reasons that real unemployment in this country is 10 percent, one of the reasons that African American youth unemployment and underemployment is 51 percent is the average worker in America doesn't have any disposable income."
460,11-14-15,primary_dem,SANDERS,"You have no disposable income when you are make 10, 12 bucks an hour."
461,11-14-15,primary_dem,SANDERS,"When we put money into the hands of working people, they're going to go out and buy goods, they're going to buy services and they're going to create jobs in doing that."
462,11-14-15,primary_dem,SANDERS,"Kathie, that is the kind of economy I believe, put money in the hands of working people, raise the minimum wage to 15 buck an hour."
463,11-14-15,primary_dem,SANDERS,"O'MALLEY: Kathie, this was not merely theory in Maryland."
464,11-14-15,primary_dem,SANDERS,We actually did it.
465,11-14-15,primary_dem,SANDERS,Not only were we the first state in the nation to pass a living wage.
466,11-14-15,primary_dem,SANDERS,We were the first to pass a minimum wage.
467,11-14-15,primary_dem,SANDERS,"And the U.S. chamber of commerce, which hardly ever says nice things about Democratic governors anywhere, named our state number one for innovation and entrepreneurship."
468,11-14-15,primary_dem,SANDERS,We defended the highest median income in the country.
469,11-14-15,primary_dem,SANDERS,"And so, look, the way that -- a stronger middle class is actually the source of economic growth."
470,11-14-15,primary_dem,SANDERS,"And if our middle class makes more money, they spend more money, and our whole economy grows."
471,11-14-15,primary_dem,SANDERS,"We did it, and it worked, and nobody headed for the hills or left the state because of it."
472,11-14-15,primary_dem,OBRADOVICH, You're calling for a $15 an hour wage now but why did you stop at $10.10 in your state?
473,11-14-15,primary_dem,OBRADOVICH,O'MALLEY: $10.10 was all I could get the state to do by the time I left in my last year.
474,11-14-15,primary_dem,OBRADOVICH,"But two of our counties actually went to $12.80 and their county executives, if they were here tonight, would also tell you that it works."
475,11-14-15,primary_dem,OBRADOVICH,"The fact of the matter is, the more our people earn, the more money they spend, and the more our whole economy grows."
476,11-14-15,primary_dem,OBRADOVICH,That's American capitalism.
477,11-14-15,primary_dem,SANDERS, Let me just...
478,11-14-15,primary_dem,CLINTON," Kathie, I think -- Kathie the..."
479,11-14-15,primary_dem,SANDERS, Let me just add to that.
480,11-14-15,primary_dem,SANDERS,Just because this is not an esoteric argument.
481,11-14-15,primary_dem,SANDERS,You're seeing cities like Seattle.
482,11-14-15,primary_dem,SANDERS,"You're seeing cities like San Francisco, cities like Los Angeles doing it, and they are doing it well and workers are able to have more disposable income."
483,11-14-15,primary_dem,CLINTON, But I do take what Alan Krueger said seriously.
484,11-14-15,primary_dem,CLINTON,"He is the foremost expert in our country on the minimum wage, and what its effects are."
485,11-14-15,primary_dem,CLINTON,And the overall message is that it doesn't result in job loss.
486,11-14-15,primary_dem,CLINTON,"However, what Alan Krueger said in the piece you're referring to is that if we went to $15, there are no international comparisons."
487,11-14-15,primary_dem,CLINTON,That is why I support a $12 national federal minimum wage.
488,11-14-15,primary_dem,CLINTON,That is what the Democrats in the Senate have put forward as a proposal.
489,11-14-15,primary_dem,CLINTON,But I do believe that is a minimum.
490,11-14-15,primary_dem,CLINTON,"And places like Seattle, like Los Angeles, like New York City, they can go higher."
491,11-14-15,primary_dem,CLINTON,It's what happened in Governor O'Malley's state.
492,11-14-15,primary_dem,CLINTON,"There was a minimum wage at the state level, and some places went higher."
493,11-14-15,primary_dem,CLINTON,"I think that is...

O'MALLEY: Didn't just happen."
494,11-14-15,primary_dem,CLINTON, I think that is the smartest way to be able to move forward because if you go to $12 it would be the highest historical average we've ever had.
495,11-14-15,primary_dem,CLINTON,O'MALLEY: Come on now.
496,11-14-15,primary_dem,CLINTON,"Yeah, but look."
497,11-14-15,primary_dem,CLINTON,It should always be going up.
498,11-14-15,primary_dem,CLINTON,"Again, with all do respect to Secretary Clinton..."
499,11-14-15,primary_dem,CLINTON, But you would index it -- you would index it to the median wage.
500,11-14-15,primary_dem,CLINTON,"Of course, you would."
501,11-14-15,primary_dem,CLINTON,Do the $12 and you would index it.
502,11-14-15,primary_dem,CLINTON,"But I...

O'MALLEY: I think we need to stop taking our advice from economists on Wall Street..."
503,11-14-15,primary_dem,CLINTON, He's not wall street.
504,11-14-15,primary_dem,CLINTON,O'MALLEY: ... And start taking advice...
505,11-14-15,primary_dem,CLINTON, That's not fair.
506,11-14-15,primary_dem,CLINTON,He's a progressive economist.
507,11-14-15,primary_dem,CLINTON,[crosstalk]
508,11-14-15,primary_dem,DICKERSON, You have -- you have given me the perfect segue.
509,11-14-15,primary_dem,DICKERSON,"We are going to talk about Wall Street, but now we've got to go do a commercial."
510,11-14-15,primary_dem,DICKERSON,We're coming to the end of the first hour.
511,11-14-15,primary_dem,DICKERSON,But there's another hour behind it and we're going to talk about Wall Street so hang with us.
512,11-14-15,primary_dem,DICKERSON,[commercial break]
513,11-14-15,primary_dem,DICKERSON," Good evening again, as we begin the second half of the debate."
514,11-14-15,primary_dem,DICKERSON,"Joining me in the questioning are the candidates -- of the candidates are CBS news congressional correspondent Nancy Cordes, Kevin Cooney of CBS Des Moines affiliate KCCI, and Kathie Obradovich of the Des Moines register."
515,11-14-15,primary_dem,DICKERSON,"As those who watched the first hour know, our topic is Wall Street."
516,11-14-15,primary_dem,DICKERSON,"For those just joining us, welcome."
517,11-14-15,primary_dem,DICKERSON,"Senator -- excuse me, Secretary Clinton, I went to the past there for a moment."
518,11-14-15,primary_dem,DICKERSON,"Senator Sanders recently said, quote, ""People should be suspect of candidates who receive large sums of money from Wall Street and then go out and say 'Trust me."
519,11-14-15,primary_dem,DICKERSON,I'm going to really regulate wall street'.
520,11-14-15,primary_dem,DICKERSON,So you've received millions of dollars in contributions and speaking fees from from Wall Street companies.
521,11-14-15,primary_dem,DICKERSON,How do you convince voters that you are going to level the playing field when you're indebted to some of its biggest players?
522,11-14-15,primary_dem,CLINTON," Well, I think it's pretty clear that they know that I will."
523,11-14-15,primary_dem,CLINTON,You have two billionaire hedge fund managers who started a super PAC and they're advertising against me in Iowa as we speak.
524,11-14-15,primary_dem,CLINTON,So they clearly think I'm going to do what I say I will do and you can look at what I did in the Senate.
525,11-14-15,primary_dem,CLINTON,I did introduce legislation to reign in compensation.
526,11-14-15,primary_dem,CLINTON,I looked at ways that the shareholders would have more control over what was going on in that arena.
527,11-14-15,primary_dem,CLINTON,"And specifically said to Wall Street, that what they were doing in the mortgage market was bringing our country down."
528,11-14-15,primary_dem,CLINTON,I've laid out a very aggressive plan to reign in Wall Street -- not just the big banks.
529,11-14-15,primary_dem,CLINTON,That's a part of the problem and I am going right at them.
530,11-14-15,primary_dem,CLINTON,"I have a comprehensive, tough plan."
531,11-14-15,primary_dem,CLINTON,But I went further than that.
532,11-14-15,primary_dem,CLINTON,We have to go after what is called the shadow banking industry.
533,11-14-15,primary_dem,CLINTON,Those hedge funds.
534,11-14-15,primary_dem,CLINTON,"Look at what happened in '08, AIG, a big insurance company, Lehman Brothers, an investment bank helped to bring our economy down."
535,11-14-15,primary_dem,CLINTON,"So, I want to look at the whole problem and that's why my proposal is much more comprehensive than anything else that's been put forth."
536,11-14-15,primary_dem,DICKERSON, Senator Sanders you said that the donations to Secretary Clinton are compromising.
537,11-14-15,primary_dem,DICKERSON,So what did you think of her answer?
538,11-14-15,primary_dem,SANDERS, Not good enough.
539,11-14-15,primary_dem,SANDERS,"[applause]

Here's the story."
540,11-14-15,primary_dem,SANDERS,"I mean, you know, let's not be naive about it."
541,11-14-15,primary_dem,SANDERS,"Why do -- why, over her political career has Wall Street been a major -- the major campaign contributor to Hillary Clinton?"
542,11-14-15,primary_dem,SANDERS,"You know, maybe they're dumb and they don't know what they're going to get, but I don't think so."
543,11-14-15,primary_dem,SANDERS,Here is the major issue when we talk about Wall Street.
544,11-14-15,primary_dem,SANDERS,It ain't complicated.
545,11-14-15,primary_dem,SANDERS,"You have six financial institutions today that have assets of 56 percent, equivalent to 56 percent of the GDP In America."
546,11-14-15,primary_dem,SANDERS,They issue two-thirds of the credit cards and one-third of the mortgages.
547,11-14-15,primary_dem,SANDERS,"If Teddy Roosevelt, a good Republican, were alive today, you know what he'd say?"
548,11-14-15,primary_dem,SANDERS,"""Break them up."""
549,11-14-15,primary_dem,SANDERS,Reestablish Glass-Steagall.
550,11-14-15,primary_dem,SANDERS,And Teddy Roosevelt is right.
551,11-14-15,primary_dem,SANDERS,That is the issue.
552,11-14-15,primary_dem,SANDERS,Now I am the only candidate up here that doesn't have a super PAC.
553,11-14-15,primary_dem,SANDERS,I am not asking Wall Street or the billionaires for money.
554,11-14-15,primary_dem,SANDERS,I will break up these banks.
555,11-14-15,primary_dem,SANDERS,Support community banks and credit unions.
556,11-14-15,primary_dem,SANDERS,That's the future of banking in America.
557,11-14-15,primary_dem,DICKERSON," Great follow up because you -- and Secretary Clinton, you will get a chance to respond."
558,11-14-15,primary_dem,DICKERSON,You said they know what they're going to get.
559,11-14-15,primary_dem,DICKERSON,What are they going to get?
560,11-14-15,primary_dem,SANDERS," I have never heard a candidate never, who has received huge amounts of money from oil, from coal, from Wall Street, from the military industrial complex, not one candidate say, oh, these campaign contributions will not influence me."
561,11-14-15,primary_dem,SANDERS,I'm going to be independent.
562,11-14-15,primary_dem,SANDERS,"Well, why do they make millions of dollars of campaign contributions?"
563,11-14-15,primary_dem,SANDERS,they expect to get something.
564,11-14-15,primary_dem,SANDERS,Everybody knows that.
565,11-14-15,primary_dem,SANDERS,"Once again, I am running a campaign differently than any other candidate."
566,11-14-15,primary_dem,SANDERS,"We are relying on small campaign donors, 750,000 of them, 30 bucks a piece."
567,11-14-15,primary_dem,SANDERS,That's who I'm indebted to.
568,11-14-15,primary_dem,CLINTON," Well John, wait a minute."
569,11-14-15,primary_dem,CLINTON,"Wait a minute, he has basically used his answer to impune my integrity."
570,11-14-15,primary_dem,CLINTON,Let's be frank here.
571,11-14-15,primary_dem,SANDERS," No, I have not."
572,11-14-15,primary_dem,CLINTON," Oh, wait a minute, senator."
573,11-14-15,primary_dem,CLINTON,"You know, not only do I have hundreds of thousands of donors, most of them small."
574,11-14-15,primary_dem,CLINTON,"And I'm very proud that for the first time a majority of my donors are women, 60 percent."
575,11-14-15,primary_dem,CLINTON,"[applause]

So, I represented New York, and I represented New York on 9/11 when we were attacked."
576,11-14-15,primary_dem,CLINTON,Where were we attacked?
577,11-14-15,primary_dem,CLINTON,We were attacked in downtown Manhattan where Wall Street is.
578,11-14-15,primary_dem,CLINTON,I did spend a whole lot of time and effort helping them rebuild.
579,11-14-15,primary_dem,CLINTON,That was good for New York.
580,11-14-15,primary_dem,CLINTON,It was good for the economy and it was a way to rebuke the terrorists who had attacked our country.
581,11-14-15,primary_dem,CLINTON,"So, you know, it's fine for you to say what you're going to say, but I looked very carefully at your proposal."
582,11-14-15,primary_dem,CLINTON,"Reinstating Glass- Steagall is a part of what very well could help, but it is nowhere near enough."
583,11-14-15,primary_dem,CLINTON,"My proposal is tougher, more effective, and more comprehensive because I go after all of Wall Street not just the big banks."
584,11-14-15,primary_dem,CLINTON,"O'MALLEY: John, please, it's-- personal privilege, John."
585,11-14-15,primary_dem,DICKERSON, Hold on.
586,11-14-15,primary_dem,DICKERSON,He was attacked.
587,11-14-15,primary_dem,DICKERSON,"[applause]

O'MALLEY: John, John,"
588,11-14-15,primary_dem,DICKERSON," Hold on, he was attacked."
589,11-14-15,primary_dem,DICKERSON,"Glass-Steagall...

[crosstalk]"
590,11-14-15,primary_dem,SANDERS," So was I, John."
591,11-14-15,primary_dem,SANDERS,Let me get a chance to respond.
592,11-14-15,primary_dem,SANDERS,This issue touches on two broad issues.
593,11-14-15,primary_dem,SANDERS,It's not just Wall Street.
594,11-14-15,primary_dem,SANDERS,It's campaign -- a corrupt campaign finance system.
595,11-14-15,primary_dem,SANDERS,"And it is easy to talk the talk about ending Citizens United, but what I think we need to do is show by example that we are prepared to not rely on large corporations and Wall Street for campaign contributions, and that's what I'm doing."
596,11-14-15,primary_dem,SANDERS,"In terms of Wall Street, I respectfully disagree with you, madam secretary, in the sense that the issue here is when you have such incredible power and such incredible wealth."
597,11-14-15,primary_dem,SANDERS,"When you have Wall Street spending $5 billion over a 10-year period to get -- to get deregulated, the only answer they know is break them up, reestablish Glass-Stegall."
598,11-14-15,primary_dem,DICKERSON, All right.
599,11-14-15,primary_dem,DICKERSON,"Senator, we have to get Governor O' Malley in."
600,11-14-15,primary_dem,DICKERSON,"Governor, along with your answer, how many Wall Street veterans would you have in your administration?"
601,11-14-15,primary_dem,DICKERSON,"O'MALLEY: Well, I'll tell you what, I've said this before."
602,11-14-15,primary_dem,DICKERSON,I don't -- I believe that we actually need some new economic thinking in the White House.
603,11-14-15,primary_dem,DICKERSON,"And I would not have Robert Rubin or Larry Summers, with all due respect, Secretary Clinton, to you and to them, back on my council of economic advisers."
604,11-14-15,primary_dem,DICKERSON, Anyone from Wall Street?
605,11-14-15,primary_dem,DICKERSON,O'MALLEY: They are the architects.
606,11-14-15,primary_dem,DICKERSON,"Sure, we'll have an inclusive group but I won't be taking my orders from Wall Street."
607,11-14-15,primary_dem,DICKERSON,"And look, let me say this."
608,11-14-15,primary_dem,DICKERSON,I put out a proposal.
609,11-14-15,primary_dem,DICKERSON,"I was on the front lines when people lost their homes, when people lost their jobs."
610,11-14-15,primary_dem,DICKERSON,I was on the front lines as a governor fighting against -- fighting that battle.
611,11-14-15,primary_dem,DICKERSON,Our economy was wrecked by the big banks of Wall Street.
612,11-14-15,primary_dem,DICKERSON,"And Secretary Clinton, when you put out your proposal on Wall Street, it was greeted by many as, quote, unquote, ""Weak tea""."
613,11-14-15,primary_dem,DICKERSON,It is weak tea.
614,11-14-15,primary_dem,DICKERSON,It is not what the people expect of our country.
615,11-14-15,primary_dem,DICKERSON,We expect that our president will protect the main street economy from excesses on Wall Street.
616,11-14-15,primary_dem,DICKERSON,And that's why Bernie's right.
617,11-14-15,primary_dem,DICKERSON,We need to reinstate a modern version of Glass-Steagall and we should have done it already.
618,11-14-15,primary_dem,DICKERSON,[applause]
619,11-14-15,primary_dem,CLINTON," Well, you know, governor, I know that when you had a chance to appoint a commissioner for financial regulation, you chose an investment banker in 2010."
620,11-14-15,primary_dem,CLINTON,"So for me, it is looking at what works and what we need to do to try to move past what happened in '08."
621,11-14-15,primary_dem,CLINTON,"And I will go back and say again, AIG was not a big bank."
622,11-14-15,primary_dem,CLINTON,It had to be bailed out and it nearly destroyed us.
623,11-14-15,primary_dem,CLINTON,Lehman Brothers was not a big bank.
624,11-14-15,primary_dem,CLINTON,It was an investment bank.
625,11-14-15,primary_dem,CLINTON,And its bankruptcy and its failure nearly destroyed us.
626,11-14-15,primary_dem,CLINTON,"So I've said, if the big banks don't play by the rules, I will break them up."
627,11-14-15,primary_dem,SANDERS, The big banks--
628,11-14-15,primary_dem,CLINTON, And I will also go after executives who are responsible for the decisions that have such bad consequences for our country.
629,11-14-15,primary_dem,CLINTON,[applause]
630,11-14-15,primary_dem,SANDERS, Look--
631,11-14-15,primary_dem,DICKERSON, Hold on.
632,11-14-15,primary_dem,SANDERS," I don't know and with all due respect to the secretary, Wall Street played by the rules?"
633,11-14-15,primary_dem,SANDERS,Who are we kidding?
634,11-14-15,primary_dem,SANDERS,The business model of Wall Street is fraud.
635,11-14-15,primary_dem,SANDERS,That's what it is.
636,11-14-15,primary_dem,SANDERS,"[applause]

And we have -- and let me make this promise."
637,11-14-15,primary_dem,SANDERS,"One of the problems we have had -- I think all Americans understand this, is whether it's Republican administrations or Democratic administrations, we have seen Wall Street and Goldman Sachs dominate administrations."
638,11-14-15,primary_dem,SANDERS,Here's my promise-- Wall Street representatives will not be in my cabinet.
639,11-14-15,primary_dem,SANDERS,[applause]
640,11-14-15,primary_dem,DICKERSON," All right, I want to switch to the -- switch to the issue of guns here."
641,11-14-15,primary_dem,DICKERSON,"Secretary Clinton, you said that Senator Sanders is not tough enough on guns, but basically he now supports roughly the same things you do."
642,11-14-15,primary_dem,DICKERSON,So can tell us what the exact difference is going forward between the two of you on the issue of gun control?
643,11-14-15,primary_dem,CLINTON," Well, I think that there are different records."
644,11-14-15,primary_dem,CLINTON,"I -- you know, know that Senator Sanders had a different vote than I did when it came to giving immunity to gun makers and sellers."
645,11-14-15,primary_dem,CLINTON,That was a terrible mistake.
