,Date,Debate Type,Speaker,Sents
218,2-4-16,primary_dem,CLINTON,"Democrats, Republicans, independents, we're going to make progress together when I'm president."
219,2-4-16,primary_dem,CLINTON,[applause]
220,2-4-16,primary_dem,MADDOW," So, Senator, to that point, Secretary Clinton is raising the issue of endorsements by your home state Democrats."
221,2-4-16,primary_dem,MADDOW,She's implying that that says something about the people who know you best.
222,2-4-16,primary_dem,SANDERS," Well, I don't see it quite like that."
223,2-4-16,primary_dem,MADDOW, How do you see it?
224,2-4-16,primary_dem,SANDERS," I am—will absolutely admit that Secretary Clinton has the support of far more governors, mayors, members of the House."
225,2-4-16,primary_dem,SANDERS,She has the entire establishment or almost the entire establishment behind her.
226,2-4-16,primary_dem,SANDERS,That's a fact.
227,2-4-16,primary_dem,SANDERS,I don't deny it.
228,2-4-16,primary_dem,SANDERS,But I am pretty proud that we have over a million people who have contributed to our campaign averaging 27 bucks apiece.
229,2-4-16,primary_dem,SANDERS,"That we have had meetings where 25,000-30,000 people have come out."
230,2-4-16,primary_dem,SANDERS,"That our campaign is a campaign of the people, by the people, and for the people."
231,2-4-16,primary_dem,SANDERS,"So, Rachel, yes, Secretary Clinton does represent the establishment."
232,2-4-16,primary_dem,SANDERS,"I represent, I hope, ordinary Americans, and by the way, who are not all that enamored with the establishment, but I am very proud to have people like Keith Ellison and Raul Grijalva in the House, the co-chairmen of the House Progressive Caucus."
233,2-4-16,primary_dem,MADDOW, Secretary.
234,2-4-16,primary_dem,CLINTON," Well, look, I've got to just jump in here because, honestly, Senator Sanders is the only person who I think would characterize me, a woman running to be the first woman president, as exemplifying the establishment."
235,2-4-16,primary_dem,CLINTON,And I've got to tell you that it is...[applause]...it is really quite amusing to me.
236,2-4-16,primary_dem,CLINTON,People support me because they know me.
237,2-4-16,primary_dem,CLINTON,They know my life's work.
238,2-4-16,primary_dem,CLINTON,They have worked with me and many have also worked with Senator Sanders.
239,2-4-16,primary_dem,CLINTON,And at the end of the day they endorse me because they know I can get things done.
240,2-4-16,primary_dem,CLINTON,"[applause]

I am not going to make promises I can't keep."
241,2-4-16,primary_dem,CLINTON,I am not going to talk about big ideas like single-payer and then not level with people about how much it will cost.
242,2-4-16,primary_dem,CLINTON,A respected health economist said that these plans would cost a trillion dollars more a year.
243,2-4-16,primary_dem,CLINTON,"I'm not going to tell people that I will raise your incomes and not your taxes, and not mean it, because I don't want to see the kind of struggle that the middle class is going through exemplified by these promises that would raise taxes and make it much more difficult for many, many Americans to get ahead and stay ahead."
244,2-4-16,primary_dem,CLINTON,That is not my agenda.
245,2-4-16,primary_dem,CLINTON,[applause]
246,2-4-16,primary_dem,MADDOW," Senator Sanders, you'll have 30 seconds to respond to that."
247,2-4-16,primary_dem,SANDERS," What being part of the establishment is, is, in the last quarter, having a super PAC that raised $15 million from Wall Street, that throughout one's life raised a whole lot of money from the drug companies and other special interests."
248,2-4-16,primary_dem,SANDERS,"To my mind, if we do not get a handle on money in politics and the degree to which big money controls the political process in this country, nobody is going to bring about the changes that is needed in this country for the middle class and working families."
249,2-4-16,primary_dem,CLINTON," Yeah, but I—I think it's fair to really ask what's behind that comment."
250,2-4-16,primary_dem,CLINTON,"You know, Senator Sanders has said he wants to run a positive campaign."
251,2-4-16,primary_dem,CLINTON,"I've tried to keep my disagreements over issues, as it should be."
252,2-4-16,primary_dem,CLINTON,"But time and time again, by innuendo, by insinuation, there is this attack that he is putting forth, which really comes down to—you know, anybody who ever took donations or speaking fees from any interest group has to be bought."
253,2-4-16,primary_dem,CLINTON,"And I just absolutely reject that, Senator."
254,2-4-16,primary_dem,CLINTON,And I really don't think these kinds of attacks by insinuation are worthy of you.
255,2-4-16,primary_dem,CLINTON,And enough is enough.
256,2-4-16,primary_dem,CLINTON,"If you've got something to say, say it directly."
257,2-4-16,primary_dem,CLINTON,But you will not find that I ever changed a view or a vote because of any donation that I ever received.
258,2-4-16,primary_dem,SANDERS, What... [applause]
259,2-4-16,primary_dem,CLINTON," And I have stood up and I have represented my constituents to the best of my abilities, and I'm very proud of that."
260,2-4-16,primary_dem,SANDERS, ... you know...
261,2-4-16,primary_dem,CLINTON, So I think it's time to end the very artful smear that you and your campaign have been carrying out...
262,2-4-16,primary_dem,SANDERS, [inaudible].
263,2-4-16,primary_dem,SANDERS,[applause]
264,2-4-16,primary_dem,CLINTON," ... in recent weeks, and let's talk...[booing]...let's talk about about the issues."
265,2-4-16,primary_dem,CLINTON,Let's talk about the issues that divide us.
266,2-4-16,primary_dem,SANDERS," Let's talk about—OK, let's talk..."
267,2-4-16,primary_dem,CLINTON, And let's—let's...
268,2-4-16,primary_dem,SANDERS, ... let us talk about issues.
269,2-4-16,primary_dem,CLINTON, ... we both agree with campaign finance reform.
270,2-4-16,primary_dem,SANDERS, Let's talk about issues.
271,2-4-16,primary_dem,CLINTON, I—I worked hard for McCain-Feingold.
272,2-4-16,primary_dem,SANDERS, Let's...
273,2-4-16,primary_dem,CLINTON, I want to reverse Citizens United.
274,2-4-16,primary_dem,SANDERS, ... let's—let's—let's talk about issues.
275,2-4-16,primary_dem,CLINTON, And so—let's talk about issues.
276,2-4-16,primary_dem,SANDERS," Let's talk—let's talk about issues, all right?"
277,2-4-16,primary_dem,SANDERS,"Let's talk about why, in the 1990s, Wall Street got deregulated."
278,2-4-16,primary_dem,SANDERS,Did it have anything to do with the fact that Wall Street provided—spent billions of dollars on lobbying and campaign contributions?
279,2-4-16,primary_dem,SANDERS,"Well, some people might think, yeah, that had some influence."
280,2-4-16,primary_dem,SANDERS,"[laughter]

Let's ask why it is that we pay, by far, the highest prices in the world for prescription drugs, and your medicine can be doubled tomorrow, and there's nothing that the government can do to stop it."
281,2-4-16,primary_dem,SANDERS,You think it has anything to do with the huge amounts of campaign contributions and lobbying from the fossil fuel industry?
282,2-4-16,primary_dem,SANDERS,Let's talk about climate change.
283,2-4-16,primary_dem,SANDERS,"Do you think there's a reason why not one Republican has the guts to recognize that climate change is real, and that we need to transform our energy system?"
284,2-4-16,primary_dem,SANDERS,Do you think it has anything to do with the Koch brothers and ExxonMobil pouring huge amounts of money into the political system?
285,2-4-16,primary_dem,SANDERS,That is what goes on in America.
286,2-4-16,primary_dem,SANDERS,I am not—I like...[applause]...there is a reason.
287,2-4-16,primary_dem,SANDERS,"You know, there is a reason why these people are putting huge amounts of money into our political system."
288,2-4-16,primary_dem,SANDERS,"And in my view, it is undermining American democracy and it is allowing Congress to represent wealthy campaign contributors and not the working families of this country."
289,2-4-16,primary_dem,CLINTON," Well, you know, Senator, I don't think—I don't...

[crosstalk] [applause]"
290,2-4-16,primary_dem,TODD," ... Secretary, we're gonna..."
291,2-4-16,primary_dem,CLINTON, ...
292,2-4-16,primary_dem,CLINTON,"I don't think you could find any person in political life today who has been subjected to more attacks and had more money spent against her by special interests, among whom you have named a few, than I."
293,2-4-16,primary_dem,CLINTON,And I'm proud of that.
294,2-4-16,primary_dem,CLINTON,"You know, when I took on the drug companies and the insurance companies for universal health care coverage, they went after me with a vengeance."
295,2-4-16,primary_dem,CLINTON,"Today, you've got hedge fund billionaires aligned with Karl Rove, running ads against me to try to get Democrats to vote for you."
296,2-4-16,primary_dem,CLINTON,I know this game.
297,2-4-16,primary_dem,CLINTON,I'm going to stop this game.
298,2-4-16,primary_dem,CLINTON,"But while we're talking about votes, you're the one who voted to deregulate swaps and derivatives in 2000, which contributed to the over-leveraging of Lehman Brothers, which was one of the culprits that brought down the economy."
299,2-4-16,primary_dem,CLINTON,So I don't know—I'm not impugning your motive because you voted to deregulate swaps and derivatives.
300,2-4-16,primary_dem,CLINTON,People make mistakes and I'm certainly not saying you did it for any kind of financial advantage.
301,2-4-16,primary_dem,CLINTON,What we've got to do as Democrats—what we've got to do as Democrats is to be united to actually solve these problems.
302,2-4-16,primary_dem,CLINTON,And what I believe is that I have a better track record and a better opportunity to actually get that job done.
303,2-4-16,primary_dem,CLINTON,That's what this election should be about.
304,2-4-16,primary_dem,CLINTON,[applause]
305,2-4-16,primary_dem,TODD, Thirty seconds.
306,2-4-16,primary_dem,TODD,[crosstalk] [applause]
307,2-4-16,primary_dem,SANDERS," I think as Secretary Clinton knows, there is nobody who fought harder."
308,2-4-16,primary_dem,SANDERS,I was on the House Financial Committee at that time.
309,2-4-16,primary_dem,SANDERS,"I heard the arguments coming from Democrats and Republicans—Robert Rubin, Alan Greenspan—about great an idea it would be if we did away with Glass-Steagall and if we allowed investor banks and commercial banks and big insurance companies to merge."
310,2-4-16,primary_dem,SANDERS,Go to YouTube today.
311,2-4-16,primary_dem,SANDERS,Look up Greenspan-Sanders.
312,2-4-16,primary_dem,SANDERS,Listen to what I told them then.
313,2-4-16,primary_dem,SANDERS,I helped lead the effort against deregulation.
314,2-4-16,primary_dem,SANDERS,"Unfortunately, we lost that."
315,2-4-16,primary_dem,SANDERS,The result is—was the worst financial disaster since the Great Depression.
316,2-4-16,primary_dem,TODD, Thank you both.
317,2-4-16,primary_dem,MADDOW," Senator Sanders, Secretary Clinton, obviously we've touched a nerve."
318,2-4-16,primary_dem,MADDOW,"We're going to be back with more on this subject, and much more, right after this."
319,2-4-16,primary_dem,MADDOW,Stay with us.
320,2-4-16,primary_dem,MADDOW,"[applause]

[commercial break]"
321,2-4-16,primary_dem,TODD," All right, welcome back."
322,2-4-16,primary_dem,TODD,Let's get right to it.
323,2-4-16,primary_dem,TODD,"Senator Sanders, you were talking about all of your campaign contributions and campaign finance reform."
324,2-4-16,primary_dem,TODD,You rail against big money in politics.
325,2-4-16,primary_dem,TODD,"But do you realize there is one public financing system that we do have in place, and it is—it is in place to run for president."
326,2-4-16,primary_dem,TODD,Why aren't you walking the walk on that?
327,2-4-16,primary_dem,TODD,Why aren't you participating in the presidential public financing system which is designed to essentially keep big money out of presidential politics?
328,2-4-16,primary_dem,SANDERS," Chuck, actually we looked at it, but it turns out to be a disaster."
329,2-4-16,primary_dem,SANDERS,"The way it is structured right now, if you make it all the way to California, you could do pretty well."
330,2-4-16,primary_dem,SANDERS,"But in terms of the early states—Iowa, New Hampshire, the other states—it just doesn't work."
331,2-4-16,primary_dem,SANDERS,Your point is well taken.
332,2-4-16,primary_dem,SANDERS,"I believe in public funding of elections, absolutely."
333,2-4-16,primary_dem,SANDERS,But this system is—I don't know if the secretary would agree—is currently very antiquated and no longer applies to modern day politics.
334,2-4-16,primary_dem,TODD," Well, going on that then, why criticize her on Super PACs, and you got—and all this when it is—you know, that's the system?"
335,2-4-16,primary_dem,TODD,"I mean, you could be participating in a publicly-financing—public financing system..."
336,2-4-16,primary_dem,SANDERS, But if the...
337,2-4-16,primary_dem,TODD, ... and being able to set—being able to set an example.
338,2-4-16,primary_dem,SANDERS,"—but Chuck, it is a public financing system that everybody knows is antiquated."
339,2-4-16,primary_dem,SANDERS,It no longer works.
340,2-4-16,primary_dem,SANDERS,Nobody can become president based on that system.
341,2-4-16,primary_dem,SANDERS,So what's the alternative?
342,2-4-16,primary_dem,SANDERS,There are two alternatives.
343,2-4-16,primary_dem,SANDERS,"And, you know, we looked at it."
344,2-4-16,primary_dem,SANDERS,"Well, should we do a Super PAC, but I concluded, honestly, I don't represent Corporate America or billionaires, I didn't want it."
345,2-4-16,primary_dem,SANDERS,So the other alternative was to ask working families and the middle class to help out in a transformational campaign.
346,2-4-16,primary_dem,SANDERS,And you know what?
347,2-4-16,primary_dem,SANDERS,"We got 3.5 million individual contributions, $27 a piece."
348,2-4-16,primary_dem,SANDERS,I think that's pretty good.
349,2-4-16,primary_dem,SANDERS,[applause]
350,2-4-16,primary_dem,MADDOW," Secretary Clinton, on the issue of Wall Street..."
351,2-4-16,primary_dem,CLINTON, On the issue of Wall Street.
352,2-4-16,primary_dem,MADDOW," ... on the issue of Wall Street, when our reporters go out and talk to people on the ground in the early states, what they tell us over and over again when they find voters who are leaning toward Senator Sanders rather than yourself is that the most frequent area of concern that they hear from those voters is the issue of Wall Street and whether or not you are too close to Wall Street."
353,2-4-16,primary_dem,MADDOW,"Last night, when you were asked about speaking fees and the amount of speaking fees you got from Goldman Sachs speeches, you said that's what they offered."
354,2-4-16,primary_dem,MADDOW,Have you been too dismissive of voters' concerns about this issue in your own campaign and your own career?
355,2-4-16,primary_dem,CLINTON," Well you know, Rachel, I think I may not have done the job I should in explaining my record."
356,2-4-16,primary_dem,CLINTON,"You know, I did—when I left the secretary of State's office, like so many former officials, military leaders, journalists, others, I did go on the speaking circuit."
357,2-4-16,primary_dem,CLINTON,"I spoke to heart doctors, I spoke to the American Camping Association, I spoke to auto dealers, and yes, I spoke to firms on Wall Street."
358,2-4-16,primary_dem,CLINTON,"They wanted me to talk about the world, what my experience had been as secretary of State."
359,2-4-16,primary_dem,CLINTON,But what I want people to know is I went to Wall Street before the crash.
360,2-4-16,primary_dem,CLINTON,I was the one saying you're going to wreck the economy because of these shenanigans with mortgages.
361,2-4-16,primary_dem,CLINTON,I called to end the carried interest loophole that hedge fund managers enjoy.
362,2-4-16,primary_dem,CLINTON,I proposed changes in CEO compensation.
363,2-4-16,primary_dem,CLINTON,I called for a consumer protection financial bureau before it was created.
364,2-4-16,primary_dem,CLINTON,And I think the best evidence that the Wall Street people at least know where I stand and where I have always stood is because they are trying to beat me in this primary.
365,2-4-16,primary_dem,CLINTON,They have collected and spent as much as $6 million on these ads.
366,2-4-16,primary_dem,CLINTON,"Hedge fund billionaires, Karl Rove, another billionaire, jumped in."
367,2-4-16,primary_dem,CLINTON,And why are they doing that?
368,2-4-16,primary_dem,CLINTON,These are guys who try to make smart investments.
369,2-4-16,primary_dem,CLINTON,"They know my record, they know me, they know that I say what I believe and I will do it."
370,2-4-16,primary_dem,CLINTON,And I also have a pretty good understanding about how to stop them.
371,2-4-16,primary_dem,CLINTON,"So I do want people to know that, and I think it's important for everybody to understand I have a record, I have stood firm and I will be the person who prevents them from ever wrecking the economy again."
372,2-4-16,primary_dem,CLINTON,[applause]
373,2-4-16,primary_dem,MADDOW," Senator Sanders, you have been a critic of Secretary Clinton taking those speaking fees and having donations from Wall Street."
374,2-4-16,primary_dem,MADDOW,What about her defense of her record?
375,2-4-16,primary_dem,SANDERS, Let me just say this.
376,2-4-16,primary_dem,SANDERS,Wall Street is perhaps the most powerful economic and political force in this country.
377,2-4-16,primary_dem,SANDERS,"You have companies like Goldman Sachs, who just recently paid a settlement fine with the federal government for $5 billion for defrauding investors."
378,2-4-16,primary_dem,SANDERS,Goldman Sachs was one of those companies whose illegal activity helped destroy our economy and ruin the lives of millions of Americans.
379,2-4-16,primary_dem,SANDERS,But this is what a rigged economy and a corrupt campaign finance system and a broken criminal justice is about.
380,2-4-16,primary_dem,SANDERS,"These guys are so powerful that not one of the executives on Wall Street has been charged with anything after paying, in this case of Goldman Sachs, a $5 billion fine."
381,2-4-16,primary_dem,SANDERS,"Kid gets caught with marijuana, that kid has a police record."
382,2-4-16,primary_dem,SANDERS,"A Wall Street executive destroys the economy, $5 billion settlement with the government, no criminal record."
383,2-4-16,primary_dem,SANDERS,That is what power is about.
384,2-4-16,primary_dem,SANDERS,That is what corruption is about.
385,2-4-16,primary_dem,SANDERS,And that is what has to change in the United States of America.
386,2-4-16,primary_dem,SANDERS,"[applause]

[crosstalk]"
387,2-4-16,primary_dem,CLINTON," If I could, let me just say that of course it has to change."
388,2-4-16,primary_dem,CLINTON,It has to change.
389,2-4-16,primary_dem,CLINTON,And that's why I have put forward a plan to do just that.
390,2-4-16,primary_dem,CLINTON,"And it's been judged to be the toughest, most effective and comprehensive one."
391,2-4-16,primary_dem,CLINTON,I have great respect for Senator Sanders's commitment to try to restore Glass-Steagall.
392,2-4-16,primary_dem,CLINTON,But I do not believe that that is enough.
393,2-4-16,primary_dem,CLINTON,"And in fact, I don't believe it really addresses a lot of the biggest issues we have."
394,2-4-16,primary_dem,CLINTON,"You know, we now have power under the Dodd-Frank legislation to break up banks."
395,2-4-16,primary_dem,CLINTON,And I've said I will use that power if they pose a systemic risk.
396,2-4-16,primary_dem,CLINTON,"But I want to go further, because it was investment banks, it was insurance companies, it was mortgage companies, all of which contributed."
397,2-4-16,primary_dem,CLINTON,So let's not just be narrowly focused on one part of the problem.
398,2-4-16,primary_dem,CLINTON,We have a lot of issues with corporate power that have to be addressed.
399,2-4-16,primary_dem,CLINTON,My plan takes us further and it would do the job.
400,2-4-16,primary_dem,CLINTON,[crosstalk] [applause]
401,2-4-16,primary_dem,SANDERS," I would say that—that folks who have looked at this issue for a long time, whether it's Elizabeth Warren or many other economists, will tell you that right now, yes, we do need a 21st century Glass-Steagall legislation."
402,2-4-16,primary_dem,SANDERS,"And I would tell you also that when you have three out of the four largest banks in America today, bigger than they were—significantly bigger than when we bailed them out because they were too big to fail, I think if Teddy Roosevelt were alive today, a good Republican by the way, what he would say is: Break them up; they are too powerful economically; they are too powerful politically."
403,2-4-16,primary_dem,SANDERS,And that is what I believe and many economists believe.
404,2-4-16,primary_dem,SANDERS,Time to break them up.
405,2-4-16,primary_dem,SANDERS,[applause]
406,2-4-16,primary_dem,CLINTON," Look we have a law—look, you know, I—I appreciate the senator's advocacy."
407,2-4-16,primary_dem,CLINTON,We have a law.
408,2-4-16,primary_dem,CLINTON,It was passed.
409,2-4-16,primary_dem,CLINTON,It was signed by President Obama.
410,2-4-16,primary_dem,CLINTON,It lays out a process that you go through to determine whether a systemic risk is posed.
411,2-4-16,primary_dem,CLINTON,"And by the way, President Obama signed that, pushed it through, even though he took donations from Wall Street, because he's a responsible president."
412,2-4-16,primary_dem,CLINTON,So we have a law in place.
413,2-4-16,primary_dem,CLINTON,"If the circumstances warrant it, I will certainly use it."
414,2-4-16,primary_dem,CLINTON,"And from what you say, I know you will as well."
415,2-4-16,primary_dem,CLINTON,But that is not enough.
416,2-4-16,primary_dem,CLINTON,"And I keep going back to this because part of the reason the Wall Street guys are trying so hard to stop me—the hedge fund guys, the shadow banking guys—is because I've got their number on all of that."
417,2-4-16,primary_dem,CLINTON,And my plan goes so much further to try to prevent the problems of the future.
418,2-4-16,primary_dem,CLINTON,"You know, we can't just fight the last war."
419,2-4-16,primary_dem,CLINTON,"We've got to be prepared to stop these guys if they ever try to use their economic power once again, to hurt the economy, and to hurt so many Americans."
420,2-4-16,primary_dem,CLINTON,"And my plan, Paul Krugman, Barney Frank, a lot of experts who understand what the new challenges might be, have said I am exactly on point, and the Wall Street guys actually know that."
421,2-4-16,primary_dem,CLINTON,"[applause]

[crosstalk]"
422,2-4-16,primary_dem,TODD, ... she has had more people praise her plan than yours.
423,2-4-16,primary_dem,SANDERS," Well, we've had a number of economists supporting our legislation."
424,2-4-16,primary_dem,SANDERS,And here's where we are.
425,2-4-16,primary_dem,SANDERS,The American people can judge.
426,2-4-16,primary_dem,SANDERS,Six largest financial institutions in America today have assets of roughly $10 trillion; equivalent to 58 percent of the GDP of the United States of America.
427,2-4-16,primary_dem,SANDERS,That is a lot of money.
428,2-4-16,primary_dem,SANDERS,"They issue two thirds of the credit cards, and by the way they're ripping off a whole lot of people with high interest rates on the credit cards, and they write about one third of the mortgages."
429,2-4-16,primary_dem,SANDERS,That is a lot of power for six financial institutions.
430,2-4-16,primary_dem,SANDERS,That's it.
431,2-4-16,primary_dem,SANDERS,I think it is too much power.
432,2-4-16,primary_dem,SANDERS,"Too much economic power, too much political power, and the economists that I talk to say we should break them up."
433,2-4-16,primary_dem,TODD, Thank you both.
434,2-4-16,primary_dem,TODD,"Let me move on to our next question here, and in fact it comes to us through New England Cable News."
435,2-4-16,primary_dem,TODD,"Secretary Clinton, it's addressed to you, and it's about this issue of the speeches, particularly to Goldman Sachs."
436,2-4-16,primary_dem,TODD,This is what the questioner wrote verbatim.
437,2-4-16,primary_dem,TODD,"""I am concerned with the abuses of Wall Street has taken with the American taxpayers money,"" and then she asks whether you would release the transcripts of your Goldman Sachs speeches, and then added, ""Don't you think the voting public has a right to know what was said?"""
438,2-4-16,primary_dem,TODD,"But, let's make that bigger."
439,2-4-16,primary_dem,TODD,Are you willing to release the transcripts of all your paid speeches?
440,2-4-16,primary_dem,TODD,We do know through reporting that there were transcription services for all of those paid speeches.
441,2-4-16,primary_dem,TODD,"In full disclosure, would you release all of them?"
442,2-4-16,primary_dem,CLINTON, I will look into it.
443,2-4-16,primary_dem,CLINTON,"I don't know the status, but I will certainly look into it."
444,2-4-16,primary_dem,CLINTON,"But, I can only repeat what is the fact that I spoke to a lot of different groups with a lot of different constituents, a lot of different kinds of members about issues that had to do with world affairs."
445,2-4-16,primary_dem,CLINTON,I probably described more times than I can remember how stressful it was advising the President about going after Bin Laden.
446,2-4-16,primary_dem,CLINTON,My view on this is look at my record.
447,2-4-16,primary_dem,CLINTON,"Look at what I am proposing, and—we have a vigorous agreement here."
448,2-4-16,primary_dem,CLINTON,We both want to reign in the excesses of Wall Street.
449,2-4-16,primary_dem,CLINTON,"I also want to reign in the excesses of Johnson Controls that we bailed out when they were an autoparts company, and we saved the auto industry, and now they want to avoid paying taxes."
