,Date,Debate Type,Speaker,Sents
450,2-4-16,primary_dem,CLINTON,"I want to go after the pharmaceutical companies like Valeant, and Turns that are increasing prices without any regard to the impact on people's health."
451,2-4-16,primary_dem,CLINTON,"Now, if all we're going to talk about is one part of our economy, and indeed one streak in our economy, we're missing the big oil companies."
452,2-4-16,primary_dem,CLINTON,We're missing other big energy companies.
453,2-4-16,primary_dem,CLINTON,"We're missing the big picture, and I have a record of trying to go at the problems that actually exist, and I will continue to do that."
454,2-4-16,primary_dem,TODD," Senator, you sound like you want to respond."
455,2-4-16,primary_dem,TODD,Go ahead.
456,2-4-16,primary_dem,SANDERS," Yeah, I do."
457,2-4-16,primary_dem,SANDERS,"I agree with much of what the Secretary said, but, madam Secretary, it is not one streak."
458,2-4-16,primary_dem,SANDERS,Wall Street is an entity of unbelievable economic and political power.
459,2-4-16,primary_dem,SANDERS,That's a fact.
460,2-4-16,primary_dem,SANDERS,"And, I want to say something, and it may sound harsh, not to you, but to the American people."
461,2-4-16,primary_dem,SANDERS,"In a sense, in my view, the business model of Wall Street is fraud."
462,2-4-16,primary_dem,SANDERS,It's fraud.
463,2-4-16,primary_dem,SANDERS,"I believe that corruption is rampant, and the fact that major bank after major bank has reached multi billion dollar settlements with the United States government when we have a weak regulator system tells me that not only did we have to bail them out once, if we don't start breaking them up, we're going to have to bail them out again, and I do not want to see that happen..."
464,2-4-16,primary_dem,CLINTON," ... Well, Senator, no one wants to see that happen."
465,2-4-16,primary_dem,CLINTON,"I mean, look, I care deeply about this because just like you I have met so many people who had their life savings wiped out, who lost their homes, who are barely back with their heads above water."
466,2-4-16,primary_dem,CLINTON,"This was a disaster for our country, and we can never let that happen again."
467,2-4-16,primary_dem,CLINTON,We have no disagreement about this.
468,2-4-16,primary_dem,CLINTON,"But, I think it's a broader target list than just Wall Street, and I believe that we have to be very focused on how we try to take back the power and increase the empowerment of the American people."
469,2-4-16,primary_dem,CLINTON,"And, I think I have that kind of experience, maybe because they've beat me up for so many years, and I know exactly how to handle them because I've been in the arena with them time and time again."
470,2-4-16,primary_dem,MADDOW," Senator Sanders, let me turn to, I think, where this direction is heading anyway, which is the broader issue of big business and power in our political system."
471,2-4-16,primary_dem,MADDOW,"You on the campaign trail have railed against big name American corporations like Boeing, and General Electric, and Wal Mart."
472,2-4-16,primary_dem,MADDOW,"But, some big businesses in this country have also been part of advancing progressive goals like that nationwide initiative to expand employment opportunities for veterans."
473,2-4-16,primary_dem,MADDOW,That was all about cooperation between the Obama administration and some very big business.
474,2-4-16,primary_dem,MADDOW,"The Affordable Care Act, some of the thorniest problems in that bill were worked out in cooperation with big business in order to accomplish progressive goals."
475,2-4-16,primary_dem,MADDOW,"Could you work with them, or have you made enemies of big business in this country with the way you've approached them in this campaign?"
476,2-4-16,primary_dem,SANDERS," Of course I can work with them, but let's be clear."
477,2-4-16,primary_dem,SANDERS,"When I talked about Boeing and I talked about General Electric, what I was referring to is an outrage."
478,2-4-16,primary_dem,SANDERS,I suspect the secretary agrees request me.
479,2-4-16,primary_dem,SANDERS,"Right now you have a loophole such that these guys are putting their profits, multi-billion dollar profitable corporations putting billions of dollars into the Cayman Islands, Bermuda, and other tax havens."
480,2-4-16,primary_dem,SANDERS,"And in a given year, Rachel, after making billions of dollars in profit, do you know how much they're paying in taxes to the United States government in a given year?"
481,2-4-16,primary_dem,SANDERS,Zero.
482,2-4-16,primary_dem,SANDERS,Now explain to me how that makes any sense at all.
483,2-4-16,primary_dem,SANDERS,"So what I have said with regard to Boeing and GE and other multinationals that pay zero taxes, you know what we're going to do?"
484,2-4-16,primary_dem,SANDERS,We're going to end that loophole.
485,2-4-16,primary_dem,SANDERS,They are going to pay their fair share of taxes.
486,2-4-16,primary_dem,SANDERS,We're going to use that money to rebuild our infrastructure and create up to 13 million jobs.
487,2-4-16,primary_dem,SANDERS,Can I work with corporations?
488,2-4-16,primary_dem,SANDERS,Are there good corporations doing incredible cutting edge research and development?
489,2-4-16,primary_dem,SANDERS,Absolutely they are.
490,2-4-16,primary_dem,SANDERS,And we should be proud of them.
491,2-4-16,primary_dem,SANDERS,"But on the other hand, there are many corporations who have turned their backs on the American worker, who have said, if I can make another nickel in profit by going to China and shutting down in the United States of America, that's what I will do."
492,2-4-16,primary_dem,SANDERS,I will do my best to transform our trade policy and take on these corporations who want to invest in low-income countries around the world rather than in the United States of America.
493,2-4-16,primary_dem,SANDERS,[applause]
494,2-4-16,primary_dem,MADDOW," Senator Sanders, thank you."
495,2-4-16,primary_dem,MADDOW,"And with that, we're going to take a break."
496,2-4-16,primary_dem,TODD, We'll be right back.
497,2-4-16,primary_dem,TODD,And we're going to get to trade and a lot of other issues.
498,2-4-16,primary_dem,TODD,"[applause]

[commercial break]"
499,2-4-16,primary_dem,MADDOW, Welcome back—welcome back to the Democratic candidates' debate.
500,2-4-16,primary_dem,MADDOW,"We're going to be talking about America in the world, both in terms of some trade issues, but also national security."
501,2-4-16,primary_dem,MADDOW,"And Secretary Clinton, we're going to start with you."
502,2-4-16,primary_dem,MADDOW,"There are more than 4,000 American troops back in Iraq right now as part of the fight against ISIS."
503,2-4-16,primary_dem,MADDOW,"It has been 15 straight years of wars and multiple deployments for America's military families, who have borne such a disproportionate burden."
504,2-4-16,primary_dem,MADDOW,Is President Obama right to keep escalating the number of U.S. troops that's fighting ISIS right now?
505,2-4-16,primary_dem,CLINTON," Well, I think what the president understands, and what he's trying to do, is that we have to support the Arab and Kurdish fighters on the ground who are actually doing the fighting."
506,2-4-16,primary_dem,CLINTON,I agree with the president.
507,2-4-16,primary_dem,CLINTON,"I've said myself, we will not send American combat troops back to either Syria or Iraq—that is off the table."
508,2-4-16,primary_dem,CLINTON,"But we do have special forces, we do have trainers, we do have the military personnel who are helping with the airstrikes that the United States is leading so that we can try to take out ISIS infrastructure, take out their leadership."
509,2-4-16,primary_dem,CLINTON,"And I think that, given the threat that ISIS poses to the region and beyond, as we have sadly seen in our own country, it is important to keep the Iraqi army on a path where they can actually take back territory, to work with the Sunni tribes in Anbar province and elsewhere so that their fighters can be also deployed, to work with the Kurds to provide them the support, but they're doing the fighting."
510,2-4-16,primary_dem,CLINTON,We're doing the support and enabling.
511,2-4-16,primary_dem,CLINTON,"And I also think we've got to do more to stop foreign fighters, foreign funding and take ISIS on online, as well as doing everything necessary to keep us safe at home."
512,2-4-16,primary_dem,CLINTON,"So as I look at what the president it doing, it adds up to me."
513,2-4-16,primary_dem,CLINTON,We just have to keep—try to get more support for those people on the ground in Syria and Iraq who have to actually physically take the territory back.
514,2-4-16,primary_dem,MADDOW," To be clear, to the specific question, if that strategic goal that you're describing requires considerably more of Americans—an ever-increasing number of Americans in Iraq and maybe in Syria, are you OK with the numbers increasing?"
515,2-4-16,primary_dem,CLINTON, No.
516,2-4-16,primary_dem,CLINTON,"I mean, of course that's a theoretical question, and we don't know what it would be for, and we don't know how many numbers there are."
517,2-4-16,primary_dem,CLINTON,I am against American combat troops being in Syria and Iraq.
518,2-4-16,primary_dem,CLINTON,I support special forces.
519,2-4-16,primary_dem,CLINTON,I support trainers.
520,2-4-16,primary_dem,CLINTON,I support the air campaign.
521,2-4-16,primary_dem,CLINTON,And I think we're making some progress.
522,2-4-16,primary_dem,CLINTON,"I want to continue to intensify that, and that's exactly what the president is doing."
523,2-4-16,primary_dem,MADDOW," Thank you, Madam Secretary."
524,2-4-16,primary_dem,TODD," Go ahead, Senator Sanders—30 seconds, your response."
525,2-4-16,primary_dem,SANDERS," OK. Let me agree with much of what the secretary said, but where we have a different background on this issue is we differ on the war in Iraq, which created barbaric organizations like ISIS."
526,2-4-16,primary_dem,SANDERS,"Not only did I vote against that war, I helped lead the opposition, and if you go to my website, berniesanders.com, you will see the statement that I made in 2002."
527,2-4-16,primary_dem,SANDERS,"And it gives me no pleasure to tell you that much of what I feared would happen the day after Saddam Hussein was overthrown, in fact, did happen."
528,2-4-16,primary_dem,TODD, All right.
529,2-4-16,primary_dem,TODD,"Senator, I want to stay, though..."
530,2-4-16,primary_dem,CLINTON, If I could—if I could...
531,2-4-16,primary_dem,TODD, Go ahead.
532,2-4-16,primary_dem,TODD,30 seconds.
533,2-4-16,primary_dem,CLINTON," ... respectfully add—look, we did differ."
534,2-4-16,primary_dem,CLINTON,A vote in 2002 is not a plan to defeat ISIS.
535,2-4-16,primary_dem,CLINTON,We have to look at the threats that we face right now...[applause]...and we have to be prepared to take them on and defeat them.
536,2-4-16,primary_dem,TODD, Let me—let—we're gonna—we're staying—we're staying basically on this topic.
537,2-4-16,primary_dem,TODD,"Obviously you've been emphasizing this difference on the Iraq war, but one place where you do agree, and one place where you voted to authorize the use of force, was in favor of the war in Afghanistan."
538,2-4-16,primary_dem,TODD,"Right now, it is possible President Obama is going to be leaving the next president, perhaps President Sanders, at least 10,000 troops in Afghanistan."
539,2-4-16,primary_dem,TODD,How long will those troops be in Afghanistan under President Sanders?
540,2-4-16,primary_dem,SANDERS," Well, I think our great task is to make certain that our young men and women in the military do not get sucked into never- ending, perpetual warfare within the quagmire of Syria and Iraq."
541,2-4-16,primary_dem,SANDERS,And I will do my very best to make sure that that doesn't happen.
542,2-4-16,primary_dem,SANDERS,I agree with the secretary that I think what has to happen—and let me just mention what King Abdullah of Jordan said.
543,2-4-16,primary_dem,SANDERS,I think he hit the nail on the head.
544,2-4-16,primary_dem,SANDERS,And what he said is essentially the war against ISIS is a war for the soul of Islam.
545,2-4-16,primary_dem,SANDERS,"And it must be Muslim troops on the ground that will destroy ISIS, with the support of a coalition of major powers—U.S., U.K., France, Germany and Russia."
546,2-4-16,primary_dem,SANDERS,So our job is to provide them the military equipment that they need; the air support they need; special forces when appropriate.
547,2-4-16,primary_dem,SANDERS,"But at the end of the day for a dozen different reasons, not the least of which is that ISIS would like American combat troops on the ground so they could reach out to the Muslim world and say, ""Look, we're taking on those terrible Americans."""
548,2-4-16,primary_dem,SANDERS,The combat on the ground must be done by Muslim troops with our support.
549,2-4-16,primary_dem,SANDERS,We must not get involved in perpetual warfare in the Middle East.
550,2-4-16,primary_dem,TODD, Can you address a question on Afghanistan?
551,2-4-16,primary_dem,TODD,"[applause]

[crosstalk]

How long are these troops going to be there?"
552,2-4-16,primary_dem,TODD,"If President Obama leaves you 10,000 troops, how long do you think they're going to be there?"
553,2-4-16,primary_dem,SANDERS," Well, you can't simply withdraw tomorrow."
554,2-4-16,primary_dem,SANDERS,"Wish we could, and allow, you know, the Taliban or anybody else to reclaim that country."
555,2-4-16,primary_dem,SANDERS,"But what we must do, and what we have seen in recent months, is some progress in Iraq, where finally the Iraqi army, which has not been a particularly effective fighting force, retook Ramadi."
556,2-4-16,primary_dem,SANDERS,ISIS has lost I think 40 percent of the territory that it held in the last year.
557,2-4-16,primary_dem,SANDERS,"Hopefully, and you know, one can't predict the future, that maybe our training and their fighting capabilities are improving and we are going to make some progress in destroying ISIS."
558,2-4-16,primary_dem,TODD," Secretary Clinton, 30 seconds: How long are these troops going to be in Afghanistan?"
559,2-4-16,primary_dem,TODD,We have more American troops in Afghanistan than what we were talking about with Iraq.
560,2-4-16,primary_dem,CLINTON," Oh, absolutely."
561,2-4-16,primary_dem,CLINTON,The president decided to leave more troops than he had originally planned in Afghanistan.
562,2-4-16,primary_dem,CLINTON,"We have a very cooperative government there, with Ashraf Ghani and his top—his top partner, Abdullah."
563,2-4-16,primary_dem,CLINTON,And they are doing their very best.
564,2-4-16,primary_dem,CLINTON,And the Afghan army is actually fighting.
565,2-4-16,primary_dem,CLINTON,The Afghan army is taking heavy losses defending Afghan territory.
566,2-4-16,primary_dem,CLINTON,And I would have to make an evaluation based on the circumstances at the time I took office as to how much help they continue to need.
567,2-4-16,primary_dem,CLINTON,Because it's not just the Taliban.
568,2-4-16,primary_dem,CLINTON,"We now are seeing outposts of, you know, fighters claiming to be affiliated with ISIS."
569,2-4-16,primary_dem,CLINTON,"So, we've got this arc of instability from North Africa to South Asia, and we have to pay close attention to it."
570,2-4-16,primary_dem,CLINTON,"And we have to build coalitions, something that I did to take on the Iranian nuclear program, and what I will do as president to make sure that we defeat these terrorist networks."
571,2-4-16,primary_dem,TODD," You know, Senator Sanders, nobody knows who your foreign policy advisers are."
572,2-4-16,primary_dem,TODD,You haven't given a major foreign policy speech.
573,2-4-16,primary_dem,TODD,"And it doesn't sound like all the time that foreign policy is a priority, other than when you're asked about it, and you say you're going to crush ISIS, as you said last night and earlier."
574,2-4-16,primary_dem,TODD,You have not proactively laid out a foreign policy doctrine yet.
575,2-4-16,primary_dem,TODD,Why?
576,2-4-16,primary_dem,SANDERS," Well, that's not quite accurate."
577,2-4-16,primary_dem,SANDERS,I did give a speech at Georgetown where I talked about democratic socialism and foreign policy.
578,2-4-16,primary_dem,SANDERS,"Maybe I shouldn't have combined the two in the same speech, because the foreign policy part of it didn't get much attention."
579,2-4-16,primary_dem,SANDERS,"So, let me take this opportunity to give you a very short speech here on the issue."
580,2-4-16,primary_dem,SANDERS,"I think, while it is true that the secretary and I voted differently on the war in Iraq, what is important is that we learn the lesson of the war in Iraq."
581,2-4-16,primary_dem,SANDERS,"And that lesson is intrinsic to my foreign policy if elected president, is the United States cannot do it alone."
582,2-4-16,primary_dem,SANDERS,We cannot be the policeman of the world.
583,2-4-16,primary_dem,SANDERS,We are now spending more I believe than the next eight countries on defense.
584,2-4-16,primary_dem,SANDERS,We have got to work in strong coalition with the major powers of the world and with those Muslim countries that are prepared to stand up and take on terrorism.
585,2-4-16,primary_dem,SANDERS,"So I would say that the key doctrine of the Sanders administration would be no, we cannot continue to do it alone; we need to work in coalition."
586,2-4-16,primary_dem,SANDERS,"[applause]

[crosstalk]"
587,2-4-16,primary_dem,CLINTON," A group of national security experts, military intelligence experts, issued a very concerning statement about Senator Sanders's views on foreign policy and national security, pointing out some of the comments he has made on these issues, such as inviting Iranian troops into Syria to try to resolve the conflict there; putting them right at the doorstep of Israel."
588,2-4-16,primary_dem,CLINTON,"Asking Saudi Arabia and Iran to work together, when they can't stand each other and are engaged in a proxy battle right at this moment."
589,2-4-16,primary_dem,CLINTON,"So I do think questions have been raised and questions have to be answered because when New Hampshire voters go on Tuesday to cast your vote, you are voting both for a president and a commander in chief."
590,2-4-16,primary_dem,CLINTON,"And there is no way to predict what comes in the door of that White House from day to day that can pose a threat to the United States or one of our friends and allies, and I think this is a big part of the job interview that we are all conducting with the voters here."
591,2-4-16,primary_dem,TODD," All right, Senator, 30 seconds."
592,2-4-16,primary_dem,TODD,[applause]
593,2-4-16,primary_dem,SANDERS," [off-mike] I fully, fully concede that Secretary Clinton, who was secretary of State for four years, has more experience—hat is not arguable—in foreign affairs."
594,2-4-16,primary_dem,SANDERS,"But experience is not the only point, judgment is."
595,2-4-16,primary_dem,SANDERS,"And once again, back in 2002, when we both looked at the same evidence about the wisdom of the war in Iraq, one of us voted the right way and one of us didn't."
596,2-4-16,primary_dem,SANDERS,"In terms of Iran and in terms of Saudi Arabia, of course they hate each other."
597,2-4-16,primary_dem,SANDERS,That's no great secret.
598,2-4-16,primary_dem,SANDERS,"But John Kerry, who is I think doing a very good job, has tried to at least get these people in the room together because both of them are being threatened by ISIS."
599,2-4-16,primary_dem,CLINTON," Well, let me just add that, you know, I've said this before and I'm very proud of it, that when it comes to judgment, having run a hard race against Senator Obama at the time, he turned to me to be secretary of State."
600,2-4-16,primary_dem,CLINTON,"And when it comes to the biggest counterterrorism issues that we faced in this administration, namely whether or not to go after bin Laden, I was at that table, I was exercising my judgment to advise the president on what to do, on that, on Iran, on Russia on China, on a whole raft of issues."
601,2-4-16,primary_dem,CLINTON,Because I know from my own experience that you've got to be ready on day one.
602,2-4-16,primary_dem,CLINTON,"There is just too much unpredictable threat and danger in the world today, you know, to try to just say wait, I'll get to that when I can."
603,2-4-16,primary_dem,CLINTON,That is just not an acceptable approach.
604,2-4-16,primary_dem,SANDERS, Well...
605,2-4-16,primary_dem,MADDOW," Secretary Clinton, at the—at the last Democratic debate in Charleston—I want to get specific here—Senator Sanders called for moving as aggressively as we can to normalize relations with Iran."
606,2-4-16,primary_dem,MADDOW,Your campaign has criticized him for saying that.
607,2-4-16,primary_dem,MADDOW,"Now that he's standing next to you here on this stage, can you explain why the U.S. shouldn't try to normalize relations in Iran in your view?"
608,2-4-16,primary_dem,CLINTON, Absolutely.
609,2-4-16,primary_dem,CLINTON,"You know, I did put together the coalition to impose sanctions."
610,2-4-16,primary_dem,CLINTON,"I actually started the negotiations that led to the nuclear agreement, sending some much my closest aides to begin the conversations with the Iranians."
611,2-4-16,primary_dem,CLINTON,I'm very pleased we got that nuclear agreement.
612,2-4-16,primary_dem,CLINTON,It puts a lid on the nuclear weapons program.
613,2-4-16,primary_dem,CLINTON,"We have to enforce it, there have to be consequences attached to it."
614,2-4-16,primary_dem,CLINTON,But that is not our only problem with Iran.
615,2-4-16,primary_dem,CLINTON,We have to figure out how to deal with Iran as the principal state sponsor of terrorism in the world.
616,2-4-16,primary_dem,CLINTON,They are destabilizing governments in the region.
617,2-4-16,primary_dem,CLINTON,They continue to support Hezbollah and Hamas in Lebanon against Israel.
618,2-4-16,primary_dem,CLINTON,A lot of work that we have do is going to be incredibly hard.
619,2-4-16,primary_dem,CLINTON,"I'm prepared to do that work, but I believe, just as I did with imposing the sanctions, you have to get action for action."
620,2-4-16,primary_dem,CLINTON,"If we were to normalize relations right now, we would remove one of the biggest pieces of leverage we have to try to influence and change Iranian behavior."
621,2-4-16,primary_dem,CLINTON,The president doesn't think we should.
622,2-4-16,primary_dem,CLINTON,I certainly don't think we should.
623,2-4-16,primary_dem,CLINTON,"I believe we have to take this step by step to try to reign in Iranian aggression, their support for terrorism and the other bad behavior that can come back and haunt us."
624,2-4-16,primary_dem,SANDERS, Who said That think we should normalize relations with Iran tomorrow?
625,2-4-16,primary_dem,SANDERS,I never said that.
626,2-4-16,primary_dem,SANDERS,I think we should move forward as quickly as we can.
627,2-4-16,primary_dem,SANDERS,And you're right.
628,2-4-16,primary_dem,SANDERS,They are a sponsor of terrorism around the world and we have to address that.
629,2-4-16,primary_dem,SANDERS,"But you know, a number of years ago, people were saying normal relationship with Cuba, what a bad and silly idea."
630,2-4-16,primary_dem,SANDERS,"They're Communists, they are our enemy."
631,2-4-16,primary_dem,SANDERS,Well guess what?
632,2-4-16,primary_dem,SANDERS,Change has come.
633,2-4-16,primary_dem,SANDERS,So please don't suggest that I think we normalize relations with Tehran tomorrow.
634,2-4-16,primary_dem,SANDERS,We don't.
635,2-4-16,primary_dem,SANDERS,"But I would like to see us move forward, and hopefully some day that will happen."
636,2-4-16,primary_dem,SANDERS,"And I would say if I might, Madam Secretary—and you can correct me if I'm wrong."
637,2-4-16,primary_dem,SANDERS,When you ran against Senator Obama you thought him naive because he thought it was a good idea to talk to our enemies.
638,2-4-16,primary_dem,SANDERS,I think those are exactly the people you have to talk to and you have to negotiate with.
639,2-4-16,primary_dem,SANDERS,[applause]
640,2-4-16,primary_dem,CLINTON," Well Senator, let me just correct the record if I can."
641,2-4-16,primary_dem,CLINTON,You know—let me correct the record.
642,2-4-16,primary_dem,CLINTON,[crosstalk]
643,2-4-16,primary_dem,TODD," 30 seconds, madam secretary."
644,2-4-16,primary_dem,CLINTON," As I—as I certainly recall, the question was to meet with without conditions."
645,2-4-16,primary_dem,CLINTON,"And you're right, I was against that."
646,2-4-16,primary_dem,CLINTON,I was against it then I would be against it now.
647,2-4-16,primary_dem,SANDERS, OK.
648,2-4-16,primary_dem,CLINTON," Part of diplomacy, the hard work of diplomacy is trying to extract whatever concessions you can get, and giving something the other side wants."
649,2-4-16,primary_dem,CLINTON,"Of course you've got to try to make peace with, and work with those who are your adversaries, but you don't just rush in, open the door, and say, ""Here I am."
650,2-4-16,primary_dem,CLINTON,"Let's talk and make a deal."""
651,2-4-16,primary_dem,CLINTON,That's not the way it works.
652,2-4-16,primary_dem,SANDERS," I think President Obama had the right idea, and the bottom line is that of course there have to be conditions."
653,2-4-16,primary_dem,SANDERS,"But, of course it doesn't do us any good to not talk with our adversaries..."
654,2-4-16,primary_dem,CLINTON," ... Well, we set conditions on Iran."
655,2-4-16,primary_dem,CLINTON,"We worked hard to get them established, and to be enforced, and then we talked."
656,2-4-16,primary_dem,CLINTON,"That's exactly the right...[crosstalk]...and, that's what I did with the President, so he and I are on the very same page."
657,2-4-16,primary_dem,CLINTON,[applause]
658,2-4-16,primary_dem,SANDERS," Just to set the record straight, I very strongly supported the agreement which makes certain that Iran does not get a nuclear weapon."
