,Date,Debate Type,Speaker,Sents
448,3-6-16,primary_dem,CLINTON,Your Senators saw it here in Michigan.
449,3-6-16,primary_dem,CLINTON,They can give you the names of 240 companies in Michigan that have been helped.
450,3-6-16,primary_dem,CLINTON,"There is a company in Levonia being helped, there are companies all over this state."
451,3-6-16,primary_dem,CLINTON,"I know, if we are going to compete and win in the global economy, we can't let every other country support their companies and we take a hands off approach."
452,3-6-16,primary_dem,CLINTON,I will not agree with that.
453,3-6-16,primary_dem,COOPER, I'm going to let you respond but I just want to push back on this.
454,3-6-16,primary_dem,COOPER,"Senator Sanders is correct, the majority of the money does go Boeing, does go to companies like Caterpillar."
455,3-6-16,primary_dem,COOPER,Do they need this money?
456,3-6-16,primary_dem,CLINTON," I will tell you what, Anderson, after I investigated it, I concluded they did and here's why."
457,3-6-16,primary_dem,CLINTON,"There two big plane manufacturers in the world, there's Airbus and Boeing."
458,3-6-16,primary_dem,CLINTON,Airbus does everything it can to get contracts to sell planes everywhere in the world.
459,3-6-16,primary_dem,CLINTON,We don't have as quite an aggressive outreach from our government.
460,3-6-16,primary_dem,CLINTON,"I did go in many places around the world to sell American products because the alternatives were usually European, Asian, primarily Chinese products."
461,3-6-16,primary_dem,CLINTON,That to me was an unacceptable concession.
462,3-6-16,primary_dem,CLINTON,"So yes, Boeing and other big companies get support just like their competitors do from the companies that they are from in the countries that provide the support."
463,3-6-16,primary_dem,COOPER, Thank you.
464,3-6-16,primary_dem,COOPER,Senator sanders?
465,3-6-16,primary_dem,SANDERS," Isn't it tragic that the large multinational corporations making billions of dollars a year, shutting down in America, going to China, going to Mexico?"
466,3-6-16,primary_dem,SANDERS,Absolutely they need a handout from the American middle class — I don't think so.
467,3-6-16,primary_dem,SANDERS,Second of all.
468,3-6-16,primary_dem,SANDERS,"[applause]

Second of all, secretary Clinton traveled the world, she has been to Europe."
469,3-6-16,primary_dem,SANDERS,And let's talk about Europe versus the United States.
470,3-6-16,primary_dem,SANDERS,"I'm sure that when you were in Europe, and France, and Germany and the U.K., and all of the other countries; you noticed something and that is every one of those countries guarantees health care to all of their people as a right."
471,3-6-16,primary_dem,SANDERS,"[applause]

And I am sure you know as you know you do that in countries like the U.K. compared to America, we are spending almost three times as much as they spend in the U.K. for health care for our people."
472,3-6-16,primary_dem,SANDERS,We are spending 50 percent more than the French.
473,3-6-16,primary_dem,SANDERS,"When we talk about Europe and their pluses and minuses, one thing they have done well that we should emulate and that is guaranteed health care for all people for a better care for all."
474,3-6-16,primary_dem,COOPER," Thank you, Senator Sanders."
475,3-6-16,primary_dem,COOPER,"Secretary Clinton, 30 seconds and we have to take a break."
476,3-6-16,primary_dem,COOPER,So 30 seconds if you can.
477,3-6-16,primary_dem,CLINTON," We are on the path to doing that thanks to President Obama and the Affordable Care Act, we have 90 percent coverage."
478,3-6-16,primary_dem,CLINTON,We are lacking 10 percent.
479,3-6-16,primary_dem,CLINTON,We are going to stay on that and get to 100 percent universal coverage.
480,3-6-16,primary_dem,COOPER, We have to take a break.
481,3-6-16,primary_dem,COOPER,We will continue this discussion.
482,3-6-16,primary_dem,COOPER,We have a lot more to talk about.
483,3-6-16,primary_dem,COOPER,We will take a short break.
484,3-6-16,primary_dem,COOPER,"We have more of the Presidential Democratic Debate from Flint, Michigan when we come back."
485,3-6-16,primary_dem,COOPER,[commercial break]
486,3-6-16,primary_dem,COOPER," And welcome back to the CNN Democratic presidential debate, live here in Flint, Michigan."
487,3-6-16,primary_dem,COOPER,We want to continue the discussion now — we're gonna turn to the subject of crime.
488,3-6-16,primary_dem,COOPER,"As most of you know, two weeks ago, an Uber driver in Kalamazoo, which is two hours from where we are tonight, went on a shooting rampage, killing six people, injuring two people."
489,3-6-16,primary_dem,COOPER,One of the injured was a 14-year-old girl.
490,3-6-16,primary_dem,COOPER,Her name is Abigail Kopf.
491,3-6-16,primary_dem,COOPER,"She was shot in the head, her heart stopped, she was on life support — looked like she might — might not make it."
492,3-6-16,primary_dem,COOPER,"But amazingly, Abigail pulled through."
493,3-6-16,primary_dem,COOPER,Her father...[applause]...her father Gene Kopf is here tonight.
494,3-6-16,primary_dem,COOPER,"And I know, Gene, you have a question."
495,3-6-16,primary_dem,COOPER,"But before you ask your question, I just want to ask, how is Abigail doing tonight?"
496,3-6-16,primary_dem,QUESTION," She is now laughing and giggling, but she has a long road of physical recovery."
497,3-6-16,primary_dem,QUESTION,[applause]
498,3-6-16,primary_dem,COOPER," I should point out you are leaning toward Senator Sanders, but I know you have a question that applies to both candidates."
499,3-6-16,primary_dem,COOPER,We'll first toss it to Secretary Clinton.
500,3-6-16,primary_dem,COOPER,What's your question?
501,3-6-16,primary_dem,QUESTION, The United States has had a rash of mass shootings over the years — 42 shootings in the United States this year alone.
502,3-6-16,primary_dem,QUESTION,"The man who shot everyone, including my daughter, in Kalamazoo, had no mental health issues recorded, and had a clear background."
503,3-6-16,primary_dem,QUESTION,What do you plan to do to address this serious epidemic?
504,3-6-16,primary_dem,QUESTION,"I don't want to hear anything about tougher laws for mental health or criminal backgrounds, because that doesn't work."
505,3-6-16,primary_dem,QUESTION,[applause]
506,3-6-16,primary_dem,COOPER, Secretary Clinton?
507,3-6-16,primary_dem,CLINTON," Well, first of all I am looking at your daughter and I'm very grateful that she is laughing and she is on a road to recovery."
508,3-6-16,primary_dem,CLINTON,But it never should have happened.
509,3-6-16,primary_dem,CLINTON,"You know, on average, 90 people a day are killed by gun violence in our country."
510,3-6-16,primary_dem,CLINTON,I think we have to try everything that works to try to limit the numbers of people and the kinds of people who are given access to firearms.
511,3-6-16,primary_dem,CLINTON,"The Brady Bill, which has been in effect now for about 23 years, has kept more than two million purchases from going forward."
512,3-6-16,primary_dem,CLINTON,So we do have to continue to try to work on that because not every killer will have the same profile.
513,3-6-16,primary_dem,CLINTON,"But the comprehensive background checks, closing the gun show loophole, closing the online loophole, closing what's called the Charleston loophole, where you get a gun at the end of three days, even if the background check is not completed which is what the killer in Charleston did."
514,3-6-16,primary_dem,CLINTON,"And then they found out later, he shouldn't have gotten the gun when he killed nine people at Mother Emmanuel Church."
515,3-6-16,primary_dem,CLINTON,"I also believe, so strongly Gene, that giving immunity to gunmakers and sellers was a terrible mistake."
516,3-6-16,primary_dem,CLINTON,"[applause]

Because it removed any accountability from the makers and the sellers."
517,3-6-16,primary_dem,CLINTON,"And it also disrupted what was a very promising legal theory, to try to get makers to do more to make guns safer for example."
518,3-6-16,primary_dem,CLINTON,To try to give sellers more accountability for selling guns when they shouldn't have.
519,3-6-16,primary_dem,CLINTON,"So that is an issue that Senator Sanders and I differ on, I voted against giving them immunity, but I think we should very seriously move to repeal that and go back to making sure gun makers and sellers are like any other business."
520,3-6-16,primary_dem,CLINTON,They can be held accountable.
521,3-6-16,primary_dem,CLINTON,And then I do think we have got to have a public...
522,3-6-16,primary_dem,QUESTION, Thank you.
523,3-6-16,primary_dem,CLINTON," Well, we've got to have a public discussion, because we have created a culture in which people grab for guns all the time."
524,3-6-16,primary_dem,COOPER, Thank you.
525,3-6-16,primary_dem,CLINTON, And there has got to be a way to have more warning signals and more efforts to try to stop that from happening like with the man who shot your daughter.
526,3-6-16,primary_dem,COOPER, I want to go to Senator Sanders.
527,3-6-16,primary_dem,COOPER,"[applause]

Senator Sanders?"
528,3-6-16,primary_dem,SANDERS, I remember President Obama being on television maybe three months ago.
529,3-6-16,primary_dem,SANDERS,Showed the secretary members as well.
530,3-6-16,primary_dem,SANDERS,"She knows the president, I know the president."
531,3-6-16,primary_dem,SANDERS,And he is generally speaking in public and he's not a very emotional guy.
532,3-6-16,primary_dem,SANDERS,"And he — after the mass killing in Oregon if my memory is correct, he said look."
533,3-6-16,primary_dem,SANDERS,"There — to be honest with you, let's be honest."
534,3-6-16,primary_dem,SANDERS,Nobody has a magic solution to this problem.
535,3-6-16,primary_dem,SANDERS,"Any lunatic tomorrow, any person can walk into a theater and do something horrific."
536,3-6-16,primary_dem,SANDERS,And you know what?
537,3-6-16,primary_dem,SANDERS,For us to tell you that that absolutely will not happen would be untrue.
538,3-6-16,primary_dem,SANDERS,"But what the president said, he said look, this is a tough issue."
539,3-6-16,primary_dem,SANDERS,But we have got to do everything we possibly can to minimize the possibility of these mass killings.
540,3-6-16,primary_dem,SANDERS,You are looking at a guy who comes from a rural state with no gun control.
541,3-6-16,primary_dem,SANDERS,I have a D minus voting record from the NRA.
542,3-6-16,primary_dem,SANDERS,"You are looking at a guy who in 1988 lost a statewide election for Congress because I was the only candidate who said you know what, I don't think it's a great idea in this country to be selling military-style assault weapons which are designed to kill people."
543,3-6-16,primary_dem,SANDERS,"[applause]

I lost that election by three votes."
544,3-6-16,primary_dem,SANDERS,I agree with what the secretary said.
545,3-6-16,primary_dem,SANDERS,We need to expand and improve the instant background checks.
546,3-6-16,primary_dem,SANDERS,Bottom line is people who should not have guns in America should not be able to buy guns in America.
547,3-6-16,primary_dem,COOPER," Senator Sanders, Secretary Clinton mentioned the so- called Charleston loophole."
548,3-6-16,primary_dem,COOPER,What she is calling the Charleston loophole.
549,3-6-16,primary_dem,COOPER,"Is that something, if you were president, you would you work to extend that three day?"
550,3-6-16,primary_dem,SANDERS," Absolutely, I agree."
551,3-6-16,primary_dem,SANDERS,"Look, that bill had some sensible provisions in it."
552,3-6-16,primary_dem,SANDERS,It had the banning of bullets that pierce policemen's armor.
553,3-6-16,primary_dem,SANDERS,Is that a good thing?
554,3-6-16,primary_dem,SANDERS,I think we would want to get rid of that.
555,3-6-16,primary_dem,SANDERS,particular legislation had safety locks on guns so the kids do not pick them up and shoot them.
556,3-6-16,primary_dem,SANDERS,That bill had bad things in it.
557,3-6-16,primary_dem,SANDERS,What I have said...
558,3-6-16,primary_dem,COOPER, So you would want a longer than three days waiting period?
559,3-6-16,primary_dem,SANDERS, Absolutely.
560,3-6-16,primary_dem,SANDERS,That was a very arbitrary decision.
561,3-6-16,primary_dem,SANDERS,"What that real debate was about, as you may or may not know, was about how long it would take for the instant background check to go into effect."
562,3-6-16,primary_dem,SANDERS,I wanted that instant background check to go into effect as soon as possible.
563,3-6-16,primary_dem,SANDERS,That was the most important part of that bill.
564,3-6-16,primary_dem,COOPER," Secretary Clinton — actually, Senator Sanders, let me continue to follow-up, because Secretary Clinton mentioned the liability."
565,3-6-16,primary_dem,COOPER,"Right now, families of Sandy Hook victims announced that they are going to sue Remington, who made the AR-15 which was used in the Newtown massacre."
566,3-6-16,primary_dem,COOPER,"[applause]

Now, they believe — those families believe that — that Remington, the distributors, the sellers — should be held legally responsible for how that gun — how their product is used."
567,3-6-16,primary_dem,COOPER,"Now, the lawsuit may not go anywhere because of the bill you voted for — legislation that prevents gun makers from being sued."
568,3-6-16,primary_dem,COOPER,"Tonight, what do you say to those families?"
569,3-6-16,primary_dem,SANDERS," Well, this is what I say, if I understand it — and correct me if I'm wrong."
570,3-6-16,primary_dem,SANDERS,"If you go to a gun store and you legally purchase a gun, and then, three days later, if you go out and start killing people, is the point of this lawsuit to hold the gun shop owner or the manufacturer of that gun liable?"
571,3-6-16,primary_dem,SANDERS,"If that is the point, I have to tell you I disagree."
572,3-6-16,primary_dem,SANDERS,"I disagree because you hold people — in terms of this liability thing, where you hold manufacturers' liability is if they understand that they're selling guns into an area that — it's getting into the hands of criminals, of course they should be held liable."
573,3-6-16,primary_dem,SANDERS,"But if they are selling a product to a person who buys it legally, what you're really talking about is ending gun manufacturing in America."
574,3-6-16,primary_dem,SANDERS,I don't agree with that.
575,3-6-16,primary_dem,COOPER, Secretary Clinton?
576,3-6-16,primary_dem,COOPER,[applause]
577,3-6-16,primary_dem,CLINTON," Well, that — that is not — that is not what happened, and I think it's important for people to understand."
578,3-6-16,primary_dem,CLINTON,"Because of the proliferation of guns, because of the epidemic of gun violence in our country, there were a group of cities, states, and other concerned people who, in the late 90s and in the early 2000s, were working on legal theories that they thought would force gun makers to do more to make guns safer and force sellers to be much more responsible."
579,3-6-16,primary_dem,CLINTON,"The NRA saw this happening, and they said, ""we've got to stop it."
580,3-6-16,primary_dem,CLINTON,"Last thing in the world we want is to have guns that you can only shoot with your fingerprint, or to have guns with such strong safety locks on them that they may not be sellable."""
581,3-6-16,primary_dem,CLINTON,"So the NRA went to the Congress, and the head of the NRA has said this was the most important NRA legislation in more than 20 years..."
582,3-6-16,primary_dem,COOPER, Secretary...
583,3-6-16,primary_dem,CLINTON, ... and they basically went to the Congress — I was there.
584,3-6-16,primary_dem,COOPER, ... Secretary...
585,3-6-16,primary_dem,CLINTON, I was in the Senate.
586,3-6-16,primary_dem,CLINTON,"And they said, ""give us absolute immunity."""
587,3-6-16,primary_dem,CLINTON,No other industry in America has absolute immunity...[crosstalk]
588,3-6-16,primary_dem,CLINTON, ...and they sell products all the time that cause harm... [applause]
589,3-6-16,primary_dem,SANDERS, So let's say this.
590,3-6-16,primary_dem,SANDERS,Let's say this.
591,3-6-16,primary_dem,CLINTON, ... and they're held responsible.
592,3-6-16,primary_dem,COOPER, Senator Sanders.
593,3-6-16,primary_dem,SANDERS," If I understand — and — you know, as I understand it, what you're really talking about is not what Secretary Clinton is responding to."
594,3-6-16,primary_dem,SANDERS,"As I understand it — and maybe I'm wrong on this, but what you were essentially saying, and what people are saying, is that, if somebody who is crazy or a criminal or a horrible person goes around shooting people, the manufacturer of that gun should be held liable."
595,3-6-16,primary_dem,SANDERS,"And if that is your position, then what you are saying, essentially — if that is the case, as I understand it — it's not what Secretary Clinton is talking about."
596,3-6-16,primary_dem,SANDERS,I agree with what she said.
597,3-6-16,primary_dem,SANDERS,"But if that is the case, then essentially, your position is there should not be any guns in America, period."
598,3-6-16,primary_dem,SANDERS,[crosstalk]
599,3-6-16,primary_dem,CLINTON, That is like the NRA position.
600,3-6-16,primary_dem,CLINTON,No.
601,3-6-16,primary_dem,SANDERS," Can I — can I finish, please?"
602,3-6-16,primary_dem,SANDERS,All right?
603,3-6-16,primary_dem,SANDERS,And you can — there are people who hold that view.
604,3-6-16,primary_dem,SANDERS,"And that's fine, if you hold it."
605,3-6-16,primary_dem,SANDERS,I think what you do is you hold those people who have used the gun accountable.
606,3-6-16,primary_dem,SANDERS,You try to make...
607,3-6-16,primary_dem,COOPER, We're gonna move on.
608,3-6-16,primary_dem,SANDERS," ... guns as safe as possible, but I would disagree on that."
609,3-6-16,primary_dem,COOPER, We're gonna move on.
610,3-6-16,primary_dem,COOPER,Dawn...
611,3-6-16,primary_dem,CLINTON," Anderson, I just want to finish, because this — I know some of the parents from Sandy Hook."
612,3-6-16,primary_dem,CLINTON,"I want people in this audience to think about what it must feel like to send off your first grader, little backpack, maybe, on his or her back, and then the next thing you hear is that somebody has come to that school using an automatic weapon, an AR-15, and murdered those children."
613,3-6-16,primary_dem,CLINTON,"Now, they are trying to prevent that from happening to any other family."
614,3-6-16,primary_dem,SANDERS, Hold...
615,3-6-16,primary_dem,CLINTON, And the best way to do that is to go right at the people...
616,3-6-16,primary_dem,COOPER, Senator Sanders...
617,3-6-16,primary_dem,CLINTON, ... you talk about corporate greed?
618,3-6-16,primary_dem,SANDERS, Hold it.
619,3-6-16,primary_dem,CLINTON, The gun manufacturers sell guns to make as much money as they can make.
620,3-6-16,primary_dem,CLINTON,[applause]
621,3-6-16,primary_dem,COOPER, Senator Sanders.
622,3-6-16,primary_dem,SANDERS," You know, I think it is a little bit — it is a little bit — look, what happened at Sandy Hook, what happened in Michigan, what has happened far too often all over this country is a terrible, terrible tragedy, and we have got to do everything we can, as I mentioned a moment ago, to end these mass killings."
623,3-6-16,primary_dem,SANDERS,"But, as I understand what your question is — and, you're not the only person whose heart was broken."
624,3-6-16,primary_dem,SANDERS,"I know, I was there in the Senate when we learned about this killing."
625,3-6-16,primary_dem,SANDERS,It is almost unspeakable to talk about some lunatic walking into a — I mean; it is hard to even talk about it.
626,3-6-16,primary_dem,SANDERS,We all feel that way.
627,3-6-16,primary_dem,SANDERS,"But it, as I understand it, Anderson, and maybe I'm wrong, what you're really talking about is people saying let's end gun manufacturing in America."
628,3-6-16,primary_dem,SANDERS,"That's the implications of that, and I don't agree with that."
629,3-6-16,primary_dem,COOPER, We're going to move on.
630,3-6-16,primary_dem,COOPER,Don Lemon?
631,3-6-16,primary_dem,LEMON," Alright, thank you very much, Anderson."
632,3-6-16,primary_dem,LEMON,"As a black man in America, if I were born today I'd have a one in three chance of ending up in prison in my life."
633,3-6-16,primary_dem,LEMON,"Secretary Clinton, on the campaign trail, you are calling for an end to the era of mass incarceration, but a lot of folks in the black community blame the 1994 Crime Bill, a bill you supported for locking up a generation of black men."
634,3-6-16,primary_dem,LEMON,"Given what's happened since 1994, why should black people trust you to get it right this time?"
635,3-6-16,primary_dem,CLINTON," Well, Don't, let me say this, Senator Sanders voted for that bill, we both supported it."
636,3-6-16,primary_dem,CLINTON,"And, I think it's fair to say we did because back then there was an outcry over the rising crime rate, and people from all communities were asking that action be taken."
637,3-6-16,primary_dem,CLINTON,"Now, my husband said at the NAACP last summer that it solved some problems, but it created other problems, and I agree."
638,3-6-16,primary_dem,CLINTON,"And, one of those problems was, unfortunately, a move to expand the reasons why people would be incarcerated, not just at the federal level which is what this bill about, but in states and localities as well."
639,3-6-16,primary_dem,CLINTON,"And, that's why the very first speech that I gave in this campaign was about criminal justice reform, and ending the era of mass incarceration because I believe absolutely that too many families were broken up, too many communities were adversely affected."
640,3-6-16,primary_dem,CLINTON,"So, we've got to do a bunch of things."
641,3-6-16,primary_dem,CLINTON,"On the criminal justice side, look, we've got to have better policing."
642,3-6-16,primary_dem,CLINTON,"That means body cameras, that means ending profiling, that means doing everything we can to make sure there's respect between the community and the police."
643,3-6-16,primary_dem,CLINTON,"And, when it comes to incarceration..."
644,3-6-16,primary_dem,LEMON," But, Secretary..."
645,3-6-16,primary_dem,CLINTON," ... That means we have to limit mandatory minimums, we have to end disparities and treatment at last through incarceration..."
646,3-6-16,primary_dem,LEMON, The question is why should black people trust you this time to get it right?
647,3-6-16,primary_dem,LEMON,That's the question.
648,3-6-16,primary_dem,CLINTON," Well, Senator Sanders voted for it as well."
649,3-6-16,primary_dem,CLINTON,Are you going to ask him the same question?
650,3-6-16,primary_dem,SANDERS, Probably will.
651,3-6-16,primary_dem,LEMON, Do you think your support — your husband has said that this bill was a mistake.
652,3-6-16,primary_dem,LEMON,Do you think it was a mistake?
653,3-6-16,primary_dem,CLINTON, I just said that.
654,3-6-16,primary_dem,CLINTON,He said at the NAACP that there were some aspects that worked well.
655,3-6-16,primary_dem,CLINTON,"The violence against women provisions have worked well, for example."
656,3-6-16,primary_dem,CLINTON,"But, other aspects of it were a mistake and I agree."
657,3-6-16,primary_dem,CLINTON,"That's why I'm focused, and have a very comprehensive approach toward fixing the criminal justice system, going after systemic racism that stalks the criminal justice system, ending private prisons, ending the incarceration of low-level offenders, and I am committed to doing that."
658,3-6-16,primary_dem,CLINTON,[applause]
659,3-6-16,primary_dem,LEMON," And, Senator Sanders, before you respond, I want to ask you this."
660,3-6-16,primary_dem,LEMON,"Back in 1994, here's what you warned, we are dooming tens of millions of young people to a future of bitterness, mystery, hopelessness, drugs, crime, and violence, but you voted for the bill anyway."
661,3-6-16,primary_dem,LEMON,Was your vote a mistake?
662,3-6-16,primary_dem,SANDERS," You know, as I think Secretary Clinton knows, as we all know, there are bills in congress that have bad stuff, there are bills in congress that have good stuff."
663,3-6-16,primary_dem,SANDERS,Good stuff and bad stuff in the same bill.
664,3-6-16,primary_dem,SANDERS,"Now, if I have voted against that bill, Secretary Clinton would be here tonight and she'd say, ""Bernie Sanders voted against the ban on assault weapons."
665,3-6-16,primary_dem,SANDERS,"Bernie Sanders voted against the violence against women act."""
666,3-6-16,primary_dem,SANDERS,"Those were provisions in the bill, as the Secretary just indicated."
667,3-6-16,primary_dem,SANDERS,"So, in that bill there was some good provisions, I have been a fierce fighter against domestic violence ever since I was mayor in Burlington."
668,3-6-16,primary_dem,SANDERS,"Violence against women act has protected millions of women in this country, it was in that bill."
669,3-6-16,primary_dem,SANDERS,"The ban on assault weapons, that's what I have fought for my whole life."
670,3-6-16,primary_dem,SANDERS,It was in that bill.
671,3-6-16,primary_dem,SANDERS,"Now, what you are reading though is I went to the floor, as I recall, and that's what I said."
672,3-6-16,primary_dem,SANDERS,I tried to get the death penalty aspects in that bill out.
673,3-6-16,primary_dem,SANDERS,Secretary Clinton have a disagreement.
674,3-6-16,primary_dem,SANDERS,"I was then, and I am now opposed to the death penalty."
675,3-6-16,primary_dem,SANDERS,"[applause]

So, to answer your question, what you read was a congressman who was torn, who said there are good things in that bill, there are bad things overall."
676,3-6-16,primary_dem,SANDERS,I voted for it.
677,3-6-16,primary_dem,SANDERS,But where we are right now is having more than 2.2 million people in jail — more than any other country on earth.
678,3-6-16,primary_dem,SANDERS,"This is a campaign promise, at the end of my first term, we will not have more people in jail than any other country."
679,3-6-16,primary_dem,COOPER, Thank you very much.
