,Date,Debate Type,Speaker,Sents
219,3-6-16,primary_dem,CLINTON,"So, I have put together resources from the private and philanthropic communities to help provide a bridge because you've got to get the federal money, you've got to get the state money, but I'm going to do everything I can."
220,3-6-16,primary_dem,CLINTON,"And, I will be with Flint all the way through this crisis in whatever capacity I am."
221,3-6-16,primary_dem,CLINTON,"And, if I'm president, it will always be a priority for action from me."
222,3-6-16,primary_dem,CLINTON,[applause]
223,3-6-16,primary_dem,COOPER, Bryn has a follow up.
224,3-6-16,primary_dem,QUESTION," Senator Sanders, how about you?"
225,3-6-16,primary_dem,QUESTION,Your first visit to Flint as a presidential candidate was just over a week ago.
226,3-6-16,primary_dem,QUESTION,That's almost five months after the people here were told to stop drinking the water.
227,3-6-16,primary_dem,QUESTION,What took you so long?
228,3-6-16,primary_dem,SANDERS," Well, first of all, that's not quite accurate."
229,3-6-16,primary_dem,SANDERS,I was here long before that.
230,3-6-16,primary_dem,SANDERS,I will you what I did.
231,3-6-16,primary_dem,SANDERS,What I did was meet very quietly in Detroit with parents and others who were impacted by this disaster.
232,3-6-16,primary_dem,SANDERS,"And the second thing I did is hold a town meeting, which was as nonpolitical as I could make it for hundreds of people to tell me and the world through the media exactly what was happening here in Flint."
233,3-6-16,primary_dem,SANDERS,I think the fear and the legitimate fear of the people of Flint is that a certain point the TV cameras and CNN will disappear.
234,3-6-16,primary_dem,SANDERS,"[applause]

And people are going to be left struggling in order to live in a safe and healthy community."
235,3-6-16,primary_dem,SANDERS,"All I can say is if you check my record going back a long time, I have stood with those who are hurting."
236,3-6-16,primary_dem,SANDERS,"I have stood with those who have no money, and I have taken on virtually every powerful special interest in the United States of America."
237,3-6-16,primary_dem,SANDERS,That's my record and I'm proud of it.
238,3-6-16,primary_dem,COOPER," Thank you, Senator."
239,3-6-16,primary_dem,COOPER,"This city is also facing a jobs crisis, 75 percent of Flint's manufacturing jobs have been lost in the last 25 years and about the same amount of time, Michigan lost 230,000 manufacturing jobs."
240,3-6-16,primary_dem,COOPER,"I want to go to Tanisha Motron, she grew up in flint and now works in Detroit at the Shinola watch factory which as you know, is often held up as the blueprint for how to save American industry jobs."
241,3-6-16,primary_dem,COOPER,She says she's leaning towards secretary Clinton and has a question for her.
242,3-6-16,primary_dem,QUESTION, A lot of members work in the auto industry here in Flint.
243,3-6-16,primary_dem,QUESTION,"That's ultimately what I wanted to do when I got out of school unfortunately, I was unable to get any one of the big three and that's why I now reside at Shinola."
244,3-6-16,primary_dem,QUESTION,"If you are elected president, what are you going to do to in the United States instead of sending them overseas to other countries?"
245,3-6-16,primary_dem,COOPER, Secretary Clinton?
246,3-6-16,primary_dem,CLINTON, I'm going to do what I think will work which is both carrots and sticks.
247,3-6-16,primary_dem,CLINTON,Let me talk about the carrots.
248,3-6-16,primary_dem,CLINTON,We're going to have a very clear set of proposals and incentives for manufacturing so that we change the way that companies think about making investments again in America.
249,3-6-16,primary_dem,CLINTON,I have a comprehensive manufacturing plan that I will be implementing.
250,3-6-16,primary_dem,CLINTON,"We're also going to invest more on infrastructure as we both have said, ""it's woefully under resourced."""
251,3-6-16,primary_dem,CLINTON,That will put a lot of people to work.
252,3-6-16,primary_dem,CLINTON,"I want to do more to help small businesses, they are the source of two thirds of our jobs and we have to help them start and grow, particularly minority and women-owned small businesses."
253,3-6-16,primary_dem,CLINTON,We need to do more to help create clean energy as a source of good jobs but I am also going to go after companies.
254,3-6-16,primary_dem,CLINTON,"You know, when a company decides to leave like Nabisco is leaving and they have gotten tax benefits from Chicago and Illinois to stay there, I will claw back the benefits."
255,3-6-16,primary_dem,CLINTON,They will have to pay them back if they are leaving a place that actually invested in them.
256,3-6-16,primary_dem,CLINTON,I am also going to go after companies like Johnson Controls in Wisconsin.
257,3-6-16,primary_dem,CLINTON,They came and got part of the bailout because they were an auto parts supplier and now they want to move headquarters to Europe.
258,3-6-16,primary_dem,CLINTON,They are going to have to pay an exit fee.
259,3-6-16,primary_dem,CLINTON,We are going to stop this kind of job exporting and we are going to start importing and growing jobs again in our country.
260,3-6-16,primary_dem,COOPER," Senator sanders, I will let you..."
261,3-6-16,primary_dem,SANDERS," I am very glad, Anderson, that secretary Clinton discovered religion on this issue but it's a little bit too late."
262,3-6-16,primary_dem,SANDERS,Secretary Clinton supported virtually every one of the disastrous trade agreements written by corporate America.
263,3-6-16,primary_dem,SANDERS,"[applause]

NAFTA, supported by the Secretary cost, us 800,000 jobs nationwide, tens of thousands of jobs in the Midwest."
264,3-6-16,primary_dem,SANDERS,Permanent normal trade relations with China cost us millions of jobs.
265,3-6-16,primary_dem,SANDERS,"Look, I was on a picket line in early 1990's against NFATA because you didn't need a PhD in economics to understand that American workers should not be forced to compete against people in Mexico making 25 cents an hour."
266,3-6-16,primary_dem,SANDERS,[applause]
267,3-6-16,primary_dem,SANDERS," And the reason that I was one of the first, not one of the last to be in opposition to the TPP is that American workers...[applause]...should not be forced to compete against people in Vietnam today making a minimum wage of $0.65 an hour."
268,3-6-16,primary_dem,SANDERS,"Look, what we have got to do is tell corporate America that they cannot continue to shut down."
269,3-6-16,primary_dem,SANDERS,"We've lost 60,000 factories since 2001."
270,3-6-16,primary_dem,SANDERS,"They're going to start having to, if I'm president, invest in this country — not in China, not in Mexico."
271,3-6-16,primary_dem,COOPER, Secretary Clinton?
272,3-6-16,primary_dem,COOPER,[applause]
273,3-6-16,primary_dem,CLINTON," Well — well, I'll tell you something else that Senator Sanders was against."
274,3-6-16,primary_dem,CLINTON,He was against the auto bailout.
275,3-6-16,primary_dem,CLINTON,"In January of 2009, President-Elect Obama asked everybody in the Congress to vote for the bailout."
276,3-6-16,primary_dem,CLINTON,"The money was there, and had to be released in order to save the American auto industry and four million jobs, and to begin the restructuring."
277,3-6-16,primary_dem,CLINTON,We had the best year that the auto industry has had in a long time.
278,3-6-16,primary_dem,CLINTON,I voted to save the auto industry.
279,3-6-16,primary_dem,CLINTON,"[applause]

He voted against the money that ended up saving the auto industry."
280,3-6-16,primary_dem,CLINTON,I think that is a pretty big difference.
281,3-6-16,primary_dem,SANDERS," Well, I — If you are talking about the Wall Street bailout, where some of your friends destroyed this economy..."
282,3-6-16,primary_dem,CLINTON, You know...
283,3-6-16,primary_dem,SANDERS," ... through — excuse me, I'm talking."
284,3-6-16,primary_dem,COOPER, Let him [inaudible].
285,3-6-16,primary_dem,COOPER,"[applause]

[crosstalk]"
286,3-6-16,primary_dem,CLINTON," If you're gonna talk, tell the whole story, Senator Sanders."
287,3-6-16,primary_dem,SANDERS, Let me tell my story.
288,3-6-16,primary_dem,SANDERS,You tell yours.
289,3-6-16,primary_dem,CLINTON, I will.
290,3-6-16,primary_dem,SANDERS," Your story is for — voting for every disastrous trade agreement, and voting for corporate America."
291,3-6-16,primary_dem,SANDERS,Did I vote against the Wall Street bailout?
292,3-6-16,primary_dem,SANDERS,"When billionaires on Wall Street destroyed this economy, they went to Congress and they said, ""please, we'll be good boys, bail us out."""
293,3-6-16,primary_dem,SANDERS,You know what I said?
294,3-6-16,primary_dem,SANDERS,"I said, ""let the billionaires themselves bail out Wall Street."""
295,3-6-16,primary_dem,SANDERS,It shouldn't be the middle class of this country.
296,3-6-16,primary_dem,SANDERS,[applause]
297,3-6-16,primary_dem,CLINTON," OK, so..."
298,3-6-16,primary_dem,COOPER, Secretary Clinton?
299,3-6-16,primary_dem,SANDERS, Wait a minute.
300,3-6-16,primary_dem,SANDERS,Wait.
301,3-6-16,primary_dem,SANDERS,Could I finish?
302,3-6-16,primary_dem,SANDERS,"You'll have your turn, all right?"
303,3-6-16,primary_dem,SANDERS,"But ultimately, if you look at our records, I stood up to corporate America time and time again."
304,3-6-16,primary_dem,SANDERS,I went to Mexico.
305,3-6-16,primary_dem,SANDERS,I saw the lives of people who were working in American factories and making $0.25 an hour.
306,3-6-16,primary_dem,SANDERS,I understood that these trade agreements were going to destroy the middle class of this country.
307,3-6-16,primary_dem,SANDERS,I led the fight against us.
308,3-6-16,primary_dem,SANDERS,That is one of the major differences that we have.
309,3-6-16,primary_dem,COOPER, Secretary Clinton.
310,3-6-16,primary_dem,CLINTON," Well, if I — if I could...[applause]...to set the record straight, I voted against the only multinational trade agreement that came before me when I was in the Senate."
311,3-6-16,primary_dem,CLINTON,It was called CAFTA.
312,3-6-16,primary_dem,CLINTON,I came out against the TPP after it was finished.
313,3-6-16,primary_dem,CLINTON,I thought it was reasonable to actually know what was in it before I opposed it.
314,3-6-16,primary_dem,CLINTON,I oppose it.
315,3-6-16,primary_dem,CLINTON,"[applause]

Now let me get back to what happened in January of 2009."
316,3-6-16,primary_dem,CLINTON,The Bush administration negotiated the deal.
317,3-6-16,primary_dem,CLINTON,Were there things in it that I didn't like?
318,3-6-16,primary_dem,CLINTON,Would I have done it differently?
319,3-6-16,primary_dem,CLINTON,Absolutely.
320,3-6-16,primary_dem,CLINTON,But was the auto bailout money in it — the $350 billion that was needed to begin the restructuring of the auto industry?
321,3-6-16,primary_dem,CLINTON,"Yes, it was."
322,3-6-16,primary_dem,CLINTON,"So when I talk about Senator Sanders being a one-issue candidate, I mean very clearly — you have to make hard choices when you're in positions of responsibility."
323,3-6-16,primary_dem,CLINTON,"The two senators from Michigan stood on the floor and said, ""we have to get this money released."""
324,3-6-16,primary_dem,CLINTON,"I went with them, and I went with Barack Obama."
325,3-6-16,primary_dem,CLINTON,You did not.
326,3-6-16,primary_dem,CLINTON,"If everybody had voted the way he did, I believe the auto industry would have collapsed, taking four million jobs with it."
327,3-6-16,primary_dem,CLINTON,[applause]
328,3-6-16,primary_dem,COOPER, Senator Sanders?
329,3-6-16,primary_dem,SANDERS," I believe that the recklessness, the greed, and the illegal behavior of Wall Street drove this country into the worst economic downturn in the history of the United — modern history of the United States of America."
330,3-6-16,primary_dem,SANDERS,And I will be damned if it was the working people of this country who had to bail out the crooks on Wall Street.
331,3-6-16,primary_dem,SANDERS,"[applause]

And what I proposed — and I had an amendment that was defeated — it was defeated by a voice vote on the floor of the Senate — that said to those people on the top who benefited from Wall Street greed — I said, ""you pay for the bailout."
332,3-6-16,primary_dem,SANDERS,"Don't go to my constituents, who are struggling to make ends meet."""
333,3-6-16,primary_dem,SANDERS,"In terms of the auto bailout, of course that made sense."
334,3-6-16,primary_dem,SANDERS,"In terms of the stimulus package, of course that made sense, and I strongly supported President Obama's position on that."
335,3-6-16,primary_dem,SANDERS,"But let us be clear, one of the major issues Secretary Clinton says I'm a one-issue person, well, I guess so."
336,3-6-16,primary_dem,SANDERS,My one issue is trying to rebuild a disappearing middle class.
337,3-6-16,primary_dem,SANDERS,That's my one issue.
338,3-6-16,primary_dem,SANDERS,[applause]
339,3-6-16,primary_dem,COOPER, Senator Sanders...
340,3-6-16,primary_dem,CLINTON," Well, all I can say is that given the terrible pressures that the auto industry was under and that the middle class of this state and Ohio and Indiana and Illinois and Wisconsin and Missouri and other places in the Midwest were facing, I think it was the right decision to heed what President-elect Obama asked us to do."
341,3-6-16,primary_dem,CLINTON,"He sent a letter, an authorized letter, asking us to support that to save the auto industry."
342,3-6-16,primary_dem,CLINTON,"Yes, were there things in it that you and I would not have necessarily wanted?"
343,3-6-16,primary_dem,CLINTON,That's true.
344,3-6-16,primary_dem,CLINTON,"But when it came down to it, you were either for saving the auto industry or you were against it."
345,3-6-16,primary_dem,CLINTON,I voted to save the auto industry.
346,3-6-16,primary_dem,CLINTON,And I am very glad that I did.
347,3-6-16,primary_dem,CLINTON,[applause]
348,3-6-16,primary_dem,SANDERS," Let me just say this, while we are on Wall Street, one of us has a super PAC."
349,3-6-16,primary_dem,SANDERS,One of us has raised $15 million from Wall Street for that super PAC.
350,3-6-16,primary_dem,SANDERS,One of us has given speeches on Wall Street for hundreds of thousands of dollars.
351,3-6-16,primary_dem,SANDERS,"Now, I kind of think if you get paid a couple hundred thousand dollars for a speech, it must be a great speech."
352,3-6-16,primary_dem,SANDERS,I think we should release it and let the American people see what that transcript was.
353,3-6-16,primary_dem,SANDERS,[applause]
354,3-6-16,primary_dem,CLINTON," And I have said and I will say again, I will be happy to release anything I have as long as everybody else does too, because what really is behind that question, Republicans and Democrats, is where I can stand up to Wall Street."
355,3-6-16,primary_dem,CLINTON,"Well, let's have some facts instead of some rhetoric for a change."
356,3-6-16,primary_dem,CLINTON,I went to Wall Street when I was a United States senator.
357,3-6-16,primary_dem,CLINTON,I told them they were wrecking the economy.
358,3-6-16,primary_dem,CLINTON,I asked for a moratorium on foreclosures.
359,3-6-16,primary_dem,CLINTON,I asked that we do more to try to prevent what I worried was going to happen.
360,3-6-16,primary_dem,CLINTON,I also called for closing loopholes including the carried interest loophole.
361,3-6-16,primary_dem,CLINTON,I also called for changes in CEO pay.
362,3-6-16,primary_dem,CLINTON,I have a record.
363,3-6-16,primary_dem,CLINTON,"And you know what, if you were going to be in some way distrusted or dismissed about whether you can take on Wall Street if you ever took money, President Obama took more money from Wall Street in the 2008 campaign than anybody ever had."
364,3-6-16,primary_dem,CLINTON,"And when it came time to stand up to Wall Street, he passed and signed the toughest regulation since the Great Depression with the Dodd-Frank regulations."
365,3-6-16,primary_dem,COOPER," Senator Sanders, just yesterday, in fact, you said just — I believe it was yesterday you said not only her speech must have been a fantastic speech, it must have been a Shakespearean speech for that amount of money."
366,3-6-16,primary_dem,COOPER,Is her answer enough for you that she will release it when all the Republicans and Democrats do?
367,3-6-16,primary_dem,SANDERS," All right, look, Secretary Clinton wants everybody else to release it, well, I'm your Democratic opponent, I release it, here it is."
368,3-6-16,primary_dem,SANDERS,There ain't nothing.
369,3-6-16,primary_dem,SANDERS,"I don't give speeches to Wall Street for hundreds of thousands of dollars, you got it."
370,3-6-16,primary_dem,SANDERS,"Second of all, when we talk about being tough on Wall Street, and this galls me and the American people."
371,3-6-16,primary_dem,SANDERS,"Recently Goldman Sachs, among many other major financial institutions on Wall Street, as you know, reached a settlement with the federal government for $5 billion because they were selling worthless packages of subprime mortgages, $5 billion settlement."
372,3-6-16,primary_dem,SANDERS,"You know how many people, executives on Wall Street have gone to jail?"
373,3-6-16,primary_dem,SANDERS,"If you are a kid caught with marijuana in Michigan, you get a police record."
374,3-6-16,primary_dem,SANDERS,"If you are an executive on Wall Street that destroys the American economy, you pay a $5 billion fine, no police record."
375,3-6-16,primary_dem,SANDERS,"If I am elected president, we are going to bring justice back to a broken criminal justice system."
376,3-6-16,primary_dem,SANDERS,[applause]
377,3-6-16,primary_dem,COOPER, Secretary Clinton?
378,3-6-16,primary_dem,CLINTON," Well, I think we are in vigorous agreement on this."
379,3-6-16,primary_dem,CLINTON,"I have said repeatedly no bank is too big to fail, no executive too powerful to jail."
380,3-6-16,primary_dem,CLINTON,"And I have said that I would use the tools in the Dodd-Frank regulations, that if any bank posed a systemic risk to the economy, they would be broken up."
381,3-6-16,primary_dem,CLINTON,"Because we now have tools, laws that we didn't have before."
382,3-6-16,primary_dem,CLINTON,And I am very happy we did.
383,3-6-16,primary_dem,CLINTON,"Because there does need to be accountability, including criminal accountability if it is called for."
384,3-6-16,primary_dem,COOPER," Senator Sanders, I just want to show the audience, you sent a tweet, I want to return to trade."
385,3-6-16,primary_dem,COOPER,"You sent a tweet on Thursday, this is the tweet, I'm showing it to viewers."
386,3-6-16,primary_dem,COOPER,It says the people of Detroit know the real costs of Hillary Clinton's free trade policies.
387,3-6-16,primary_dem,COOPER,It shows pictures of crumbling buildings.
388,3-6-16,primary_dem,COOPER,It seems like you're blaming her for the situation in Detroit.
389,3-6-16,primary_dem,SANDERS," Well, I'm blaming the trade policies."
390,3-6-16,primary_dem,SANDERS,You know what?
391,3-6-16,primary_dem,SANDERS,"This is an amazing thing which I didn't know until recently, and I wonder how many people did know this."
392,3-6-16,primary_dem,COOPER," But, you're calling them Hillary Clinton's failed trade policies."
393,3-6-16,primary_dem,SANDERS," Well, Hillary Clinton, and everybody else who supported these disastrous trade policies."
394,3-6-16,primary_dem,SANDERS,She wasn't alone.
395,3-6-16,primary_dem,SANDERS,"We have many, many Republicans and far too many Democrats who supported these disastrous trade policies."
396,3-6-16,primary_dem,SANDERS,Do you know...[applause]... Do you know that in 1960 Detroit Michigan was one of the wealthiest cities in America?
397,3-6-16,primary_dem,SANDERS,"Flint, Michigan was a prosperous city, but then what happened is corporate America said why do I want to pay somebody in Michigan a living wage when I can pay slave wages in Mexico or China?"
398,3-6-16,primary_dem,SANDERS,"We're going to shut down, we're going to move abroad, we're going to bring those products back into this country."
399,3-6-16,primary_dem,SANDERS,"Those trade policies, as much as any other set of policies, has resulted in the shrinking of the American middle class."
400,3-6-16,primary_dem,SANDERS,"And, I'll tell you what else it did."
401,3-6-16,primary_dem,SANDERS,"It's not only job loss by the millions, it is the race to the bottom so that new jobs in manufacturing, in some cases today, pay 50 percent less than they did 20 years ago."
402,3-6-16,primary_dem,SANDERS,How stupid is that trade policy?
403,3-6-16,primary_dem,SANDERS,[applause]
404,3-6-16,primary_dem,COOPER, Secretary Clinton?
405,3-6-16,primary_dem,CLINTON," You know, if we're going to argue about the 1990's instead of talking about the future, which I'd much prefer because I think every election is about the future, and you all deserve to know what we will do to help you have a brighter future — but, if we are going to talk about the 1990's I think it's only fair to say that at the end of the 1990's, after two terms of my husband's presidency, the unemployment rate in Michigan was 4.4 percent."
406,3-6-16,primary_dem,CLINTON,"There had been a net increase of 54,000 manufacturing jobs."
407,3-6-16,primary_dem,CLINTON,"There had been a net increase of 653,000 jobs overall."
408,3-6-16,primary_dem,CLINTON,"And, one of the ways jobs were brought to, and grown here in Michigan was through something called the Export-Import Bank which helped a lot of businesses, particularly small businesses, be able to export around the world."
409,3-6-16,primary_dem,CLINTON,Senator Sanders opposes that.
410,3-6-16,primary_dem,CLINTON,I think we're in a race for exports.
411,3-6-16,primary_dem,CLINTON,"I think China, Germany, everybody else supports their businesses."
412,3-6-16,primary_dem,CLINTON,"Here in Michigan there's been $11 billion dollars in recent years used to support exports, primarily from small businesses."
413,3-6-16,primary_dem,CLINTON,"I favor that, he's opposed it."
414,3-6-16,primary_dem,CLINTON,I want to do everything I can for us to compete and win in the global economy...
415,3-6-16,primary_dem,COOPER, ...
416,3-6-16,primary_dem,COOPER,Senator Sanders...
417,3-6-16,primary_dem,CLINTON, ... and that's what I will do as president...
418,3-6-16,primary_dem,COOPER, ...
419,3-6-16,primary_dem,COOPER,"I just want to explain to viewers what the Export- Import Bank is, in case everybody is not quite as wonkish as everybody on this stage here."
420,3-6-16,primary_dem,COOPER,"The Export-Import Bank, it's a federal agency, it gives loans to companies that export American products."
421,3-6-16,primary_dem,COOPER,"Senator Sanders, you do oppose it."
422,3-6-16,primary_dem,COOPER,"The vast majority of the bank's customers are small businesses, 176 right here in Michigan."
423,3-6-16,primary_dem,COOPER,What do you say to small business owners....
424,3-6-16,primary_dem,SANDERS, ...
425,3-6-16,primary_dem,SANDERS,I'll tell you what I say...
426,3-6-16,primary_dem,COOPER, ... Who rely on the banks to make their company profitable...
427,3-6-16,primary_dem,SANDERS, ...
428,3-6-16,primary_dem,SANDERS,I'll tell you what I say.
429,3-6-16,primary_dem,SANDERS,Do you know what the other name of the Export-Import Bank is?
430,3-6-16,primary_dem,SANDERS,What it's called in Washington?
431,3-6-16,primary_dem,SANDERS,It's called the bank of Boeing because Boeing itself gets 40 percent of the money discharged by the Export-Import Bank.
432,3-6-16,primary_dem,SANDERS,"Seventy-Five percent of the funds going from the federal government, the Export-Import Bank, goes to large, profitable corporations."
433,3-6-16,primary_dem,SANDERS,"Many of these corporations have shut down in America, and have gone abroad to exploit poor people."
434,3-6-16,primary_dem,SANDERS,You know what?
435,3-6-16,primary_dem,SANDERS,I don't think it's a great idea for the American taxpayer to have to subsidize through corporate welfare profitable corporations who downsize in the United States of America.
436,3-6-16,primary_dem,COOPER, Senator...
437,3-6-16,primary_dem,SANDERS, ... Seventy-Five percent of that money goes to large profitable corporations.
438,3-6-16,primary_dem,COOPER," Senator Sanders, you are the only member of the Democratic caucus to vote against it."
439,3-6-16,primary_dem,COOPER,"You're agreeing with Senator Ted Cruz on this, why is he right and the Democrats wrong?"
440,3-6-16,primary_dem,SANDERS," Well, let me tell you, I don't want to break the bad news."
441,3-6-16,primary_dem,SANDERS,"[laughter]

Democrats are not always right."
442,3-6-16,primary_dem,SANDERS,"Democrats have often supported corporate welfare...[applause]...Democrats have supported disastrous trade agreements, but on this issue I do not believe in corporate welfare, and in fact, secretary Clinton may know or not know, but as a member of the Financial Services Committee, I worked hard and successfully to make sure that at least 20 percent of the money went to small businesses which is where it should go and not to profitable corporations and downsizing in our country."
443,3-6-16,primary_dem,COOPER, Secretary Clinton?
444,3-6-16,primary_dem,CLINTON," When I traveled around the world on you behalf as Secretary of State and went to 112 countries, one thing I saw everywhere was how European and Asian countries were supporting their companies back in their countries, to be able to make sales and contracts in a lot of the rest of the world."
445,3-6-16,primary_dem,CLINTON,"In fact, without the export-import bank, supporting businesses of all sizes — I believe more jobs would be lost here at home and more jobs literally would be exported."
446,3-6-16,primary_dem,CLINTON,"Instead of exporting products, we would be exporting jobs."
447,3-6-16,primary_dem,CLINTON,I just believe that Senator Sanders took that lonely position because most of us who saw the results — I saw it as a senator from New York.
